input_utterance,utterance_template,intent,seed_id,source,paraphrase_value,paraphrase_template,bertscore,ted,duplicate,semantics,selected_templates_related_paraphrases,ted_to_selected_templates,_is_similar
Play a 1964 track from Shahram Nazeri on Pandora.,( S ( VP ( VB ) ( NP ) ) ( . ) ),PlayMusic,34,SNIPS,Please start playing a song performed by Shahram Nazari in 1964 on Pandora.,( S ( NP ( UH ) ) ( VP ( VB ) ( S ) ) ( . ) ),0.93417674,3.0,False,True,"['Retrieve a selection of attractive photos that are similar to Opera House and have a resolution of 1024 pixels by 768 pixels', 'Can you tell me the least expensive one-way fare from Boston to Baltimore?']","{'( S ( VP ( VB ) ( NP ) ) )': 4.0, '( SQ ( MD ) ( NP ( PRP ) ) ( VP ( VB ) ( NP ) ( NP ) ) ( . ) )': 5.0}",False
Please play me some Satire music,( S ( X ( UH ) ) ( VP ( VB ) ( NP ) ( NP ) ) ),PlayMusic,35,SNIPS,I'm in the mood for some satirical tunes. Can you help me find them?,( S ( NP ( PRP ) ) ( VP ( VP ) ( . ) ( SQ ) ) ( . ) ),0.8766739,6.0,False,True,"['include this musician called Kirk Hammett in my playlist Party', 'Can you tell me the current temperature in Pesotum?']","{'( S ( VP ( VB ) ( NP ) ) )': 6.0, '( SQ ( MD ) ( NP ( PRP ) ) ( VP ( VB ) ( NP ) ( NP ) ) ( . ) )': 5.0}",False
When is Crime and Punishment U.S.A. showing?,( SBARQ ( WHADVP ( WRB ) ) ( SQ ( VBZ ) ( NP ) ( VP ) ) ( . ) ),SearchScreeningEvent,36,SNIPS,Could you tell me when the movie Crime and Punishment U.S.A. is playing?,( SQ ( MD ) ( NP ( PRP ) ) ( VP ( VB ) ( NP ) ( SBAR ) ) ( . ) ),0.89694464,7.0,False,True,"['include Kirk Hammett in my Party playlist', 'can you give me the forecast for cooler temperatures in Anston?']","{'( S ( VP ( VB ) ( NP ) ) )': 6.0, '( SQ ( MD ) ( NP ( PRP ) ) ( VP ( VB ) ( NP ) ( NP ) ) ( . ) )': 1.0}",True
find Fox Theatres with The Caretaker,( S ( VP ( VB ) ( NP ) ( PP ) ) ),SearchScreeningEvent,37,SNIPS,discover theaters playing the movie called 'The Caretaker' such as Fox Theater,( S ( VP ( VB ) ( NP ) ) ),0.88499916,1.0,False,True,"['Discover the most popular pictures with the hashtag #LOVE', 'Can you find me a pub with Italian dressing where I can host a party for 5 people on February 11, 2033?']","{'( S ( VP ( VB ) ( NP ) ) )': 0.0, '( SQ ( MD ) ( NP ( PRP ) ) ( VP ( VB ) ( NP ) ( NP ) ) ( . ) )': 6.0}",True
I would like to watch The Wedding Ring at the movie theatre,( S ( NP ( PRP ) ) ( VP ( MD ) ( VP ) ) ),SearchScreeningEvent,38,SNIPS,"Where can I go to see the movie called The Weddinng ring, please?",( SBARQ ( WHADVP ( WRB ) ) ( SQ ( MD ) ( NP ) ( VP ) ) ( . ) ),0.8760658,6.0,False,True,"['locate Fox Theatres showing The Caretaker', 'Can you tell me the weather forecast for Anston in colder temperatures?']","{'( S ( VP ( VB ) ( NP ) ) )': 7.0, '( SQ ( MD ) ( NP ( PRP ) ) ( VP ( VB ) ( NP ) ( NP ) ) ( . ) )': 7.0}",False
I want to read the book The Lion Sleeps Tonight,( S ( NP ( PRP ) ) ( VP ( VBP ) ( S ) ) ),SearchCreativeWork,39,SNIPS,"May I have access to The Lion Sleeps Thonight book's text, please?","( SQ ( MD ) ( NP ( PRP ) ) ( VP ( VB ) ( NP ) ( , ) ( INTJ ) ) ( . ) )",0.8931964,7.0,False,True,"['find places where I can access Join the Dots: B-sides and Rarities', 'Can you show me The Wedding Ring movie playing at the cinema?']","{'( S ( VP ( VB ) ( NP ) ) )': 7.0, '( SQ ( MD ) ( NP ( PRP ) ) ( VP ( VB ) ( NP ) ( NP ) ) ( . ) )': 2.0}",True
Where can I buy a used copy of the game called I Lie Around?,( SBARQ ( WHADVP ( WRB ) ) ( SQ ( MD ) ( NP ) ( VP ) ) ( . ) ),SearchCreativeWork,41,SNIPS,I'm interested in buying an older copy of the card game called Lying Around. Where might it be available for purchase?,( S ( NP ( PRP ) ) ( VP ( VBP ) ( ADJP ) ) ( . ) ( SBARQ ( WHADVP ) ( SQ ) ) ( . ) ),0.9168254,11.0,False,True,"['include this musician named Kirk Hammett in my Party playlist', 'Can you tell me the current weather in Pesotum?']","{'( S ( VP ( VB ) ( NP ) ) )': 9.0, '( SQ ( MD ) ( NP ( PRP ) ) ( VP ( VB ) ( NP ) ( NP ) ) ( . ) )': 9.0}",False
please give me the cheapest flight from denver to pittsburgh,( S ( X ( UH ) ) ( VP ( VB ) ( NP ) ( NP ) ) ),flight,42,ATIS,How do I find low-cost tickets for traveling between these two cities: denver and pittsburgh,( SBARQ ( WHADVP ( WRB ) ) ( SQ ( VBP ) ( NP ) ( VP ) ) ),0.91545504,6.0,False,True,"['Find the top-rated photos labeled with #LOVE', 'Can you find me the least expensive ticket for a one-way trip from Boston to Baltimore?']","{'( S ( VP ( VB ) ( NP ) ) )': 6.0, '( SQ ( MD ) ( NP ( PRP ) ) ( VP ( VB ) ( NP ) ( NP ) ) ( . ) )': 8.0}",False
i want to fly from milwaukee to orlando on either wednesday evening or thursday morning,( S ( NP ( PRP ) ) ( VP ( VBP ) ( S ) ) ),flight,43,ATIS,"Could you assist me in finding a way to get from Milwaukee to Orlando? Ideally, it would be on either Wednesday night or Thursday morning.","( S ( SQ ( MD ) ( NP ) ( VP ) ) ( . ) ( ADVP ( RB ) ) ( , ) ( NP ( PRP ) ) ( VP ( MD ) ( VP ) ) ( . ) )",0.9036212,11.0,False,True,"['find showtimes for the movie The Caretaker at Fox Theatres', ""Can you show me the ratings for McDonald's on Kensington street?""]","{'( S ( VP ( VB ) ( NP ) ) )': 13.0, '( SQ ( MD ) ( NP ( PRP ) ) ( VP ( VB ) ( NP ) ( NP ) ) ( . ) )': 11.0}",False
what is the lowest fare from denver to pittsburgh,( SBAR ( WHNP ( WP ) ) ( S ( VP ) ) ),airfare,44,ATIS,What is the cheapest price for a flight from Denver to Pittsburgh?,( SBARQ ( WHNP ( WP ) ) ( SQ ( VP ) ) ( . ) ),0.9158726,3.0,False,True,"['locate Fox Theatres that show The Caretaker', 'Can you tell me the current temperature in Pesotum?']","{'( S ( VP ( VB ) ( NP ) ) )': 6.0, '( SQ ( MD ) ( NP ( PRP ) ) ( VP ( VB ) ( NP ) ( NP ) ) ( . ) )': 8.0}",False
what is the cheapest one way fare from boston to baltimore,( SBARQ ( WHNP ( WP ) ) ( S ( VP ) ) ),airfare,45,ATIS,Provide me with information on the cheapest fare offered for a single-trip travel route between Boston and Baltimore.,( S ( VP ( VB ) ( NP ) ( PP ) ) ( . ) ),0.89223236,6.0,False,True,"['find showings of The Caretaker at Fox Theatres', 'Could you show me 5 conference articles on the topic of text mining?']","{'( S ( VP ( VB ) ( NP ) ) )': 2.0, '( SQ ( MD ) ( NP ( PRP ) ) ( VP ( VB ) ( NP ) ( NP ) ) ( . ) )': 5.0}",True
what is the ground transportation from oakland to san francisco,( SBARQ ( WHNP ( WP ) ) ( S ( VP ) ) ),ground_service,46,ATIS,tell me about the ground transportation options from Oakland to San Francisco,( S ( VP ( VB ) ( NP ) ( PP ) ) ),0.9077712,5.0,False,True,"['include this musician called Kirk Hammett in my Party playlist', 'Can you tell me the current temperature in Pesotum?']","{'( S ( VP ( VB ) ( NP ) ) )': 1.0, '( SQ ( MD ) ( NP ( PRP ) ) ( VP ( VB ) ( NP ) ( NP ) ) ( . ) )': 6.0}",True
can i get a rental car in dallas,( SQ ( MD ) ( NP ( PRP ) ) ( VP ( VB ) ( NP ) ( PP ) ) ),ground_service,47,ATIS,Do you know where I can rent a vehicle when I'm visiting Dallas?,( SQ ( VBP ) ( NP ( PRP ) ) ( VP ( VB ) ( SBAR ) ) ( . ) ),0.883982,4.0,False,True,"['Retrieve 5 conference articles that discuss text mining', 'Can you show me five conference articles regarding text mining?']","{'( S ( VP ( VB ) ( NP ) ) )': 6.0, '( SQ ( MD ) ( NP ( PRP ) ) ( VP ( VB ) ( NP ) ( NP ) ) ( . ) )': 3.0}",True
what airlines fly between boston and atlanta,( SBAR ( WHNP ( WP ) ) ( S ( NP ) ( VP ) ) ),airline,48,ATIS,give me a list of the airlines that offer flights from Boston to Atlanta,( S ( VP ( VB ) ( NP ) ( NP ) ) ),0.88207304,4.0,False,True,"['locate Fox Theatres that are showing The Caretaker', 'Can you find me a pub with Italian dressing where I can host a party for 5 people on February 11, 2033?']","{'( S ( VP ( VB ) ( NP ) ) )': 1.0, '( SQ ( MD ) ( NP ( PRP ) ) ( VP ( VB ) ( NP ) ( NP ) ) ( . ) )': 5.0}",True
show me the airlines between boston and denver,( S ( VP ( VB ) ( S ) ) ),airline,49,ATIS,present me with a compilation of air carriers serving the route from boston to denver,( S ( VP ( VB ) ( NP ) ( PP ) ) ),0.93411577,2.0,False,True,"['Find videos on how to cook', ""Could you give me some information about the customer reviews of McDonald's on Kensington St?""]","{'( S ( VP ( VB ) ( NP ) ) )': 1.0, '( SQ ( MD ) ( NP ( PRP ) ) ( VP ( VB ) ( NP ) ( NP ) ) ( . ) )': 6.0}",True
what does ls stand for,( SBARQ ( WHNP ( WP ) ) ( SQ ( VBZ ) ( NP ) ( VP ) ) ),abbreviation,50,ATIS,What is the full form of ls?,( SBARQ ( WHNP ( WP ) ) ( SQ ( SQ ) ) ( . ) ),0.8621808,4.0,False,True,"['list all the airlines that have flights from boston to atlanta', 'Can you tell me the current temperature in Pesotum?']","{'( S ( VP ( VB ) ( NP ) ) )': 6.0, '( SQ ( MD ) ( NP ( PRP ) ) ( VP ( VB ) ( NP ) ( NP ) ) ( . ) )': 8.0}",False
what does dfw mean,( SBARQ ( WHNP ( WP ) ) ( SQ ( VBZ ) ( NP ) ( VP ) ) ),abbreviation,51,ATIS,What is the interpretation of DFW acronym?,( SBARQ ( WHNP ( WP ) ) ( SQ ( VBZ ) ( NP ) ) ( . ) ),0.89776963,2.0,False,True,"['find places where I can access Join the Dots: B-sides and Rarities', 'Can you tell me the current temperature in Pesotum?']","{'( S ( VP ( VB ) ( NP ) ) )': 6.0, '( SQ ( MD ) ( NP ( PRP ) ) ( VP ( VB ) ( NP ) ( NP ) ) ( . ) )': 7.0}",False
What is the forecast for Harrison-Crawford State Forest,( SBARQ ( WHNP ( WP ) ) ( S ( VP ) ) ),GetWeather,21,SNIPS,Do you have any information on the expected forecast for Harrison-Crawford State Forest?,( SQ ( VBP ) ( NP ( PRP ) ) ( VP ( VB ) ( NP ) ) ( . ) ),0.9368746,7.0,False,True,"['display the flights operating between Boston and Denver', 'Can you tell me the distance of the closest cab?']","{'( S ( VP ( VB ) ( NP ) ) )': 5.0, '( SQ ( MD ) ( NP ( PRP ) ) ( VP ( VB ) ( NP ) ( NP ) ) ( . ) )': 2.0}",True
find Join the Dots: B-sides and Rarities,( S ( VP ( VB ) ( S ) ) ),SearchCreativeWork,40,SNIPS,Retrieve information about Join the Dots: B-Sides & Rarities compilation,( S ( VP ( VB ) ( NP ) ) ),0.92222476,1.0,False,True,"['Find videos about cooking', ""Can you give me the reviews for the McDonald's located at Kensington st.?""]","{'( S ( VP ( VB ) ( NP ) ) )': 0.0, '( SQ ( MD ) ( NP ( PRP ) ) ( VP ( VB ) ( NP ) ( NP ) ) ( . ) )': 6.0}",True
Terminate i-a541 now,( S ( VP ( VB ) ( NP ) ( ADVP ) ) ),EndEC2Instance,1,ParaQuality,End the i-a541 immediately.,( S ( VP ( VB ) ( NP ) ( ADVP ) ) ( . ) ),0.9460475,1.0,False,True,"['Find the trending photos tagged as #LOVE', 'Can you tell me the cheapest price for a flight from Denver to Pittsburgh?']","{'( S ( VP ( VB ) ( NP ) ) )': 2.0, '( SQ ( MD ) ( NP ( PRP ) ) ( VP ( VB ) ( NP ) ( NP ) ) ( . ) )': 5.0}",True
Search for cooking videos,( NP ( NP ( VB ) ) ( PP ( IN ) ( NP ) ) ),SearchWeb,2,ParaQuality,Find video guides on food preparation,( S ( VP ( VB ) ( NP ) ) ),0.9105902,4.0,False,True,"['locate Fox Theatres featuring The Caretaker', 'Can you find me a copy of The Lion Sleeps Tonight book?']","{'( S ( VP ( VB ) ( NP ) ) )': 0.0, '( SQ ( MD ) ( NP ( PRP ) ) ( VP ( VB ) ( NP ) ( NP ) ) ( . ) )': 6.0}",True
Find most popular photos tagged #LOVE,( S ( S ( VP ) ) ( VP ( VBP ) ) ),SearchWeb,3,ParaQuality,Explore highly rated photographs marked with #LOVE tag,( S ( VP ( VB ) ( NP ) ) ),0.92539346,3.0,False,True,"['Find videos about cooking', 'Can you show me The Wedding Ring movie playing at the cinema?']","{'( S ( VP ( VB ) ( NP ) ) )': 0.0, '( SQ ( MD ) ( NP ( PRP ) ) ( VP ( VB ) ( NP ) ( NP ) ) ( . ) )': 6.0}",True
Search for a few nice photos matching Opera House with size 1024px * 768px,( NP ( NP ( VB ) ) ( PP ( IN ) ( NP ) ) ),SearchWeb,4,ParaQuality,Can you find me some visually pleasing photos featuring the well-known architectural masterpiece known as The Sydney opera house? They should be precisely sized at one thousand twenty-four pixel-width multiplied by seven hundred sixty-eight pixel-height?,( SQ ( MD ) ( NP ( PRP ) ) ( VP ( VB ) ( NP ) ( S ) ) ( . ) ),0.838889,6.0,False,True,"['list all the airlines that have flights from boston to atlanta', 'Can you find me a pub that serves Italian dressing for a group of 5 people on February 11, 2033?']","{'( S ( VP ( VB ) ( NP ) ) )': 5.0, '( SQ ( MD ) ( NP ( PRP ) ) ( VP ( VB ) ( NP ) ( NP ) ) ( . ) )': 1.0}",True
Are the burglar alarms in the office malfunctioning ?,( SQ ( VBP ) ( NP ( DT ) ( NN ) ( NNS ) ) ( PP ( IN ) ( NP ) ) ( VP ( VBG ) ) ( . ) ),CheckDevice,5,ParaQuality,Have we encountered any errors or issues regarding our intruder alert system at work premises lately for some reason ?,( SQ ( VBP ) ( NP ( PRP ) ) ( VP ( VBN ) ( NP ) ( ADVP ) ( PP ) ) ( . ) ),0.87948173,9.0,False,True,"['display the airlines that operate flights between Boston and Denver', 'Can you tell me the weather forecast for Harrison-Crawford State Forest?']","{'( S ( VP ( VB ) ( NP ) ) )': 8.0, '( SQ ( MD ) ( NP ( PRP ) ) ( VP ( VB ) ( NP ) ( NP ) ) ( . ) )': 4.0}",False
Is the TV in the house off ?,( SQ ( VBZ ) ( NP ( DT ) ( NN ) ) ( PP ( IN ) ( NP ) ) ( PRT ( RP ) ) ( . ) ),CheckDevice,6,ParaQuality,Is there a lack of power going to that TV indoors right now?,( SQ ( VBZ ) ( NP ( EX ) ) ( NP ( NP ) ( PP ) ) ( VP ( VBG ) ( PP ) ( ADVP ) ( ADVP ) ) ( . ) ),0.87681735,10.0,False,True,"['Discover culinary videos', 'Can you find me the least expensive ticket for a one-way trip from Boston to Baltimore?']","{'( S ( VP ( VB ) ( NP ) ) )': 12.0, '( SQ ( MD ) ( NP ( PRP ) ) ( VP ( VB ) ( NP ) ( NP ) ) ( . ) )': 9.0}",False
Any suggestions for an inexpensive hotel near Seattle for tomorrow for 2,( NP ( NP ( DT ) ( NNS ) ) ( PP ( IN ) ( NP ) ) ),FindHotel,7,ParaQuality,Where can I find a cost-effective place to stay near Seattle starting from the next day? It needs to be able to host 2 individuals.,( S ( SBARQ ( WHADVP ) ( SQ ) ( . ) ) ( NP ( PRP ) ) ( VP ( VBZ ) ( S ) ) ( . ) ),0.87780523,11.0,False,True,"['Retrieve 5 conference articles that discuss text mining', 'Can you tell me the cheapest price for a flight from Denver to Pittsburgh?']","{'( S ( VP ( VB ) ( NP ) ) )': 9.0, '( SQ ( MD ) ( NP ( PRP ) ) ( VP ( VB ) ( NP ) ( NP ) ) ( . ) )': 8.0}",False
Are there any cheap hotels for 7-day stay somewhere near Riverside,( SQ ( VBP ) ( NP ( EX ) ) ( NP ( NP ) ( PP ) ) ( ADVP ( RB ) ( IN ) ( NP ) ) ),FindHotel,8,ParaQuality,Could you assist me in finding affordable accommodation options that can cater to my week-long stay around the vicinity of Riverside?,( SQ ( MD ) ( NP ( PRP ) ) ( VP ( VB ) ( NP ) ( PP ) ) ( . ) ),0.89990515,8.0,False,True,"['list all the airlines that have flights from boston to atlanta', 'Can you find me the most recent scientific paper about Machine Learning?']","{'( S ( VP ( VB ) ( NP ) ) )': 6.0, '( SQ ( MD ) ( NP ( PRP ) ) ( VP ( VB ) ( NP ) ( NP ) ) ( . ) )': 1.0}",True
Send an email to Phil telling her that ''I got you'',( S ( VP ( VB ) ( NP ) ( PP ) ) ( '' ) ( '' ) ),SendMail,9,ParaQuality,"Transmit the following content through email: 'You don't have anything to worry about', addressed for Phil","( S ( S ( VP ) ) ( : ) ( `` ) ( S ( NP ) ( VP ) ) ( '' ) ( , ) ( S ( VP ) ) )",0.85901487,7.0,False,True,"['display the flights operating between Boston and Denver', 'Can you find me the most recent scientific publication about Machine Learning?']","{'( S ( VP ( VB ) ( NP ) ) )': 8.0, '( SQ ( MD ) ( NP ( PRP ) ) ( VP ( VB ) ( NP ) ( NP ) ) ( . ) )': 10.0}",False
Give me 5 conference articles about text mining,( S ( VP ( VB ) ( NP ) ( NP ) ) ),FindArticles,10,ParaQuality,Can you show me five academic conference papers that cover the subject of analyzing texts?,( SQ ( MD ) ( NP ( PRP ) ) ( VP ( VB ) ( NP ) ( NP ) ) ( . ) ),0.8896997,5.0,False,True,"['provide a list of airlines connecting Boston and Denver', 'Can you find me the book called The Lion Sleeps Tonight to read?']","{'( S ( VP ( VB ) ( NP ) ) )': 6.0, '( SQ ( MD ) ( NP ( PRP ) ) ( VP ( VB ) ( NP ) ( NP ) ) ( . ) )': 0.0}",True
I am looking for the latest scientific article related to Machine Learning,( S ( NP ( PRP ) ) ( VP ( VBP ) ( VP ) ) ),FindArticles,11,ParaQuality,I want to find the most current scientific article relating to Machine Learning.,( S ( NP ( PRP ) ) ( VP ( VBP ) ( S ) ) ( . ) ),0.9230421,2.0,False,True,"['discover Fox Theatres showcasingThe Caretaker', 'Can you show me The Wedding Ring movie playing at the cinema?']","{'( S ( VP ( VB ) ( NP ) ) )': 5.0, '( SQ ( MD ) ( NP ( PRP ) ) ( VP ( VB ) ( NP ) ( NP ) ) ( . ) )': 5.0}",False
Create a comment saying ''Best Voice Ever'',( S ( VP ( VB ) ( NP ) ) ( '' ) ),CreateComment,12,ParaQuality,Fashion a commentary exclaiming 'Absolutely outstanding vocals!',( S ( NP ( NN ) ) ( NP ( NP ) ( VP ) ) ( . ) ( '' ) ),0.9139351,6.0,False,True,"['Compose a comment expressing praise for the excellent voice', 'Can you tell me the cheapest price for a flight from Denver to Pittsburgh?']","{'( S ( VP ( VB ) ( NP ) ) )': 7.0, '( SQ ( MD ) ( NP ( PRP ) ) ( VP ( VB ) ( NP ) ( NP ) ) ( . ) )': 7.0}",False
Jump to the previous song,( S ( VP ( VB ) ( PP ) ) ),NavigatePlaylist,13,ParaQuality,Jump back one track in my playlist,( S ( VP ( VB ) ( ADVP ) ( NP ) ( PP ) ) ),0.86766183,2.0,False,True,"['Discover cooking tutorials', 'Can you find me the cheapest fare for a one-way trip from Boston to Baltimore?']","{'( S ( VP ( VB ) ( NP ) ) )': 2.0, '( SQ ( MD ) ( NP ( PRP ) ) ( VP ( VB ) ( NP ) ( NP ) ) ( . ) )': 7.0}",True
Skip to the next song,( S ( VP ( VB ) ( PP ) ) ),NavigatePlaylist,14,ParaQuality,Skip ahead to the following melody,( S ( VP ( VB ) ( ADVP ) ( PP ) ) ),0.9069039,1.0,False,True,"['find places that have Join the Dots: B-sides and Rarities', 'Can you tell me the current temperature in Pesotum?']","{'( S ( VP ( VB ) ( NP ) ) )': 2.0, '( SQ ( MD ) ( NP ( PRP ) ) ( VP ( VB ) ( NP ) ( NP ) ) ( . ) )': 7.0}",True
Where can I upgrade my laptop ?,( SBARQ ( WHADVP ( WRB ) ) ( SQ ( MD ) ( NP ) ( VP ) ) ( . ) ),FindStores,15,ParaQuality,Are there any shops where I can get an upgrade for my laptop?,( SQ ( VBP ) ( NP ( EX ) ) ( NP ( NP ) ( SBAR ) ) ( . ) ),0.90808773,7.0,False,True,"['Find videos about cooking', 'Can you tell me the weather forecast for Harrison-Crawford State Forest?']","{'( S ( VP ( VB ) ( NP ) ) )': 7.0, '( SQ ( MD ) ( NP ( PRP ) ) ( VP ( VB ) ( NP ) ( NP ) ) ( . ) )': 5.0}",False
Could you offer three barbershops in Newtown,( SQ ( MD ) ( NP ( PRP ) ) ( VP ( VB ) ( NP ) ) ),FindStores,16,ParaQuality,Can you give me the names of three hair salons situated in Newtown?,( SQ ( MD ) ( NP ( PRP ) ) ( VP ( VB ) ( NP ) ( NP ) ) ( . ) ),0.89921963,2.0,False,True,"['Compose a comment expressing praise for the excellent voice', 'Can you tell me the current temperature in Pesotum?']","{'( S ( VP ( VB ) ( NP ) ) )': 6.0, '( SQ ( MD ) ( NP ( PRP ) ) ( VP ( VB ) ( NP ) ( NP ) ) ( . ) )': 0.0}",True
Let me have top three convenience stores near Newtown,( S ( VP ( VB ) ( S ) ) ),FindStores,17,ParaQuality,Which are the top three convenience stores near Newtown?,( SBARQ ( WHNP ( WDT ) ) ( SQ ( SQ ) ) ( . ) ),0.9212028,6.0,False,True,"['locate Fox Theatres that are showing The Caretaker', 'Can you tell me the current temperature in Pesotum?']","{'( S ( VP ( VB ) ( NP ) ) )': 6.0, '( SQ ( MD ) ( NP ( PRP ) ) ( VP ( VB ) ( NP ) ( NP ) ) ( . ) )': 8.0}",False
I want reviews for McDonald's at Kensington st.,( S ( NP ( PRP ) ) ( VP ( VBP ) ( NP ) ( PP ) ) ( . ) ),GetReviews,18,ParaQuality,Please share customer evaluations for the MacDonald’s eatery found within Kensignton Street.,( S ( X ( UH ) ) ( VP ( VB ) ( NP ) ( NP ) ) ( . ) ),0.92095345,4.0,False,True,"['include Kirk Hammett in my Party playlist', 'Can you show me the most recent scientific paper on Machine Learning?']","{'( S ( VP ( VB ) ( NP ) ) )': 4.0, '( SQ ( MD ) ( NP ( PRP ) ) ( VP ( VB ) ( NP ) ( NP ) ) ( . ) )': 4.0}",False
How far is the closest cab,( SBARQ ( WHADVP ( WRB ) ( RB ) ) ( VP ( VBZ ) ( NP ) ) ),FindTaxi,19,ParaQuality,Give me an idea of how distant the closest taxi is.,( S ( VP ( VB ) ( NP ) ( NP ) ) ( . ) ),0.8929853,7.0,False,True,"['Discover the most popular images with the #LOVE tag', 'Can you show me the top three convenience stores close to Newtown?']","{'( S ( VP ( VB ) ( NP ) ) )': 2.0, '( SQ ( MD ) ( NP ( PRP ) ) ( VP ( VB ) ( NP ) ( NP ) ) ( . ) )': 4.0}",True
Request a taxi from the airport to home,( S ( VP ( VB ) ( NP ) ( PP ) ) ),BookTaxi,20,ParaQuality,"I want someone just landed at Sydney Airport; come pick us up, will give details of residence","( S ( NP ( PRP ) ) ( VP ( VP ) ( , ) ( S ) ( , ) ( VP ) ) )",0.8391042,6.0,False,True,"['Locate several lovely images that correspond to Opera House and have a size of 1024 pixels by 768 pixels', 'Can you find me the cheapest fare for a one-way trip from Boston to Baltimore?']","{'( S ( VP ( VB ) ( NP ) ) )': 6.0, '( SQ ( MD ) ( NP ( PRP ) ) ( VP ( VB ) ( NP ) ( NP ) ) ( . ) )': 7.0}",False
what is the forecast for colder in Anston,( SBARQ ( WHNP ( WP ) ) ( S ( VP ) ) ),GetWeather,22,SNIPS,Can you provide me with the forecast for Anston in colder conditions?,( SQ ( MD ) ( NP ( PRP ) ) ( VP ( VB ) ( NP ) ( PP ) ( PP ) ) ( . ) ),0.8975788,9.0,False,True,"['Craft a comment stating that it is the best voice of all time', 'Can you show me the most recent scientific paper on Machine Learning?']","{'( S ( VP ( VB ) ( NP ) ) )': 7.0, '( SQ ( MD ) ( NP ( PRP ) ) ( VP ( VB ) ( NP ) ( NP ) ) ( . ) )': 2.0}",True
How hot is it in Pesotum,( SBARQ ( WHADJP ( WRB ) ( JJ ) ) ( VP ( VBZ ) ( NP ) ( PP ) ) ),GetWeather,23,SNIPS,Is there any heatwave happening lately in Pesotum?,( SQ ( VBZ ) ( NP ( EX ) ) ( NP ( DT ) ( NN ) ) ( VP ( VBG ) ( ADVP ) ( PP ) ) ( . ) ),0.9115064,10.0,False,True,"['display the list of airlines operating between Boston and Denver', 'Can you find me a pub that serves Italian dressing for a party of 5 on February 11, 2033?']","{'( S ( VP ( VB ) ( NP ) ) )': 11.0, '( SQ ( MD ) ( NP ( PRP ) ) ( VP ( VB ) ( NP ) ( NP ) ) ( . ) )': 8.0}",False
"I would like to go to a pub that has italian dressing for a party of 5 on February 11, 2033",( S ( NP ( PRP ) ) ( VP ( MD ) ( VP ) ) ),BookRestaurant,24,SNIPS,"On Feburary eleven, twenty-thirty three could you help me find an elegant sports bar serving great delicious traditional italian sauce which has allocated seats available for folk gathered as squad who are quintet persons?","( S ( PP ( IN ) ( NP ) ) ( , ) ( NP ( QP ) ) ( MD ) ( NP ( PRP ) ) ( VP ( VB ) ( S ) ) ( . ) )",0.8469451,10.0,False,True,"['find places that have Join the Dots: B-sides and Rarities', 'Can you give me information about three barbershops located in Newtown?']","{'( S ( VP ( VB ) ( NP ) ) )': 11.0, '( SQ ( MD ) ( NP ( PRP ) ) ( VP ( VB ) ( NP ) ( NP ) ) ( . ) )': 9.0}",False
Book a taverna in Equatorial Guinea this month for nine people.,( S ( VP ( VB ) ( NP ) ( NP ) ( PP ) ) ( . ) ),BookRestaurant,25,SNIPS,Make a reservation at an eatery in Equatorial Guinea for nine individuals during this month.,( S ( VP ( VB ) ( NP ) ( PP ) ) ( . ) ),0.92889345,1.0,False,True,"['Find the trending photos tagged as #LOVE', 'Can you tell me the weather forecast for Harrison-Crawford State Forest?']","{'( S ( VP ( VB ) ( NP ) ) )': 2.0, '( SQ ( MD ) ( NP ( PRP ) ) ( VP ( VB ) ( NP ) ( NP ) ) ( . ) )': 5.0}",True
Book a table for eight people please,( S ( VP ( VB ) ( NP ) ( ADVP ) ) ),BookRestaurant,26,SNIPS,Is it possible to reserve seating for an octet at your establishment?,( SQ ( VBZ ) ( NP ( NP ) ) ( ADJP ( JJ ) ) ( S ( VP ) ) ( . ) ),0.8458545,7.0,False,True,"['add the artist named Kirk Hammett to the Party playlist', 'Can you tell me the least expensive one-way fare from Boston to Baltimore?']","{'( S ( VP ( VB ) ( NP ) ) )': 7.0, '( SQ ( MD ) ( NP ( PRP ) ) ( VP ( VB ) ( NP ) ( NP ) ) ( . ) )': 7.0}",False
Please add Ruud Jolie to my playlist Guest List Polygon,( S ( X ( UH ) ) ( VP ( VB ) ( NP ) ( PP ) ) ),AddToPlaylist,27,SNIPS,Please put on my music list titled 'Guests of The Polygons' a new track from an artist called  Mr. Rood Joey.,( S ( NP ( UH ) ) ( VP ( VB ) ( PP ) ( NP ) ) ( . ) ),0.8345064,4.0,False,True,"['Find videos about cooking', 'Can you tell me the schedule for Crime and Punishment U.S.A.?']","{'( S ( VP ( VB ) ( NP ) ) )': 4.0, '( SQ ( MD ) ( NP ( PRP ) ) ( VP ( VB ) ( NP ) ( NP ) ) ( . ) )': 4.0}",False
add this artist named Kirk Hammett to my playlist Party,( S ( VP ( VB ) ( NP ) ( PP ) ) ),AddToPlaylist,28,SNIPS,Put music from this person called KirHam on the list of songs I have for when I'm having a party.,( NP ( NP ( VB ) ( NN ) ) ( PP ( IN ) ( NP ) ) ( . ) ),0.8628863,6.0,False,True,"['include this musician called Kirk Hammett in my playlist Party', 'Can you tell me the current temperature in Pesotum?']","{'( S ( VP ( VB ) ( NP ) ) )': 6.0, '( SQ ( MD ) ( NP ( PRP ) ) ( VP ( VB ) ( NP ) ( NP ) ) ( . ) )': 7.0}",False
I want to put a copy of this tune into Skatepark Punks,( S ( NP ( PRP ) ) ( VP ( VBP ) ( S ) ) ),AddToPlaylist,29,SNIPS,Is it possible for me to integrate this tune into Skatepark Punks?,( SQ ( VBZ ) ( NP ( NP ) ) ( ADJP ( JJ ) ) ( SBAR ( IN ) ( S ) ) ( . ) ),0.93383443,8.0,False,True,"['Discover the trending photos marked with #LOVE', 'Can you find me the most recent scientific publication about Machine Learning?']","{'( S ( VP ( VB ) ( NP ) ) )': 8.0, '( SQ ( MD ) ( NP ( PRP ) ) ( VP ( VB ) ( NP ) ( NP ) ) ( . ) )': 8.0}",False
"I would give With Lee in Virginia, A Story of the American Civil War chronicle 4 of 6",( S ( NP ( PRP ) ) ( VP ( MD ) ( VP ) ) ),RateBook,30,SNIPS,The American Civil War story With Lee in Virginia takes place at number four within its series comprised with six books total.,( S ( NP ( NP ) ( PP ) ) ( VP ( VBZ ) ( NP ) ( PP ) ( PP ) ) ( . ) ),0.8571471,7.0,False,True,"['locate Fox Theatres that show The Caretaker', 'Can you tell me the weather forecast for Harrison-Crawford State Forest?']","{'( S ( VP ( VB ) ( NP ) ) )': 7.0, '( SQ ( MD ) ( NP ( PRP ) ) ( VP ( VB ) ( NP ) ( NP ) ) ( . ) )': 7.0}",False
