input_utterance,utterance_template,intent,seed_id,source,paraphrase_value,paraphrase_template,bertscore,ted,duplicate,semantics,selected_templates_related_paraphrases,ted_to_selected_templates,_is_similar
what does ls stand for,( SBARQ ( WHNP ( WP ) ) ( SQ ( VBZ ) ( NP ) ( VP ) ) ),abbreviation,50,ATIS,Could you define ls for me?,( SQ ( MD ) ( NP ( PRP ) ) ( VP ( VB ) ( NP ) ( PP ) ) ( . ) ),0.81795824,8.0,False,True,"['list all the airlines that have flights from boston to atlanta', 'Can you tell me the current temperature in Pesotum?']","{'( S ( VP ( VB ) ( NP ) ) )': 6.0, '( SQ ( MD ) ( NP ( PRP ) ) ( VP ( VB ) ( NP ) ( NP ) ) ( . ) )': 1.0}",True
what does dfw mean,( SBARQ ( WHNP ( WP ) ) ( SQ ( VBZ ) ( NP ) ( VP ) ) ),abbreviation,51,ATIS,Do you have any information about dfw's meaning?,( SQ ( VBP ) ( NP ( PRP ) ) ( VP ( VB ) ( NP ) ) ( . ) ),0.88076955,8.0,False,True,"['find places where I can access Join the Dots: B-sides and Rarities', 'Can you tell me the current temperature in Pesotum?']","{'( S ( VP ( VB ) ( NP ) ) )': 5.0, '( SQ ( MD ) ( NP ( PRP ) ) ( VP ( VB ) ( NP ) ( NP ) ) ( . ) )': 2.0}",True
What is the forecast for Harrison-Crawford State Forest,( SBARQ ( WHNP ( WP ) ) ( S ( VP ) ) ),GetWeather,21,SNIPS,Tell me what to expect weather-wise at Harrison-Crawford State Forest.,( S ( VP ( VB ) ( NP ) ( SBAR ) ) ( . ) ),0.9315,6.0,False,True,"['display the flights operating between Boston and Denver', 'Can you tell me the distance of the closest cab?']","{'( S ( VP ( VB ) ( NP ) ) )': 2.0, '( SQ ( MD ) ( NP ( PRP ) ) ( VP ( VB ) ( NP ) ( NP ) ) ( . ) )': 5.0}",True
find Join the Dots: B-sides and Rarities,( S ( VP ( VB ) ( S ) ) ),SearchCreativeWork,40,SNIPS,Find me a copy of Join the Dots: B-sides and Rarities,( S ( VP ( VB ) ( NP ) ( NP ) ) ),0.9380312,2.0,False,True,"['Find videos about cooking', ""Can you give me the reviews for the McDonald's located at Kensington st.?""]","{'( S ( VP ( VB ) ( NP ) ) )': 1.0, '( SQ ( MD ) ( NP ( PRP ) ) ( VP ( VB ) ( NP ) ( NP ) ) ( . ) )': 5.0}",True
Terminate i-a541 now,( S ( VP ( VB ) ( NP ) ( ADVP ) ) ),EndEC2Instance,1,ParaQuality,Finish executing program i-a541 now,( NP ( NN ) ( VP ( VBG ) ( NP ) ( NP ) ( ADVP ) ) ),0.8929989,4.0,False,True,"['Find the trending photos tagged as #LOVE', 'Can you tell me the cheapest price for a flight from Denver to Pittsburgh?']","{'( S ( VP ( VB ) ( NP ) ) )': 5.0, '( SQ ( MD ) ( NP ( PRP ) ) ( VP ( VB ) ( NP ) ( NP ) ) ( . ) )': 7.0}",False
Search for cooking videos,( NP ( NP ( VB ) ) ( PP ( IN ) ( NP ) ) ),SearchWeb,2,ParaQuality,Find instructional videos for cooking,( S ( VP ( VB ) ( NP ) ) ),0.93594855,4.0,False,True,"['locate Fox Theatres featuring The Caretaker', 'Can you find me a copy of The Lion Sleeps Tonight book?']","{'( S ( VP ( VB ) ( NP ) ) )': 0.0, '( SQ ( MD ) ( NP ( PRP ) ) ( VP ( VB ) ( NP ) ( NP ) ) ( . ) )': 6.0}",True
Find most popular photos tagged #LOVE,( S ( S ( VP ) ) ( VP ( VBP ) ) ),SearchWeb,3,ParaQuality,Find the most liked images containing the hashtag #LOVE,( S ( VP ( VB ) ( NP ) ) ),0.9522059,3.0,False,True,"['Find videos about cooking', 'Can you show me The Wedding Ring movie playing at the cinema?']","{'( S ( VP ( VB ) ( NP ) ) )': 0.0, '( SQ ( MD ) ( NP ( PRP ) ) ( VP ( VB ) ( NP ) ( NP ) ) ( . ) )': 6.0}",True
Search for a few nice photos matching Opera House with size 1024px * 768px,( NP ( NP ( VB ) ) ( PP ( IN ) ( NP ) ) ),SearchWeb,4,ParaQuality,"Retrieve some nice photographs that resemble the Opera House, measuring at exactly 1024 by 768 pixels.","( S ( VP ( VB ) ( NP ) ( , ) ( S ) ) ( . ) )",0.902294,6.0,False,True,"['list all the airlines that have flights from boston to atlanta', 'Can you find me a pub that serves Italian dressing for a group of 5 people on February 11, 2033?']","{'( S ( VP ( VB ) ( NP ) ) )': 2.0, '( SQ ( MD ) ( NP ( PRP ) ) ( VP ( VB ) ( NP ) ( NP ) ) ( . ) )': 5.0}",True
Are the burglar alarms in the office malfunctioning ?,( SQ ( VBP ) ( NP ( DT ) ( NN ) ( NNS ) ) ( PP ( IN ) ( NP ) ) ( VP ( VBG ) ) ( . ) ),CheckDevice,5,ParaQuality,Do you think there might be a malfunction with the burglar alarms in the office?,( SQ ( VBP ) ( NP ( PRP ) ) ( VP ( VB ) ( SBAR ) ) ( . ) ),0.94543266,8.0,False,True,"['display the airlines that operate flights between Boston and Denver', 'Can you tell me the weather forecast for Harrison-Crawford State Forest?']","{'( S ( VP ( VB ) ( NP ) ) )': 6.0, '( SQ ( MD ) ( NP ( PRP ) ) ( VP ( VB ) ( NP ) ( NP ) ) ( . ) )': 3.0}",True
Is the TV in the house off ?,( SQ ( VBZ ) ( NP ( DT ) ( NN ) ) ( PP ( IN ) ( NP ) ) ( PRT ( RP ) ) ( . ) ),CheckDevice,6,ParaQuality,Has anyone powered down the television within this abode?,( SQ ( VBZ ) ( NP ( NN ) ) ( VP ( VBN ) ( PRT ) ( NP ) ( PP ) ) ( . ) ),0.89916456,7.0,False,True,"['Discover culinary videos', 'Can you find me the least expensive ticket for a one-way trip from Boston to Baltimore?']","{'( S ( VP ( VB ) ( NP ) ) )': 8.0, '( SQ ( MD ) ( NP ( PRP ) ) ( VP ( VB ) ( NP ) ( NP ) ) ( . ) )': 5.0}",False
Any suggestions for an inexpensive hotel near Seattle for tomorrow for 2,( NP ( NP ( DT ) ( NNS ) ) ( PP ( IN ) ( NP ) ) ),FindHotel,7,ParaQuality,Can you suggest a low-cost hotel in the vicinity of Seattle that is available tomorrow and can accommodate two people?,( SQ ( MD ) ( NP ( PRP ) ) ( VP ( VB ) ( NP ) ) ( . ) ),0.8944018,7.0,False,True,"['Retrieve 5 conference articles that discuss text mining', 'Can you tell me the cheapest price for a flight from Denver to Pittsburgh?']","{'( S ( VP ( VB ) ( NP ) ) )': 5.0, '( SQ ( MD ) ( NP ( PRP ) ) ( VP ( VB ) ( NP ) ( NP ) ) ( . ) )': 1.0}",True
Are there any cheap hotels for 7-day stay somewhere near Riverside,( SQ ( VBP ) ( NP ( EX ) ) ( NP ( NP ) ( PP ) ) ( ADVP ( RB ) ( IN ) ( NP ) ) ),FindHotel,8,ParaQuality,I need information on reasonably priced hotels that are conveniently located close to Riverside and offer stays for 7 days.,( S ( NP ( PRP ) ) ( VP ( VBP ) ( NP ) ) ( . ) ),0.9040514,10.0,False,True,"['list all the airlines that have flights from boston to atlanta', 'Can you find me the most recent scientific paper about Machine Learning?']","{'( S ( VP ( VB ) ( NP ) ) )': 4.0, '( SQ ( MD ) ( NP ( PRP ) ) ( VP ( VB ) ( NP ) ( NP ) ) ( . ) )': 4.0}",False
Send an email to Phil telling her that ''I got you'',( S ( VP ( VB ) ( NP ) ( PP ) ) ( '' ) ( '' ) ),SendMail,9,ParaQuality,Could you forward a message to Phil stating that 'you can count on me'?,( SQ ( MD ) ( NP ( PRP ) ) ( VP ( VP ) ( '' ) ) ( . ) ),0.8993534,7.0,False,True,"['display the flights operating between Boston and Denver', 'Can you find me the most recent scientific publication about Machine Learning?']","{'( S ( VP ( VB ) ( NP ) ) )': 7.0, '( SQ ( MD ) ( NP ( PRP ) ) ( VP ( VB ) ( NP ) ( NP ) ) ( . ) )': 3.0}",True
Give me 5 conference articles about text mining,( S ( VP ( VB ) ( NP ) ( NP ) ) ),FindArticles,10,ParaQuality,Discover 5 research articles about text mining from conferences,( S ( VP ( VB ) ( NP ) ) ),0.9378117,1.0,False,True,"['provide a list of airlines connecting Boston and Denver', 'Can you find me the book called The Lion Sleeps Tonight to read?']","{'( S ( VP ( VB ) ( NP ) ) )': 0.0, '( SQ ( MD ) ( NP ( PRP ) ) ( VP ( VB ) ( NP ) ( NP ) ) ( . ) )': 6.0}",True
I am looking for the latest scientific article related to Machine Learning,( S ( NP ( PRP ) ) ( VP ( VBP ) ( VP ) ) ),FindArticles,11,ParaQuality,I'm searching for the latest scholarly article that has a connection with Machine Learning.,( S ( NP ( PRP ) ) ( VP ( VBP ) ( VP ) ) ( . ) ),0.9158799,1.0,False,True,"['discover Fox Theatres showcasingThe Caretaker', 'Can you show me The Wedding Ring movie playing at the cinema?']","{'( S ( VP ( VB ) ( NP ) ) )': 5.0, '( SQ ( MD ) ( NP ( PRP ) ) ( VP ( VB ) ( NP ) ( NP ) ) ( . ) )': 5.0}",False
Create a comment saying ''Best Voice Ever'',( S ( VP ( VB ) ( NP ) ) ( '' ) ),CreateComment,12,ParaQuality,Write down an observation expressing admiration for the amazing vocal performance,( S ( VP ( VB ) ( PRT ) ( NP ) ) ),0.88314503,2.0,False,True,"['Compose a comment expressing praise for the excellent voice', 'Can you tell me the cheapest price for a flight from Denver to Pittsburgh?']","{'( S ( VP ( VB ) ( NP ) ) )': 1.0, '( SQ ( MD ) ( NP ( PRP ) ) ( VP ( VB ) ( NP ) ( NP ) ) ( . ) )': 6.0}",True
Jump to the previous song,( S ( VP ( VB ) ( PP ) ) ),NavigatePlaylist,13,ParaQuality,Navigate to the previous music,( S ( VP ( VB ) ( PP ) ) ),0.91736937,0.0,False,True,"['Discover cooking tutorials', 'Can you find me the cheapest fare for a one-way trip from Boston to Baltimore?']","{'( S ( VP ( VB ) ( NP ) ) )': 1.0, '( SQ ( MD ) ( NP ( PRP ) ) ( VP ( VB ) ( NP ) ( NP ) ) ( . ) )': 7.0}",True
Skip to the next song,( S ( VP ( VB ) ( PP ) ) ),NavigatePlaylist,14,ParaQuality,Proceed to the next tune,( S ( VP ( VB ) ( PP ) ) ),0.9744369,0.0,False,True,"['find places that have Join the Dots: B-sides and Rarities', 'Can you tell me the current temperature in Pesotum?']","{'( S ( VP ( VB ) ( NP ) ) )': 1.0, '( SQ ( MD ) ( NP ( PRP ) ) ( VP ( VB ) ( NP ) ( NP ) ) ( . ) )': 7.0}",True
Where can I upgrade my laptop ?,( SBARQ ( WHADVP ( WRB ) ) ( SQ ( MD ) ( NP ) ( VP ) ) ( . ) ),FindStores,15,ParaQuality,I need help finding a place to upgrade my laptop.,( S ( NP ( PRP ) ) ( VP ( VBP ) ( NP ) ) ( . ) ),0.9012342,6.0,False,True,"['Find videos about cooking', 'Can you tell me the weather forecast for Harrison-Crawford State Forest?']","{'( S ( VP ( VB ) ( NP ) ) )': 4.0, '( SQ ( MD ) ( NP ( PRP ) ) ( VP ( VB ) ( NP ) ( NP ) ) ( . ) )': 4.0}",False
Could you offer three barbershops in Newtown,( SQ ( MD ) ( NP ( PRP ) ) ( VP ( VB ) ( NP ) ) ),FindStores,16,ParaQuality,Do you know of any places that offer barber services in Newtown? I need at least three options.,( S ( SQ ( VBP ) ( NP ) ( VP ) ) ( . ) ( NP ( PRP ) ) ( VP ( VBP ) ( NP ) ) ( . ) ),0.89342827,8.0,False,True,"['Compose a comment expressing praise for the excellent voice', 'Can you tell me the current temperature in Pesotum?']","{'( S ( VP ( VB ) ( NP ) ) )': 9.0, '( SQ ( MD ) ( NP ( PRP ) ) ( VP ( VB ) ( NP ) ( NP ) ) ( . ) )': 8.0}",False
Let me have top three convenience stores near Newtown,( S ( VP ( VB ) ( S ) ) ),FindStores,17,ParaQuality,Tell me where I can find the top three convenience stores near Newtown.,( S ( VP ( VB ) ( NP ) ( SBAR ) ) ( . ) ),0.9188428,3.0,False,True,"['locate Fox Theatres that are showing The Caretaker', 'Can you tell me the current temperature in Pesotum?']","{'( S ( VP ( VB ) ( NP ) ) )': 2.0, '( SQ ( MD ) ( NP ( PRP ) ) ( VP ( VB ) ( NP ) ( NP ) ) ( . ) )': 5.0}",True
I want reviews for McDonald's at Kensington st.,( S ( NP ( PRP ) ) ( VP ( VBP ) ( NP ) ( PP ) ) ( . ) ),GetReviews,18,ParaQuality,I would like to know what people are saying about McDonald's on Kensington st.,( S ( NP ( PRP ) ) ( VP ( MD ) ( VP ) ) ( . ) ),0.9405445,3.0,False,True,"['include Kirk Hammett in my Party playlist', 'Can you show me the most recent scientific paper on Machine Learning?']","{'( S ( VP ( VB ) ( NP ) ) )': 5.0, '( SQ ( MD ) ( NP ( PRP ) ) ( VP ( VB ) ( NP ) ( NP ) ) ( . ) )': 5.0}",False
How far is the closest cab,( SBARQ ( WHADVP ( WRB ) ( RB ) ) ( VP ( VBZ ) ( NP ) ) ),FindTaxi,19,ParaQuality,What's the distance between here and the closest taxi stand?,( SBARQ ( WHNP ( WP ) ) ( SQ ( SQ ) ) ( . ) ),0.894355,7.0,False,True,"['Discover the most popular images with the #LOVE tag', 'Can you show me the top three convenience stores close to Newtown?']","{'( S ( VP ( VB ) ( NP ) ) )': 6.0, '( SQ ( MD ) ( NP ( PRP ) ) ( VP ( VB ) ( NP ) ( NP ) ) ( . ) )': 8.0}",False
Request a taxi from the airport to home,( S ( VP ( VB ) ( NP ) ( PP ) ) ),BookTaxi,20,ParaQuality,Could you organize a taxi service for me? I want to go from the airport directly home.,( S ( SQ ( MD ) ( NP ) ( VP ) ) ( . ) ( NP ( PRP ) ) ( VP ( VBP ) ( S ) ) ( . ) ),0.90380955,9.0,False,True,"['Locate several lovely images that correspond to Opera House and have a size of 1024 pixels by 768 pixels', 'Can you find me the cheapest fare for a one-way trip from Boston to Baltimore?']","{'( S ( VP ( VB ) ( NP ) ) )': 9.0, '( SQ ( MD ) ( NP ( PRP ) ) ( VP ( VB ) ( NP ) ( NP ) ) ( . ) )': 8.0}",False
what is the forecast for colder in Anston,( SBARQ ( WHNP ( WP ) ) ( S ( VP ) ) ),GetWeather,22,SNIPS,I'm interested to know what's predicted for the weather in Anston as it cools down.,( S ( NP ( PRP ) ) ( VP ( VBP ) ( ADJP ) ) ( . ) ),0.90295583,6.0,False,True,"['Craft a comment stating that it is the best voice of all time', 'Can you show me the most recent scientific paper on Machine Learning?']","{'( S ( VP ( VB ) ( NP ) ) )': 5.0, '( SQ ( MD ) ( NP ( PRP ) ) ( VP ( VB ) ( NP ) ( NP ) ) ( . ) )': 5.0}",False
How hot is it in Pesotum,( SBARQ ( WHADJP ( WRB ) ( JJ ) ) ( VP ( VBZ ) ( NP ) ( PP ) ) ),GetWeather,23,SNIPS,How warm is it right now in Pesotum?,( SBARQ ( WHADJP ( WRB ) ( JJ ) ) ( SQ ( VBZ ) ( NP ) ( ADVP ) ( PP ) ) ( . ) ),0.9622096,3.0,False,True,"['display the list of airlines operating between Boston and Denver', 'Can you find me a pub that serves Italian dressing for a party of 5 on February 11, 2033?']","{'( S ( VP ( VB ) ( NP ) ) )': 9.0, '( SQ ( MD ) ( NP ( PRP ) ) ( VP ( VB ) ( NP ) ( NP ) ) ( . ) )': 9.0}",False
"I would like to go to a pub that has italian dressing for a party of 5 on February 11, 2033",( S ( NP ( PRP ) ) ( VP ( MD ) ( VP ) ) ),BookRestaurant,24,SNIPS,I'm looking for an establishment with Italian dressing where I can bring my group of five people to celebrate on February the eleventh at some point in two thousand thirty-three.,( S ( NP ( PRP ) ) ( VP ( VBP ) ( VP ) ) ( . ) ),0.8866718,2.0,False,True,"['find places that have Join the Dots: B-sides and Rarities', 'Can you give me information about three barbershops located in Newtown?']","{'( S ( VP ( VB ) ( NP ) ) )': 5.0, '( SQ ( MD ) ( NP ( PRP ) ) ( VP ( VB ) ( NP ) ( NP ) ) ( . ) )': 5.0}",False
Book a taverna in Equatorial Guinea this month for nine people.,( S ( VP ( VB ) ( NP ) ( NP ) ( PP ) ) ( . ) ),BookRestaurant,25,SNIPS,Find me available tables at tavernas in Equatorial Guinea. I need it sometime within this month and we're going to be nine people.,( S ( S ( VP ) ) ( . ) ( S ( NP ) ( VP ) ) ( CC ) ( S ( NP ) ( VP ) ) ( . ) ),0.880736,6.0,False,True,"['Find the trending photos tagged as #LOVE', 'Can you tell me the weather forecast for Harrison-Crawford State Forest?']","{'( S ( VP ( VB ) ( NP ) ) )': 8.0, '( SQ ( MD ) ( NP ( PRP ) ) ( VP ( VB ) ( NP ) ( NP ) ) ( . ) )': 8.0}",False
Book a table for eight people please,( S ( VP ( VB ) ( NP ) ( ADVP ) ) ),BookRestaurant,26,SNIPS,Please secure us a table for eight guests.,( VP ( UH ) ( VP ( VB ) ( NP ) ( NP ) ) ( . ) ),0.929226,4.0,False,True,"['add the artist named Kirk Hammett to the Party playlist', 'Can you tell me the least expensive one-way fare from Boston to Baltimore?']","{'( S ( VP ( VB ) ( NP ) ) )': 4.0, '( SQ ( MD ) ( NP ( PRP ) ) ( VP ( VB ) ( NP ) ( NP ) ) ( . ) )': 4.0}",False
Please add Ruud Jolie to my playlist Guest List Polygon,( S ( X ( UH ) ) ( VP ( VB ) ( NP ) ( PP ) ) ),AddToPlaylist,27,SNIPS,Please add the song by Ruud Jolie to my Guest List Polygon playlist.,( S ( X ( UH ) ) ( VP ( VB ) ( NP ) ( PP ) ( PP ) ) ( . ) ),0.9409079,2.0,False,True,"['Find videos about cooking', 'Can you tell me the schedule for Crime and Punishment U.S.A.?']","{'( S ( VP ( VB ) ( NP ) ) )': 5.0, '( SQ ( MD ) ( NP ( PRP ) ) ( VP ( VB ) ( NP ) ( NP ) ) ( . ) )': 6.0}",False
add this artist named Kirk Hammett to my playlist Party,( S ( VP ( VB ) ( NP ) ( PP ) ) ),AddToPlaylist,28,SNIPS,Add the music of Kirk Hammett to my Party playlist.,( S ( VP ( VB ) ( NP ) ( PP ) ) ( . ) ),0.93472606,1.0,False,True,"['include this musician called Kirk Hammett in my playlist Party', 'Can you tell me the current temperature in Pesotum?']","{'( S ( VP ( VB ) ( NP ) ) )': 2.0, '( SQ ( MD ) ( NP ( PRP ) ) ( VP ( VB ) ( NP ) ( NP ) ) ( . ) )': 5.0}",True
I want to put a copy of this tune into Skatepark Punks,( S ( NP ( PRP ) ) ( VP ( VBP ) ( S ) ) ),AddToPlaylist,29,SNIPS,Can you help me transfer this song to the Skatepark Punks?,( SQ ( MD ) ( NP ( PRP ) ) ( VP ( VB ) ( S ) ) ( . ) ),0.92241764,4.0,False,True,"['Discover the trending photos marked with #LOVE', 'Can you find me the most recent scientific publication about Machine Learning?']","{'( S ( VP ( VB ) ( NP ) ) )': 6.0, '( SQ ( MD ) ( NP ( PRP ) ) ( VP ( VB ) ( NP ) ( NP ) ) ( . ) )': 2.0}",True
"I would give With Lee in Virginia, A Story of the American Civil War chronicle 4 of 6",( S ( NP ( PRP ) ) ( VP ( MD ) ( VP ) ) ),RateBook,30,SNIPS,"A Story of the American Civil War, With Lee in Virginia, ranks fourth out of six in the chronicle.","( S ( NP ( NP ) ( PP ) ( , ) ( PP ) ( , ) ) ( VP ( VBZ ) ( ADVP ) ( PP ) ) ( . ) )",0.8932707,9.0,False,True,"['locate Fox Theatres that show The Caretaker', 'Can you tell me the weather forecast for Harrison-Crawford State Forest?']","{'( S ( VP ( VB ) ( NP ) ) )': 10.0, '( SQ ( MD ) ( NP ( PRP ) ) ( VP ( VB ) ( NP ) ( NP ) ) ( . ) )': 10.0}",False
Rate this album two out of 6,( S ( VP ( VB ) ( NP ) ( NP ) ) ),RateBook,31,SNIPS,Give this album a rating of 2 out of 6,( S ( VP ( VB ) ( NP ) ( NP ) ) ),0.9450985,0.0,False,True,"['Discover the most popular images with the #LOVE tag', 'Could you show me 5 conference articles on the topic of text mining?']","{'( S ( VP ( VB ) ( NP ) ) )': 1.0, '( SQ ( MD ) ( NP ( PRP ) ) ( VP ( VB ) ( NP ) ( NP ) ) ( . ) )': 5.0}",True
Give the current part of the saga 4 points out of 6.,( S ( VP ( VB ) ( NP ) ( NP ) ) ( . ) ),RateBook,32,SNIPS,Provide an evaluation for this segment among all others in terms of quality. Use numbers from one through six and assign it four points based on your judgment.,( S ( VP ( VB ) ( NP ) ) ( . ) ),0.8509306,1.0,False,True,"['find all the airlines that fly from Boston to Denver', 'Can you tell me the meaning of ls?']","{'( S ( VP ( VB ) ( NP ) ) )': 1.0, '( SQ ( MD ) ( NP ( PRP ) ) ( VP ( VB ) ( NP ) ( NP ) ) ( . ) )': 5.0}",True
Can you play some fifties music by lavern baker,( SQ ( MD ) ( NP ( PRP ) ) ( VP ( VB ) ( NP ) ( PP ) ) ),PlayMusic,33,SNIPS,Could you find and play some lavern baker tunes from the 1950s for me?,( SQ ( MD ) ( NP ( PRP ) ) ( VP ( VB ) ( CC ) ( VB ) ( NP ) ( PP ) ( PP ) ) ( . ) ),0.8949438,4.0,False,True,"['Find videos about cooking', 'Can you find me the most recent scientific publication about Machine Learning?']","{'( S ( VP ( VB ) ( NP ) ) )': 9.0, '( SQ ( MD ) ( NP ( PRP ) ) ( VP ( VB ) ( NP ) ( NP ) ) ( . ) )': 4.0}",False
Play a 1964 track from Shahram Nazeri on Pandora.,( S ( VP ( VB ) ( NP ) ) ( . ) ),PlayMusic,34,SNIPS,Could you put on a track from Shahram Nazeri that came out in 1964 on Pandora?,( SQ ( MD ) ( NP ( PRP ) ) ( VP ( VB ) ( PP ) ) ( . ) ),0.9216289,5.0,False,True,"['list all the airlines that have flights from boston to atlanta', 'Can you show me the best three convenience stores around Newtown?']","{'( S ( VP ( VB ) ( NP ) ) )': 6.0, '( SQ ( MD ) ( NP ( PRP ) ) ( VP ( VB ) ( NP ) ( NP ) ) ( . ) )': 2.0}",True
Please play me some Satire music,( S ( X ( UH ) ) ( VP ( VB ) ( NP ) ( NP ) ) ),PlayMusic,35,SNIPS,Can I get some humorous or parodistic tunes?,( SQ ( MD ) ( NP ( PRP ) ) ( VP ( VB ) ( NP ) ) ( . ) ),0.8680306,6.0,False,True,"['Discover the most popular images with the #LOVE tag', 'Can you tell me the cheapest price for a flight from Denver to Pittsburgh?']","{'( S ( VP ( VB ) ( NP ) ) )': 5.0, '( SQ ( MD ) ( NP ( PRP ) ) ( VP ( VB ) ( NP ) ( NP ) ) ( . ) )': 1.0}",True
When is Crime and Punishment U.S.A. showing?,( SBARQ ( WHADVP ( WRB ) ) ( SQ ( VBZ ) ( NP ) ( VP ) ) ( . ) ),SearchScreeningEvent,36,SNIPS,When does the screening of Crime and Punisment U.S.A take place?,( SBARQ ( WHADVP ( WRB ) ) ( SQ ( VBZ ) ( NP ) ( VP ) ) ( . ) ),0.9030398,0.0,False,True,"['Retrieve a handful of lovely photographs that match Opera House, measuring 1024 pixels in width and 768 pixels in height', 'Can you tell me the proximity of the closest taxi?']","{'( S ( VP ( VB ) ( NP ) ) )': 7.0, '( SQ ( MD ) ( NP ( PRP ) ) ( VP ( VB ) ( NP ) ( NP ) ) ( . ) )': 7.0}",False
find Fox Theatres with The Caretaker,( S ( VP ( VB ) ( NP ) ( PP ) ) ),SearchScreeningEvent,37,SNIPS,look for Fox Theatres presenting the show titled The Caretaker,( S ( VP ( VB ) ( PP ) ) ),0.9328742,1.0,False,True,"['locate Fox Theatres that are currently presenting The Caretaker', 'Can you find me a pub with Italian dressing where I can host a party for 5 people on February 11, 2033?']","{'( S ( VP ( VB ) ( NP ) ) )': 1.0, '( SQ ( MD ) ( NP ( PRP ) ) ( VP ( VB ) ( NP ) ( NP ) ) ( . ) )': 7.0}",True
I would like to watch The Wedding Ring at the movie theatre,( S ( NP ( PRP ) ) ( VP ( MD ) ( VP ) ) ),SearchScreeningEvent,38,SNIPS,I'm interested in watching The Wedding Ring. Can you provide details about its screenings in theaters?,( S ( NP ( PRP ) ) ( VP ( VBP ) ( ADJP ) ) ( . ) ( SQ ( MD ) ( NP ) ( VP ) ) ( . ) ),0.9053687,7.0,False,True,"['Find videos on cooking', 'Can you find me a pub that serves Italian dressing for a group of 5 people on February 11, 2033?']","{'( S ( VP ( VB ) ( NP ) ) )': 10.0, '( SQ ( MD ) ( NP ( PRP ) ) ( VP ( VB ) ( NP ) ( NP ) ) ( . ) )': 9.0}",False
I want to read the book The Lion Sleeps Tonight,( S ( NP ( PRP ) ) ( VP ( VBP ) ( S ) ) ),SearchCreativeWork,39,SNIPS,Can you assist me in accessing and reading The Lion Sleeps Tonight?,( SQ ( MD ) ( NP ( PRP ) ) ( VP ( VB ) ( NP ) ( PP ) ) ( . ) ),0.91044635,6.0,False,True,"['Find the trending photos tagged as #LOVE', 'Can you tell me the weather forecast for Harrison-Crawford State Forest?']","{'( S ( VP ( VB ) ( NP ) ) )': 6.0, '( SQ ( MD ) ( NP ( PRP ) ) ( VP ( VB ) ( NP ) ( NP ) ) ( . ) )': 1.0}",True
Where can I buy a used copy of the game called I Lie Around?,( SBARQ ( WHADVP ( WRB ) ) ( SQ ( MD ) ( NP ) ( VP ) ) ( . ) ),SearchCreativeWork,41,SNIPS,Where might one find a previously owned version of the game known as I Lie Around?,( SBARQ ( WHADVP ( WRB ) ) ( SQ ( MD ) ( NP ) ( VP ) ) ( . ) ),0.93544614,0.0,False,True,"['Locate the most popular pictures with the #LOVE tag', 'Can you find me a copy of The Lion Sleeps Tonight book?']","{'( S ( VP ( VB ) ( NP ) ) )': 7.0, '( SQ ( MD ) ( NP ( PRP ) ) ( VP ( VB ) ( NP ) ( NP ) ) ( . ) )': 7.0}",False
please give me the cheapest flight from denver to pittsburgh,( S ( X ( UH ) ) ( VP ( VB ) ( NP ) ( NP ) ) ),flight,42,ATIS,I'm looking for the lowest-cost flight from Denver to Pittsburgh. Can you help me with that?,( S ( NP ( PRP ) ) ( VP ( VP ) ( . ) ( SQ ) ) ( . ) ),0.9101701,6.0,False,True,"['Locate the top-rated pictures that are labeled with #LOVE', 'Can you show me the top three convenience stores close to Newtown?']","{'( S ( VP ( VB ) ( NP ) ) )': 6.0, '( SQ ( MD ) ( NP ( PRP ) ) ( VP ( VB ) ( NP ) ( NP ) ) ( . ) )': 5.0}",False
i want to fly from milwaukee to orlando on either wednesday evening or thursday morning,( S ( NP ( PRP ) ) ( VP ( VBP ) ( S ) ) ),flight,43,ATIS,"Could you please help me find flights departing from Milwaukee and arriving in Orlando, with options for Wednesday evening or Thursday morning departures?",( SQ ( MD ) ( NP ( PRP ) ) ( VP ( UH ) ( VP ) ) ( . ) ),0.8876484,5.0,False,True,"['discover places with Join the Dots: B-sides and Rarities', 'Can you find me the most recent scientific paper about Machine Learning?']","{'( S ( VP ( VB ) ( NP ) ) )': 7.0, '( SQ ( MD ) ( NP ( PRP ) ) ( VP ( VB ) ( NP ) ( NP ) ) ( . ) )': 3.0}",True
what is the lowest fare from denver to pittsburgh,( SBAR ( WHNP ( WP ) ) ( S ( VP ) ) ),airfare,44,ATIS,I want to know the least expensive airfare from Denver to Pittsburgh.,( S ( NP ( PRP ) ) ( VP ( VBP ) ( S ) ) ( . ) ),0.90063316,5.0,False,True,"['Retrieve several high-quality photographs that are similar to Opera House and have a size of 1024 pixels by 768 pixels', 'Can you tell me the lowest cost for a single journey from Boston to Baltimore?']","{'( S ( VP ( VB ) ( NP ) ) )': 5.0, '( SQ ( MD ) ( NP ( PRP ) ) ( VP ( VB ) ( NP ) ( NP ) ) ( . ) )': 5.0}",False
what is the cheapest one way fare from boston to baltimore,( SBARQ ( WHNP ( WP ) ) ( S ( VP ) ) ),airfare,45,ATIS,How much does it cost for a one-way ticket from Boston to Baltimore that is the most affordable?,( SBARQ ( WHNP ( WRB ) ( JJ ) ) ( SQ ( VBZ ) ( NP ) ( VP ) ) ( . ) ),0.9049807,6.0,False,True,"['locate Fox Theatres that show The Caretaker', ""Can you give me the reviews for the McDonald's located at Kensington st.?""]","{'( S ( VP ( VB ) ( NP ) ) )': 8.0, '( SQ ( MD ) ( NP ( PRP ) ) ( VP ( VB ) ( NP ) ( NP ) ) ( . ) )': 8.0}",False
what is the ground transportation from oakland to san francisco,( SBARQ ( WHNP ( WP ) ) ( S ( VP ) ) ),ground_service,46,ATIS,what are my choices for traveling on land between Oakland and San Fransisco?,( SBARQ ( WHNP ( WP ) ) ( SQ ( VBP ) ( NP ) ) ( . ) ),0.8930422,4.0,False,True,"['locate Fox Theatres featuring The Caretaker', 'Can you show me the most recent scientific paper on Machine Learning?']","{'( S ( VP ( VB ) ( NP ) ) )': 6.0, '( SQ ( MD ) ( NP ( PRP ) ) ( VP ( VB ) ( NP ) ( NP ) ) ( . ) )': 7.0}",False
can i get a rental car in dallas,( SQ ( MD ) ( NP ( PRP ) ) ( VP ( VB ) ( NP ) ( PP ) ) ),ground_service,47,ATIS,Where can I find a rental car service in Dallas?,( SBARQ ( WHADVP ( WRB ) ) ( SQ ( MD ) ( NP ) ( VP ) ) ( . ) ),0.9165332,8.0,False,True,"['find albums with B-sides and Rarities from Join the Dots', 'Can you give me information about three barbershops located in Newtown?']","{'( S ( VP ( VB ) ( NP ) ) )': 7.0, '( SQ ( MD ) ( NP ( PRP ) ) ( VP ( VB ) ( NP ) ( NP ) ) ( . ) )': 7.0}",False
