input_utterance,utterance_template,intent,seed_id,source,paraphrase_value,paraphrase_template,bertscore,ted,duplicate,semantics,selected_templates_related_paraphrases,ted_to_selected_templates,_is_similar
Search for a few nice photos matching Opera House with size 1024px * 768px,( NP ( NP ( VB ) ) ( PP ( IN ) ( NP ) ) ),SearchWeb,4,ParaQuality,Please locate various captivating visual stills which present views equivalent or alike tos scenic background normally found when looking towards The Operea Hug from across Circular Quay there may not necessarily require regularising image attributes ontot any specific direniotion but they much ensure any given desplay uses co-ordinates indicating horizontal representationis Should mesure within exact parameters One-Thosand-Twonty-Four Pixels across b seven-hundred and sixty-eight pixeels deep,( S ( S ( VP ) ) ( VP ( VP ) ( VP ) ) ( CC ) ( S ( NP ) ( ADVP ) ( VP ) ) ),0.7947834,9.0,False,True,"['list all the airlines that have flights from boston to atlanta', 'Can you find me a pub that serves Italian dressing for a group of 5 people on February 11, 2033?']","{'( S ( VP ( VB ) ( NP ) ) )': 7.0, '( SQ ( MD ) ( NP ( PRP ) ) ( VP ( VB ) ( NP ) ( NP ) ) ( . ) )': 9.0}",False
Are the burglar alarms in the office malfunctioning ?,( SQ ( VBP ) ( NP ( DT ) ( NN ) ( NNS ) ) ( PP ( IN ) ( NP ) ) ( VP ( VBG ) ) ( . ) ),CheckDevice,5,ParaQuality,Can you verify that no faults or malfunctions exist when it comes down to security measures placed against all forms of unauthorized access into exclusive areas within headquarters?,( SQ ( MD ) ( NP ( PRP ) ) ( VP ( VB ) ( SBAR ) ) ( . ) ),0.85420156,9.0,False,True,"['display the airlines that operate flights between Boston and Denver', 'Can you tell me the weather forecast for Harrison-Crawford State Forest?']","{'( S ( VP ( VB ) ( NP ) ) )': 6.0, '( SQ ( MD ) ( NP ( PRP ) ) ( VP ( VB ) ( NP ) ( NP ) ) ( . ) )': 2.0}",True
Is the TV in the house off ?,( SQ ( VBZ ) ( NP ( DT ) ( NN ) ) ( PP ( IN ) ( NP ) ) ( PRT ( RP ) ) ( . ) ),CheckDevice,6,ParaQuality,Is it true that no one has left any entertainment streaming devices running at my place?,( SQ ( VBZ ) ( NP ( NP ) ) ( ADJP ( JJ ) ) ( SBAR ( IN ) ( S ) ) ( . ) ),0.86622655,7.0,False,True,"['Discover culinary videos', 'Can you find me the least expensive ticket for a one-way trip from Boston to Baltimore?']","{'( S ( VP ( VB ) ( NP ) ) )': 8.0, '( SQ ( MD ) ( NP ( PRP ) ) ( VP ( VB ) ( NP ) ( NP ) ) ( . ) )': 8.0}",False
Any suggestions for an inexpensive hotel near Seattle for tomorrow for 2,( NP ( NP ( DT ) ( NNS ) ) ( PP ( IN ) ( NP ) ) ),FindHotel,7,ParaQuality,I am searching furiously online but trying really hard getting no luck. Please tell me where can I get suggestions regarding Budget Accomodations with Duo occupancy preference in region within Range Of Mt Rainier-National Park ,( S ( S ( NP ) ( VP ) ) ( . ) ( S ( WHNP ) ( VP ) ) ),0.8392896,8.0,False,True,"['Retrieve 5 conference articles that discuss text mining', 'Can you tell me the cheapest price for a flight from Denver to Pittsburgh?']","{'( S ( VP ( VB ) ( NP ) ) )': 6.0, '( SQ ( MD ) ( NP ( PRP ) ) ( VP ( VB ) ( NP ) ( NP ) ) ( . ) )': 8.0}",False
Are there any cheap hotels for 7-day stay somewhere near Riverside,( SQ ( VBP ) ( NP ( EX ) ) ( NP ( NP ) ( PP ) ) ( ADVP ( RB ) ( IN ) ( NP ) ) ),FindHotel,8,ParaQuality,"As I'm planning my trip, I am curious if there are any pocket friendly lodging options available around river side which allow staying up-to one week.","( S ( SBAR ( IN ) ( S ) ) ( , ) ( NP ( PRP ) ) ( VP ( VBP ) ( ADJP ) ( SBAR ) ) ( . ) )",0.8845118,12.0,False,True,"['list all the airlines that have flights from boston to atlanta', 'Can you find me the most recent scientific paper about Machine Learning?']","{'( S ( VP ( VB ) ( NP ) ) )': 9.0, '( SQ ( MD ) ( NP ( PRP ) ) ( VP ( VB ) ( NP ) ( NP ) ) ( . ) )': 7.0}",False
Send an email to Phil telling her that ''I got you'',( S ( VP ( VB ) ( NP ) ( PP ) ) ( '' ) ( '' ) ),SendMail,9,ParaQuality,Forward a letter revealing positive news and addressed toward Philip via e-mail.,( S ( VP ( VB ) ( NP ) ) ( . ) ),0.8732021,3.0,False,True,"['display the flights operating between Boston and Denver', 'Can you find me the most recent scientific publication about Machine Learning?']","{'( S ( VP ( VB ) ( NP ) ) )': 1.0, '( SQ ( MD ) ( NP ( PRP ) ) ( VP ( VB ) ( NP ) ( NP ) ) ( . ) )': 5.0}",True
Give me 5 conference articles about text mining,( S ( VP ( VB ) ( NP ) ( NP ) ) ),FindArticles,10,ParaQuality,"I need assistance finding top-quality resources - specifically, can you assist in locating particulars regarding figuring out phrases within documents in reviewing information captured from big data? Let's be specific and concentrate solely on studies delivered during gatherings or symposiums.",( S ( NP ( PRP ) ) ( VP ( VBP ) ( NP ) ) ( . ) ),0.83761823,5.0,False,True,"['provide a list of airlines connecting Boston and Denver', 'Can you find me the book called The Lion Sleeps Tonight to read?']","{'( S ( VP ( VB ) ( NP ) ) )': 4.0, '( SQ ( MD ) ( NP ( PRP ) ) ( VP ( VB ) ( NP ) ( NP ) ) ( . ) )': 4.0}",False
I am looking for the latest scientific article related to Machine Learning,( S ( NP ( PRP ) ) ( VP ( VBP ) ( VP ) ) ),FindArticles,11,ParaQuality,I'm interested in reading a new scholarly article discussing advancements in Natural Language Processing.,( S ( NP ( PRP ) ) ( VP ( VBP ) ( ADJP ) ) ( . ) ),0.88967323,2.0,False,True,"['discover Fox Theatres showcasingThe Caretaker', 'Can you show me The Wedding Ring movie playing at the cinema?']","{'( S ( VP ( VB ) ( NP ) ) )': 5.0, '( SQ ( MD ) ( NP ( PRP ) ) ( VP ( VB ) ( NP ) ( NP ) ) ( . ) )': 5.0}",False
Create a comment saying ''Best Voice Ever'',( S ( VP ( VB ) ( NP ) ) ( '' ) ),CreateComment,12,ParaQuality,I need help generating content that says ''Best Voice Ever''?,( S ( NP ( PRP ) ) ( VP ( VBP ) ( NP ) ) ( . ) ),0.894614,4.0,False,True,"['Compose a comment expressing praise for the excellent voice', 'Can you tell me the cheapest price for a flight from Denver to Pittsburgh?']","{'( S ( VP ( VB ) ( NP ) ) )': 4.0, '( SQ ( MD ) ( NP ( PRP ) ) ( VP ( VB ) ( NP ) ( NP ) ) ( . ) )': 4.0}",False
Jump to the previous song,( S ( VP ( VB ) ( PP ) ) ),NavigatePlaylist,13,ParaQuality,Travel backwards in my music library,( S ( VP ( VB ) ( ADVP ) ( PP ) ) ),0.86060715,1.0,False,True,"['Discover cooking tutorials', 'Can you find me the cheapest fare for a one-way trip from Boston to Baltimore?']","{'( S ( VP ( VB ) ( NP ) ) )': 2.0, '( SQ ( MD ) ( NP ( PRP ) ) ( VP ( VB ) ( NP ) ( NP ) ) ( . ) )': 7.0}",True
Skip to the next song,( S ( VP ( VB ) ( PP ) ) ),NavigatePlaylist,14,ParaQuality,Change it up with a different song!,( S ( VP ( VB ) ( NP ) ( PRT ) ( PP ) ) ( . ) ),0.875138,3.0,False,True,"['find places that have Join the Dots: B-sides and Rarities', 'Can you tell me the current temperature in Pesotum?']","{'( S ( VP ( VB ) ( NP ) ) )': 3.0, '( SQ ( MD ) ( NP ( PRP ) ) ( VP ( VB ) ( NP ) ( NP ) ) ( . ) )': 6.0}",True
Where can I upgrade my laptop ?,( SBARQ ( WHADVP ( WRB ) ) ( SQ ( MD ) ( NP ) ( VP ) ) ( . ) ),FindStores,15,ParaQuality,Do you have information on stores that do upgrades for laptops?,( SQ ( VBP ) ( NP ( PRP ) ) ( VP ( VB ) ( NP ) ) ( . ) ),0.8775749,7.0,False,True,"['Find videos about cooking', 'Can you tell me the weather forecast for Harrison-Crawford State Forest?']","{'( S ( VP ( VB ) ( NP ) ) )': 5.0, '( SQ ( MD ) ( NP ( PRP ) ) ( VP ( VB ) ( NP ) ( NP ) ) ( . ) )': 2.0}",True
Could you offer three barbershops in Newtown,( SQ ( MD ) ( NP ( PRP ) ) ( VP ( VB ) ( NP ) ) ),FindStores,16,ParaQuality,Do we have some nice barbing centers closeby? I need about 3 choices please,( SQ ( VBP ) ( NP ( PRP ) ) ( VP ( VB ) ( NP ) ( ADVP ) ) ( . ) ( S ( NP ) ( VP ) ) ),0.8622355,5.0,False,True,"['Compose a comment expressing praise for the excellent voice', 'Can you tell me the current temperature in Pesotum?']","{'( S ( VP ( VB ) ( NP ) ) )': 8.0, '( SQ ( MD ) ( NP ( PRP ) ) ( VP ( VB ) ( NP ) ( NP ) ) ( . ) )': 4.0}",False
Let me have top three convenience stores near Newtown,( S ( VP ( VB ) ( S ) ) ),FindStores,17,ParaQuality,"What are some of the best options for convenient shops near Newton? Specifically, I want at least a list of 3","( S ( SBARQ ( WHNP ) ( SQ ) ( . ) ( ADVP ) ( , ) ) ( NP ( PRP ) ) ( VP ( VBP ) ( NP ) ) )",0.86656904,10.0,False,True,"['locate Fox Theatres that are showing The Caretaker', 'Can you tell me the current temperature in Pesotum?']","{'( S ( VP ( VB ) ( NP ) ) )': 9.0, '( SQ ( MD ) ( NP ( PRP ) ) ( VP ( VB ) ( NP ) ( NP ) ) ( . ) )': 10.0}",False
I want reviews for McDonald's at Kensington st.,( S ( NP ( PRP ) ) ( VP ( VBP ) ( NP ) ( PP ) ) ( . ) ),GetReviews,18,ParaQuality,"I’d be happy if I could read what other people think of Macdonalds, this particular gate located inside Catham Rd",( S ( NP ( PRP ) ) ( VP ( MD ) ( VP ) ) ),0.8722827,4.0,False,True,"['include Kirk Hammett in my Party playlist', 'Can you show me the most recent scientific paper on Machine Learning?']","{'( S ( VP ( VB ) ( NP ) ) )': 4.0, '( SQ ( MD ) ( NP ( PRP ) ) ( VP ( VB ) ( NP ) ( NP ) ) ( . ) )': 6.0}",False
How far is the closest cab,( SBARQ ( WHADVP ( WRB ) ( RB ) ) ( VP ( VBZ ) ( NP ) ) ),FindTaxi,19,ParaQuality,Can you tell me what's left until I reach my destination in terms of cabs?,( SQ ( MD ) ( NP ( PRP ) ) ( VP ( VB ) ( NP ) ( SBAR ) ) ( . ) ),0.8472714,8.0,False,True,"['Discover the most popular images with the #LOVE tag', 'Can you show me the top three convenience stores close to Newtown?']","{'( S ( VP ( VB ) ( NP ) ) )': 6.0, '( SQ ( MD ) ( NP ( PRP ) ) ( VP ( VB ) ( NP ) ( NP ) ) ( . ) )': 1.0}",True
Request a taxi from the airport to home,( S ( VP ( VB ) ( NP ) ( PP ) ) ),BookTaxi,20,ParaQuality,Need help booking travel arrangements? Arriving by plane soon and need transport onward,( VP ( VBP ) ( NP ( NN ) ) ( S ( VP ) ) ( . ) ( S ( VP ) ) ),0.84710425,5.0,False,True,"['Locate several lovely images that correspond to Opera House and have a size of 1024 pixels by 768 pixels', 'Can you find me the cheapest fare for a one-way trip from Boston to Baltimore?']","{'( S ( VP ( VB ) ( NP ) ) )': 5.0, '( SQ ( MD ) ( NP ( PRP ) ) ( VP ( VB ) ( NP ) ( NP ) ) ( . ) )': 7.0}",False
what is the forecast for colder in Anston,( SBARQ ( WHNP ( WP ) ) ( S ( VP ) ) ),GetWeather,22,SNIPS,Is there any information available about how cold it will be and what to expect in terms of forecasts for that area called ‘Anson’? ,( SQ ( VBZ ) ( NP ( EX ) ) ( NP ( NP ) ( ADJP ) ) ( '' ) ( . ) ),0.852591,9.0,False,True,"['Craft a comment stating that it is the best voice of all time', 'Can you show me the most recent scientific paper on Machine Learning?']","{'( S ( VP ( VB ) ( NP ) ) )': 8.0, '( SQ ( MD ) ( NP ( PRP ) ) ( VP ( VB ) ( NP ) ( NP ) ) ( . ) )': 6.0}",False
How hot is it in Pesotum,( SBARQ ( WHADJP ( WRB ) ( JJ ) ) ( VP ( VBZ ) ( NP ) ( PP ) ) ),GetWeather,23,SNIPS,I am curious to know if it's hot or cold right now at [city name].,( S ( NP ( PRP ) ) ( VP ( VBP ) ( ADJP ) ) ( -RRB- ) ( . ) ),0.8502589,9.0,False,True,"['display the list of airlines operating between Boston and Denver', 'Can you find me a pub that serves Italian dressing for a party of 5 on February 11, 2033?']","{'( S ( VP ( VB ) ( NP ) ) )': 6.0, '( SQ ( MD ) ( NP ( PRP ) ) ( VP ( VB ) ( NP ) ( NP ) ) ( . ) )': 6.0}",False
"I would like to go to a pub that has italian dressing for a party of 5 on February 11, 2033",( S ( NP ( PRP ) ) ( VP ( MD ) ( VP ) ) ),BookRestaurant,24,SNIPS,What's your recommended destination famous due diets reserving assignment executes via escort tourists along counts each contains ingredients originating fashionable nation nearby utilizes splendid decorations final quality juice invited indoors?!,( S ( SBAR ( WHNP ) ( S ) ) ( VP ( VBZ ) ( PP ) ) ( NP ( DT ) ) ( VP ( VBZ ) ( NP ) ) ( VP ( VBZ ) ( NP ) ) ( . ) ),0.79423577,12.0,False,True,"['find places that have Join the Dots: B-sides and Rarities', 'Can you give me information about three barbershops located in Newtown?']","{'( S ( VP ( VB ) ( NP ) ) )': 12.0, '( SQ ( MD ) ( NP ( PRP ) ) ( VP ( VB ) ( NP ) ( NP ) ) ( . ) )': 12.0}",False
Book a taverna in Equatorial Guinea this month for nine people.,( S ( VP ( VB ) ( NP ) ( NP ) ( PP ) ) ( . ) ),BookRestaurant,25,SNIPS,Discover venues specialized on cooking Italian recipes,( S ( VP ( VB ) ( NP ) ) ),0.83961797,3.0,False,True,"['Find the trending photos tagged as #LOVE', 'Can you tell me the weather forecast for Harrison-Crawford State Forest?']","{'( S ( VP ( VB ) ( NP ) ) )': 0.0, '( SQ ( MD ) ( NP ( PRP ) ) ( VP ( VB ) ( NP ) ( NP ) ) ( . ) )': 6.0}",True
Book a table for eight people please,( S ( VP ( VB ) ( NP ) ( ADVP ) ) ),BookRestaurant,26,SNIPS,I would appreciate it if you could make arrangements so that we can dine with our entire group of 8.,( S ( NP ( PRP ) ) ( VP ( MD ) ( VP ) ) ( . ) ),0.84827024,6.0,False,True,"['add the artist named Kirk Hammett to the Party playlist', 'Can you tell me the least expensive one-way fare from Boston to Baltimore?']","{'( S ( VP ( VB ) ( NP ) ) )': 5.0, '( SQ ( MD ) ( NP ( PRP ) ) ( VP ( VB ) ( NP ) ( NP ) ) ( . ) )': 5.0}",False
Please add Ruud Jolie to my playlist Guest List Polygon,( S ( X ( UH ) ) ( VP ( VB ) ( NP ) ( PP ) ) ),AddToPlaylist,27,SNIPS,My records require your kind intervention in adding songs by Reputable Judge Rutledge into GLL,( S ( NP ( PRP$ ) ( NNS ) ) ( VP ( VBP ) ( NP ) ( PP ) ) ),0.837425,4.0,False,True,"['Find videos about cooking', 'Can you tell me the schedule for Crime and Punishment U.S.A.?']","{'( S ( VP ( VB ) ( NP ) ) )': 5.0, '( SQ ( MD ) ( NP ( PRP ) ) ( VP ( VB ) ( NP ) ( NP ) ) ( . ) )': 7.0}",False
add this artist named Kirk Hammett to my playlist Party,( S ( VP ( VB ) ( NP ) ( PP ) ) ),AddToPlaylist,28,SNIPS,"I am asking whether or not it would be feasible were I able take advantage of your artificial knowledge storing functionabilities, and thereby ensuring than anyone looking at what songs we're playing at our upcoming collective observance could see authoritative confirmation that Mr. Henry Bartmann was represented musically.",( S ( NP ( PRP ) ) ( VP ( VBP ) ( VP ) ) ( . ) ),0.808414,6.0,False,True,"['include this musician called Kirk Hammett in my playlist Party', 'Can you tell me the current temperature in Pesotum?']","{'( S ( VP ( VB ) ( NP ) ) )': 5.0, '( SQ ( MD ) ( NP ( PRP ) ) ( VP ( VB ) ( NP ) ( NP ) ) ( . ) )': 5.0}",False
I want to put a copy of this tune into Skatepark Punks,( S ( NP ( PRP ) ) ( VP ( VBP ) ( S ) ) ),AddToPlaylist,29,SNIPS,Please enable an option where I am able add background music from my library collection,( VP ( UH ) ( VP ( VB ) ( NP ) ) ),0.8495064,5.0,False,True,"['Discover the trending photos marked with #LOVE', 'Can you find me the most recent scientific publication about Machine Learning?']","{'( S ( VP ( VB ) ( NP ) ) )': 2.0, '( SQ ( MD ) ( NP ( PRP ) ) ( VP ( VB ) ( NP ) ( NP ) ) ( . ) )': 6.0}",True
"I would give With Lee in Virginia, A Story of the American Civil War chronicle 4 of 6",( S ( NP ( PRP ) ) ( VP ( MD ) ( VP ) ) ),RateBook,30,SNIPS,"In a collection of six books about different aspects of the American Civil War, With Lee In Virginia has been placed at position number four.","( S ( PP ( IN ) ( NP ) ) ( , ) ( SBAR ( IN ) ( S ) ) ( . ) )",0.8557353,8.0,False,True,"['locate Fox Theatres that show The Caretaker', 'Can you tell me the weather forecast for Harrison-Crawford State Forest?']","{'( S ( VP ( VB ) ( NP ) ) )': 6.0, '( SQ ( MD ) ( NP ( PRP ) ) ( VP ( VB ) ( NP ) ( NP ) ) ( . ) )': 9.0}",False
Rate this album two out of 6,( S ( VP ( VB ) ( NP ) ( NP ) ) ),RateBook,31,SNIPS,How interesting do you find the content presented in that LP? Assigning it zero if not interested at all up to seven if very interested. My rate is number four indeed.,( S ( SBARQ ( WHADJP ) ( SQ ) ( . ) ) ( VP ( VBG ) ( NP ) ( ADVP ) ( SBAR ) ) ( . ) ( NP ( PRP$ ) ( NN ) ) ( VP ( VBZ ) ( NP ) ( ADVP ) ) ( . ) ),0.80756843,16.0,False,True,"['Discover the most popular images with the #LOVE tag', 'Could you show me 5 conference articles on the topic of text mining?']","{'( S ( VP ( VB ) ( NP ) ) )': 16.0, '( SQ ( MD ) ( NP ( PRP ) ) ( VP ( VB ) ( NP ) ( NP ) ) ( . ) )': 15.0}",False
Give the current part of the saga 4 points out of 6.,( S ( VP ( VB ) ( NP ) ( NP ) ) ( . ) ),RateBook,32,SNIPS,Rate this chapter within the ongoing tale on a scale from one to six. Assign four points based on your assessment criteria.,( S ( S ( VP ) ) ( . ) ( VP ( VB ) ( NP ) ) ( . ) ),0.86968946,3.0,False,True,"['find all the airlines that fly from Boston to Denver', 'Can you tell me the meaning of ls?']","{'( S ( VP ( VB ) ( NP ) ) )': 3.0, '( SQ ( MD ) ( NP ( PRP ) ) ( VP ( VB ) ( NP ) ( NP ) ) ( . ) )': 5.0}",True
Can you play some fifties music by lavern baker,( SQ ( MD ) ( NP ( PRP ) ) ( VP ( VB ) ( NP ) ( PP ) ) ),PlayMusic,33,SNIPS,I'm curious if there are any famous Lavarn Baker hits during her peak years around top fifty rock n roll,( S ( NP ( PRP ) ) ( VP ( VBP ) ( ADJP ) ( SBAR ) ) ),0.8284056,5.0,False,True,"['Find videos about cooking', 'Can you find me the most recent scientific publication about Machine Learning?']","{'( S ( VP ( VB ) ( NP ) ) )': 5.0, '( SQ ( MD ) ( NP ( PRP ) ) ( VP ( VB ) ( NP ) ( NP ) ) ( . ) )': 6.0}",False
Play a 1964 track from Shahram Nazeri on Pandora.,( S ( VP ( VB ) ( NP ) ) ( . ) ),PlayMusic,34,SNIPS,I would love for my auditory senses to experience captivating melodies popularized decades ago - one possibility includes turning up tracks performed professionally within Persian domains utilizing tuned instruments likely found alongside Oriental origins,( S ( NP ( PRP ) ) ( VP ( MD ) ( VP ) ) ),0.83889157,5.0,False,True,"['list all the airlines that have flights from boston to atlanta', 'Can you show me the best three convenience stores around Newtown?']","{'( S ( VP ( VB ) ( NP ) ) )': 4.0, '( SQ ( MD ) ( NP ( PRP ) ) ( VP ( VB ) ( NP ) ( NP ) ) ( . ) )': 6.0}",False
Please play me some Satire music,( S ( X ( UH ) ) ( VP ( VB ) ( NP ) ( NP ) ) ),PlayMusic,35,SNIPS,Could I have a playlist with humoristic or satirical content please?,( SQ ( MD ) ( NP ( PRP ) ) ( VP ( VB ) ( NP ) ( ADVP ) ) ( . ) ),0.85138166,6.0,False,True,"['Discover the most popular images with the #LOVE tag', 'Can you tell me the cheapest price for a flight from Denver to Pittsburgh?']","{'( S ( VP ( VB ) ( NP ) ) )': 6.0, '( SQ ( MD ) ( NP ( PRP ) ) ( VP ( VB ) ( NP ) ( NP ) ) ( . ) )': 1.0}",True
When is Crime and Punishment U.S.A. showing?,( SBARQ ( WHADVP ( WRB ) ) ( SQ ( VBZ ) ( NP ) ( VP ) ) ( . ) ),SearchScreeningEvent,36,SNIPS,What are the show timings of their production 'Crime And punishment Usa'?,( SBARQ ( WHNP ( WP ) ) ( VP ( VBP ) ( NP ) ) ( '' ) ( . ) ),0.8681217,6.0,False,True,"['Retrieve a handful of lovely photographs that match Opera House, measuring 1024 pixels in width and 768 pixels in height', 'Can you tell me the proximity of the closest taxi?']","{'( S ( VP ( VB ) ( NP ) ) )': 6.0, '( SQ ( MD ) ( NP ( PRP ) ) ( VP ( VB ) ( NP ) ( NP ) ) ( . ) )': 7.0}",False
find Fox Theatres with The Caretaker,( S ( VP ( VB ) ( NP ) ( PP ) ) ),SearchScreeningEvent,37,SNIPS,I am looking for venues screening playwright starring person who looks after someone in charge of building in Foxy Theater.,( S ( NP ( PRP ) ) ( VP ( VBP ) ( VP ) ) ( . ) ),0.82974505,6.0,False,True,"['locate Fox Theatres that are currently presenting The Caretaker', 'Can you find me a pub with Italian dressing where I can host a party for 5 people on February 11, 2033?']","{'( S ( VP ( VB ) ( NP ) ) )': 5.0, '( SQ ( MD ) ( NP ( PRP ) ) ( VP ( VB ) ( NP ) ( NP ) ) ( . ) )': 5.0}",False
I would like to watch The Wedding Ring at the movie theatre,( S ( NP ( PRP ) ) ( VP ( MD ) ( VP ) ) ),SearchScreeningEvent,38,SNIPS,I'm looking forward to seeing 'The Marriage Circle'. Do you have info about its showings?,( S ( NP ( PRP ) ) ( VP ( VP ) ( '' ) ) ( . ) ( SQ ( VBP ) ( NP ) ( VP ) ) ( . ) ),0.86668134,8.0,False,True,"['Find videos on cooking', 'Can you find me a pub that serves Italian dressing for a group of 5 people on February 11, 2033?']","{'( S ( VP ( VB ) ( NP ) ) )': 10.0, '( SQ ( MD ) ( NP ( PRP ) ) ( VP ( VB ) ( NP ) ( NP ) ) ( . ) )': 9.0}",False
I want to read the book The Lion Sleeps Tonight,( S ( NP ( PRP ) ) ( VP ( VBP ) ( S ) ) ),SearchCreativeWork,39,SNIPS,Please enable me to read the literary work known as 'The lion sleeps tonight',( S ( X ( UH ) ) ( VP ( VB ) ( NP ) ( S ) ) ( '' ) ),0.90576744,5.0,False,True,"['Find the trending photos tagged as #LOVE', 'Can you tell me the weather forecast for Harrison-Crawford State Forest?']","{'( S ( VP ( VB ) ( NP ) ) )': 3.0, '( SQ ( MD ) ( NP ( PRP ) ) ( VP ( VB ) ( NP ) ( NP ) ) ( . ) )': 6.0}",True
Where can I buy a used copy of the game called I Lie Around?,( SBARQ ( WHADVP ( WRB ) ) ( SQ ( MD ) ( NP ) ( VP ) ) ( . ) ),SearchCreativeWork,41,SNIPS,I am interested in acquiring/sourcing retailers/finding establishments(suppose in great condition)a second-hand/buying - It is entitlted or referred as: 'Lying about'.,( S ( NP ( PRP ) ) ( VP ( VBP ) ( ADJP ) ) ( . ) ),0.8218129,7.0,False,True,"['Locate the most popular pictures with the #LOVE tag', 'Can you find me a copy of The Lion Sleeps Tonight book?']","{'( S ( VP ( VB ) ( NP ) ) )': 5.0, '( SQ ( MD ) ( NP ( PRP ) ) ( VP ( VB ) ( NP ) ( NP ) ) ( . ) )': 5.0}",False
please give me the cheapest flight from denver to pittsburgh,( S ( X ( UH ) ) ( VP ( VB ) ( NP ) ( NP ) ) ),flight,42,ATIS,Could I have some help in finding reasonably priced air travel options.,( SQ ( MD ) ( NP ( PRP ) ) ( VP ( VB ) ( NP ) ( PP ) ) ( . ) ),0.85893077,6.0,False,True,"['Locate the top-rated pictures that are labeled with #LOVE', 'Can you show me the top three convenience stores close to Newtown?']","{'( S ( VP ( VB ) ( NP ) ) )': 6.0, '( SQ ( MD ) ( NP ( PRP ) ) ( VP ( VB ) ( NP ) ( NP ) ) ( . ) )': 1.0}",True
i want to fly from milwaukee to orlando on either wednesday evening or thursday morning,( S ( NP ( PRP ) ) ( VP ( VBP ) ( S ) ) ),flight,43,ATIS,Finding flights that go between Milwaukee and Orlando is what I'm after. My preferred departure times are either Wednesday evening or Thursday morning.,( S ( S ( S ) ( VP ) ) ( . ) ( S ( NP ) ( VP ) ) ( . ) ),0.90391886,5.0,False,True,"['discover places with Join the Dots: B-sides and Rarities', 'Can you find me the most recent scientific paper about Machine Learning?']","{'( S ( VP ( VB ) ( NP ) ) )': 5.0, '( SQ ( MD ) ( NP ( PRP ) ) ( VP ( VB ) ( NP ) ( NP ) ) ( . ) )': 7.0}",False
what is the lowest fare from denver to pittsburgh,( SBAR ( WHNP ( WP ) ) ( S ( VP ) ) ),airfare,44,ATIS,Could you inform me about the least costly fare from Denver heading towards Pittsburgh?,( SQ ( MD ) ( NP ( PRP ) ) ( VP ( VB ) ( NP ) ( PP ) ) ( . ) ),0.8837525,8.0,False,True,"['Retrieve several high-quality photographs that are similar to Opera House and have a size of 1024 pixels by 768 pixels', 'Can you tell me the lowest cost for a single journey from Boston to Baltimore?']","{'( S ( VP ( VB ) ( NP ) ) )': 6.0, '( SQ ( MD ) ( NP ( PRP ) ) ( VP ( VB ) ( NP ) ( NP ) ) ( . ) )': 1.0}",True
what is the cheapest one way fare from boston to baltimore,( SBARQ ( WHNP ( WP ) ) ( S ( VP ) ) ),airfare,45,ATIS,Could you find me the least costly fare for going one way from Boston to Baltimore?,( SQ ( MD ) ( NP ( PRP ) ) ( VP ( VB ) ( S ) ) ( . ) ),0.90295297,6.0,False,True,"['locate Fox Theatres that show The Caretaker', ""Can you give me the reviews for the McDonald's located at Kensington st.?""]","{'( S ( VP ( VB ) ( NP ) ) )': 6.0, '( SQ ( MD ) ( NP ( PRP ) ) ( VP ( VB ) ( NP ) ( NP ) ) ( . ) )': 2.0}",True
what is the ground transportation from oakland to san francisco,( SBARQ ( WHNP ( WP ) ) ( S ( VP ) ) ),ground_service,46,ATIS,what are the transportation options from oakland to san francisco?,( SBARQ ( WHNP ( WP ) ) ( SQ ( SQ ) ) ( . ) ),0.94802123,3.0,False,True,"['locate Fox Theatres featuring The Caretaker', 'Can you show me the most recent scientific paper on Machine Learning?']","{'( S ( VP ( VB ) ( NP ) ) )': 6.0, '( SQ ( MD ) ( NP ( PRP ) ) ( VP ( VB ) ( NP ) ( NP ) ) ( . ) )': 8.0}",False
can i get a rental car in dallas,( SQ ( MD ) ( NP ( PRP ) ) ( VP ( VB ) ( NP ) ( PP ) ) ),ground_service,47,ATIS,I need assistance with finding an automobile i can temporarily obtain while visiting dallas.,( S ( NP ( PRP ) ) ( VP ( VBP ) ( NP ) ) ( . ) ),0.8975597,5.0,False,True,"['find albums with B-sides and Rarities from Join the Dots', 'Can you give me information about three barbershops located in Newtown?']","{'( S ( VP ( VB ) ( NP ) ) )': 4.0, '( SQ ( MD ) ( NP ( PRP ) ) ( VP ( VB ) ( NP ) ( NP ) ) ( . ) )': 4.0}",False
what airlines fly between boston and atlanta,( SBAR ( WHNP ( WP ) ) ( S ( NP ) ( VP ) ) ),airline,48,ATIS,Could you tell me which airlines serve the route from Boston to Atlanta?,( SQ ( MD ) ( NP ( PRP ) ) ( VP ( VB ) ( NP ) ( SBAR ) ) ( . ) ),0.87863857,8.0,False,True,"['find showtimes for the movie The Caretaker at Fox Theatres', 'Can you tell me the weather forecast for Harrison-Crawford State Forest?']","{'( S ( VP ( VB ) ( NP ) ) )': 6.0, '( SQ ( MD ) ( NP ( PRP ) ) ( VP ( VB ) ( NP ) ( NP ) ) ( . ) )': 1.0}",True
show me the airlines between boston and denver,( S ( VP ( VB ) ( S ) ) ),airline,49,ATIS,"Discover any possible alternatives when it comes to airline companies flying passengers back and forth between both boston city located in Massachusetts state U.S.A., including denver City found situated within Colorado State United States America.",( S ( VP ( VB ) ( NP ) ( SBAR ) ) ( . ) ),0.8579256,3.0,False,True,"['Find several beautiful images that match Opera House and have dimensions of 1024px * 768px', 'Can you tell me the current temperature in Pesotum?']","{'( S ( VP ( VB ) ( NP ) ) )': 2.0, '( SQ ( MD ) ( NP ( PRP ) ) ( VP ( VB ) ( NP ) ( NP ) ) ( . ) )': 5.0}",True
