input_utterance,intent,parameters,utterance_template,source,seed_id,selected_templates,selected_templates_related_paraphrases,p1,p1_template,p1_ted_to_selected_templates,p1_is_similar,p2,p2_template,p2_ted_to_selected_templates,p2_is_similar,p3,p3_template,p3_ted_to_selected_templates,p3_is_similar,p4,p4_template,p4_ted_to_selected_templates,p4_is_similar,p5,p5_template,p5_ted_to_selected_templates,p5_is_similar,p6,p6_template,p6_ted_to_selected_templates,p6_is_similar,p7,p7_template,p7_ted_to_selected_templates,p7_is_similar,p8,p8_template,p8_ted_to_selected_templates,p8_is_similar
How hot is it in Pesotum,GetWeather,"[['condition_temperature', 'hot'], ['city', 'Pesotum']]",( SBARQ ( WHADJP ( WRB ) ( JJ ) ) ( VP ( VBZ ) ( NP ) ( PP ) ) ),SNIPS,23,"['( S ( VP ( VB ) ( NP ) ) )', '( SQ ( MD ) ( NP ( PRP ) ) ( VP ( VB ) ( NP ) ( NP ) ) ( . ) )']","['find a screening of The Caretaker at Fox Theatres', 'Can you tell me the weather forecast for Harrison-Crawford State Forest?']",What is the temperature in Pesotum?,( SBARQ ( WHNP ( WP ) ) ( SQ ( VBZ ) ( NP ) ( PP ) ) ( . ) ),"{'( S ( VP ( VB ) ( NP ) ) )': 7.0, '( SQ ( MD ) ( NP ( PRP ) ) ( VP ( VB ) ( NP ) ( NP ) ) ( . ) )': 7.0}",False,Could you tell me the current temperature in Pesotum?,( SQ ( MD ) ( NP ( PRP ) ) ( VP ( VB ) ( NP ) ( NP ) ) ( . ) ),"{'( S ( VP ( VB ) ( NP ) ) )': 6.0, '( SQ ( MD ) ( NP ( PRP ) ) ( VP ( VB ) ( NP ) ( NP ) ) ( . ) )': 0.0}",True,I would like to know how hot it is in Pesotum.,( S ( NP ( PRP ) ) ( VP ( MD ) ( VP ) ) ( . ) ),"{'( S ( VP ( VB ) ( NP ) ) )': 5.0, '( SQ ( MD ) ( NP ( PRP ) ) ( VP ( VB ) ( NP ) ( NP ) ) ( . ) )': 5.0}",False,Tell me the level of heat in Pesotum.,( S ( VP ( VB ) ( NP ) ( NP ) ) ( . ) ),"{'( S ( VP ( VB ) ( NP ) ) )': 2.0, '( SQ ( MD ) ( NP ( PRP ) ) ( VP ( VB ) ( NP ) ( NP ) ) ( . ) )': 4.0}",True,Is there any weather data available for Pesotum?,( SQ ( VBZ ) ( NP ( EX ) ) ( NP ( DT ) ( NN ) ( NNS ) ) ( ADJP ( JJ ) ( PP ) ) ( . ) ),"{'( S ( VP ( VB ) ( NP ) ) )': 11.0, '( SQ ( MD ) ( NP ( PRP ) ) ( VP ( VB ) ( NP ) ( NP ) ) ( . ) )': 9.0}",False,Can you inform me about the degree of heat in Pesotum?,( SQ ( MD ) ( NP ( PRP ) ) ( VP ( VB ) ( NP ) ( PP ) ) ( . ) ),"{'( S ( VP ( VB ) ( NP ) ) )': 6.0, '( SQ ( MD ) ( NP ( PRP ) ) ( VP ( VB ) ( NP ) ( NP ) ) ( . ) )': 1.0}",True,Please provide information on the current temperature in Pesotum.,( S ( INTJ ( UH ) ) ( VP ( VB ) ( NP ) ) ( . ) ),"{'( S ( VP ( VB ) ( NP ) ) )': 3.0, '( SQ ( MD ) ( NP ( PRP ) ) ( VP ( VB ) ( NP ) ( NP ) ) ( . ) )': 5.0}",True,I'm interested to know about the warmth level at Pesotom.,( S ( NP ( PRP ) ) ( VP ( VBP ) ( ADJP ) ) ( . ) ),"{'( S ( VP ( VB ) ( NP ) ) )': 5.0, '( SQ ( MD ) ( NP ( PRP ) ) ( VP ( VB ) ( NP ) ( NP ) ) ( . ) )': 5.0}",False
"I would like to go to a pub that has italian dressing for a party of 5 on February 11, 2033",BookRestaurant,"[['restaurant_type', 'pub'], ['served_dish', 'italian dressing'], ['party_size_number', '5'], ['timeRange', 'February 11, 2033']]",( S ( NP ( PRP ) ) ( VP ( MD ) ( VP ) ) ),SNIPS,24,"['( S ( VP ( VB ) ( NP ) ) )', '( SQ ( MD ) ( NP ( PRP ) ) ( VP ( VB ) ( NP ) ( NP ) ) ( . ) )']","['Find videos on cooking', 'Can you find me the most recent scientific publication about Machine Learning?']","Could you locate a bar that serves Italian dressing for a gathering of 5 people on February 11, 2033?",( SQ ( MD ) ( NP ( PRP ) ) ( VP ( VB ) ( NP ) ) ( . ) ),"{'( S ( VP ( VB ) ( NP ) ) )': 5.0, '( SQ ( MD ) ( NP ( PRP ) ) ( VP ( VB ) ( NP ) ( NP ) ) ( . ) )': 1.0}",True,"Can you help me find a pub where I can get Italian dressing for my party of five on February the eleventh, two thousand and thirty-three?",( SQ ( MD ) ( NP ( PRP ) ) ( VP ( VB ) ( S ) ) ( . ) ),"{'( S ( VP ( VB ) ( NP ) ) )': 6.0, '( SQ ( MD ) ( NP ( PRP ) ) ( VP ( VB ) ( NP ) ( NP ) ) ( . ) )': 2.0}",True,I'm looking for a tavern that offers Italian dressing to accommodate five guests on February the eleventh in the year two thousand and thirty-three.,( S ( NP ( PRP ) ) ( VP ( VBP ) ( VP ) ) ( . ) ),"{'( S ( VP ( VB ) ( NP ) ) )': 5.0, '( SQ ( MD ) ( NP ( PRP ) ) ( VP ( VB ) ( NP ) ( NP ) ) ( . ) )': 5.0}",False,"Is it possible to find me a pub that caters to parties of five with Italian dressing available, specifically on February eleven, twenty-thirty-three?",( SQ ( VBZ ) ( NP ( NP ) ) ( ADJP ( JJ ) ) ( S ( VP ) ) ( . ) ),"{'( S ( VP ( VB ) ( NP ) ) )': 7.0, '( SQ ( MD ) ( NP ( PRP ) ) ( VP ( VB ) ( NP ) ( NP ) ) ( . ) )': 7.0}",False,I am interested in finding a pub where I can go with four others and enjoy some delicious Italian dressing. The date we are planning is February eleven in twenty thirty three.,( S ( S ( NP ) ( VP ) ) ( . ) ( S ( NP ) ( VP ) ) ( . ) ),"{'( S ( VP ( VB ) ( NP ) ) )': 6.0, '( SQ ( MD ) ( NP ( PRP ) ) ( VP ( VB ) ( NP ) ( NP ) ) ( . ) )': 7.0}",False,Can you assist me in locating an establishment serving italian salad sauce suitable for my group of friends consisting of five people? The event will take place on the eleventh day of february in the year two zero three three.,( S ( SQ ( MD ) ( NP ) ( VP ) ) ( . ) ( S ( NP ) ( VP ) ) ( . ) ),"{'( S ( VP ( VB ) ( NP ) ) )': 7.0, '( SQ ( MD ) ( NP ( PRP ) ) ( VP ( VB ) ( NP ) ( NP ) ) ( . ) )': 7.0}",False,Do you have any recommendations for pubs offering italian dressings? My party would consistantly be composed by about five individuals. We aim at going there during Feburary Eqleveniorigone,( S ( SQ ( VBP ) ( NP ) ( VP ) ) ( . ) ( S ( NP ) ( VP ) ) ( . ) ( S ( NP ) ( VP ) ) ),"{'( S ( VP ( VB ) ( NP ) ) )': 9.0, '( SQ ( MD ) ( NP ( PRP ) ) ( VP ( VB ) ( NP ) ( NP ) ) ( . ) )': 10.0}",False,What are some good bars or clubs offering accomodations and menu items such as italian sauces drippers being knowning how costly one goes being partied-for-Feb-1st-2033th?,( S ( SBARQ ( WHNP ) ( S ) ) ( NP ( NNS ) ) ( VP ( VBG ) ( VP ) ) ( . ) ),"{'( S ( VP ( VB ) ( NP ) ) )': 7.0, '( SQ ( MD ) ( NP ( PRP ) ) ( VP ( VB ) ( NP ) ( NP ) ) ( . ) )': 7.0}",False
Book a taverna in Equatorial Guinea this month for nine people.,BookRestaurant,"[['restaurant_type', 'taverna'], ['country', 'Equatorial Guinea'], ['timeRange', 'this month'], ['party_size_number', 'nine']]",( S ( VP ( VB ) ( NP ) ( NP ) ( PP ) ) ( . ) ),SNIPS,25,"['( S ( VP ( VB ) ( NP ) ) )', '( SQ ( MD ) ( NP ( PRP ) ) ( VP ( VB ) ( NP ) ( NP ) ) ( . ) )']","['find places that have Join the Dots: B-sides and Rarities', ""Can you give me the reviews for the McDonald's located at Kensington st.?""]",Find a taverna for nine people in Equatorial Guinea this month.,( S ( VP ( VB ) ( NP ) ( NP ) ) ( . ) ),"{'( S ( VP ( VB ) ( NP ) ) )': 2.0, '( SQ ( MD ) ( NP ( PRP ) ) ( VP ( VB ) ( NP ) ( NP ) ) ( . ) )': 4.0}",True,Reserve a table at a taverna in Equatorial Guinea for nine people this month.,( S ( VP ( VB ) ( NP ) ) ( . ) ),"{'( S ( VP ( VB ) ( NP ) ) )': 1.0, '( SQ ( MD ) ( NP ( PRP ) ) ( VP ( VB ) ( NP ) ( NP ) ) ( . ) )': 5.0}",True,Can you make a reservation for me at a taverna in Equatorial Guinea this month? We'll be nine people.,( S ( SQ ( MD ) ( NP ) ( VP ) ) ( . ) ( NP ( PRP ) ) ( VP ( MD ) ( VP ) ) ( . ) ),"{'( S ( VP ( VB ) ( NP ) ) )': 10.0, '( SQ ( MD ) ( NP ( PRP ) ) ( VP ( VB ) ( NP ) ( NP ) ) ( . ) )': 8.0}",False,I would like to book a table at an eatery in Equatorial Guinea for the current month. It should have room for nine individuals.,( S ( S ( NP ) ( VP ) ) ( . ) ( S ( NP ) ( VP ) ) ( . ) ),"{'( S ( VP ( VB ) ( NP ) ) )': 6.0, '( SQ ( MD ) ( NP ( PRP ) ) ( VP ( VB ) ( NP ) ( NP ) ) ( . ) )': 7.0}",False,"This is going to sound weird, but can you help me find a place where I can eat Italian food with eight other friends of mine? The place has to be situated somewhere around here, specifically in Equatorial Guinea and it must be open sometime within the next thirty days?","( S ( S ( NP ) ( VP ) ) ( , ) ( CC ) ( SQ ( MD ) ( NP ) ( VP ) ) ( . ) ( S ( NP ) ( VP ) ) ( CC ) ( S ( NP ) ( VP ) ) ( . ) )","{'( S ( VP ( VB ) ( NP ) ) )': 14.0, '( SQ ( MD ) ( NP ( PRP ) ) ( VP ( VB ) ( NP ) ( NP ) ) ( . ) )': 13.0}",False,Do you have any suggestions on where I can eat out with my family of 9 while we're visiting Equatorial Guinea this month?,( SQ ( VBP ) ( NP ( PRP ) ) ( VP ( VB ) ( NP ) ) ( . ) ),"{'( S ( VP ( VB ) ( NP ) ) )': 5.0, '( SQ ( MD ) ( NP ( PRP ) ) ( VP ( VB ) ( NP ) ( NP ) ) ( . ) )': 2.0}",True,"I need assistance. Could you please find me an available seating area for myself and eight others at one of the local restaurants here, specifically those situated within the country of Equtorial Guineu? Can these reservations please be made sometime during what remains of our current calendar time period?",( S ( NP ( PRP ) ) ( VP ( VBP ) ( NP ) ) ( . ) ( SQ ( MD ) ( NP ) ( VP ) ) ( . ) ),"{'( S ( VP ( VB ) ( NP ) ) )': 9.0, '( SQ ( MD ) ( NP ( PRP ) ) ( VP ( VB ) ( NP ) ( NP ) ) ( . ) )': 9.0}",False,Can you do me favor by organizing dinner reservations that could comfortably accommodate my party size - which numbers 9 people - within some location or vicinity known as 'Equator'? These plans should fall under either 'this upcoming lunar cycle' or alternately 'within several weeks after today's date'.,( S ( SQ ( MD ) ( NP ) ( VP ) ) ( . ) ( NP ( DT ) ( NNS ) ) ( VP ( MD ) ( VP ) ) ( '' ) ( . ) ),"{'( S ( VP ( VB ) ( NP ) ) )': 12.0, '( SQ ( MD ) ( NP ( PRP ) ) ( VP ( VB ) ( NP ) ( NP ) ) ( . ) )': 11.0}",False
Book a table for eight people please,BookRestaurant,"[['party_size_number', 'eight']]",( S ( VP ( VB ) ( NP ) ( ADVP ) ) ),SNIPS,26,"['( S ( VP ( VB ) ( NP ) ) )', '( SQ ( MD ) ( NP ( PRP ) ) ( VP ( VB ) ( NP ) ( NP ) ) ( . ) )']","['Discover tutorials on cooking', 'Can you tell me the current temperature in Pesotum?']",Please reserve a table for a party of eight.,( S ( NP ( UH ) ) ( VP ( VB ) ( NP ) ) ( . ) ),"{'( S ( VP ( VB ) ( NP ) ) )': 3.0, '( SQ ( MD ) ( NP ( PRP ) ) ( VP ( VB ) ( NP ) ( NP ) ) ( . ) )': 4.0}",True,"I would like to make a reservation for eight people, please.",( S ( NP ( PRP ) ) ( VP ( MD ) ( VP ) ) ( . ) ),"{'( S ( VP ( VB ) ( NP ) ) )': 5.0, '( SQ ( MD ) ( NP ( PRP ) ) ( VP ( VB ) ( NP ) ( NP ) ) ( . ) )': 5.0}",False,Could you book a table for eight individuals?,( SQ ( MD ) ( NP ( PRP ) ) ( VP ( VB ) ( NP ) ) ( . ) ),"{'( S ( VP ( VB ) ( NP ) ) )': 5.0, '( SQ ( MD ) ( NP ( PRP ) ) ( VP ( VB ) ( NP ) ( NP ) ) ( . ) )': 1.0}",True,Is it possible to reserve seating for eight?,( SQ ( VBZ ) ( NP ( NP ) ) ( ADJP ( JJ ) ) ( S ( VP ) ) ( . ) ),"{'( S ( VP ( VB ) ( NP ) ) )': 7.0, '( SQ ( MD ) ( NP ( PRP ) ) ( VP ( VB ) ( NP ) ( NP ) ) ( . ) )': 7.0}",False,May I request a table for a group of eight?,( SQ ( MD ) ( NP ( PRP ) ) ( VP ( VB ) ( NP ) ) ( . ) ),"{'( S ( VP ( VB ) ( NP ) ) )': 5.0, '( SQ ( MD ) ( NP ( PRP ) ) ( VP ( VB ) ( NP ) ( NP ) ) ( . ) )': 1.0}",True,"Can you arrange seating for me and seven other people, please?","( SQ ( MD ) ( NP ( PRP ) ) ( VP ( VB ) ( NP ) ( , ) ( INTJ ) ) ( . ) )","{'( S ( VP ( VB ) ( NP ) ) )': 7.0, '( SQ ( MD ) ( NP ( PRP ) ) ( VP ( VB ) ( NP ) ( NP ) ) ( . ) )': 2.0}",True,Would it be possible to secure reservations for an octet?,( SQ ( MD ) ( NP ( NP ) ) ( VP ( VB ) ( ADJP ) ( S ) ) ( . ) ),"{'( S ( VP ( VB ) ( NP ) ) )': 6.0, '( SQ ( MD ) ( NP ( PRP ) ) ( VP ( VB ) ( NP ) ( NP ) ) ( . ) )': 3.0}",True,Is there availability to book a table that can accommodate up to eight guests?,( SQ ( VBZ ) ( NP ( EX ) ) ( NP ( NN ) ) ( S ( VP ) ) ( . ) ),"{'( S ( VP ( VB ) ( NP ) ) )': 7.0, '( SQ ( MD ) ( NP ( PRP ) ) ( VP ( VB ) ( NP ) ( NP ) ) ( . ) )': 6.0}",False
Please add Ruud Jolie to my playlist Guest List Polygon,AddToPlaylist,"[['artist', 'Ruud Jolie'], ['playlist_owner', 'my'], ['playlist', 'Guest List Polygon']]",( S ( X ( UH ) ) ( VP ( VB ) ( NP ) ( PP ) ) ),SNIPS,27,"['( S ( VP ( VB ) ( NP ) ) )', '( SQ ( MD ) ( NP ( PRP ) ) ( VP ( VB ) ( NP ) ( NP ) ) ( . ) )']","['Find videos about cooking', 'Could you give me an update on the weather conditions at Harrison-Crawford State Forest?']",Can you please find Italian food places for me?,( SQ ( MD ) ( NP ( PRP ) ) ( VP ( UH ) ( VP ) ) ( . ) ),"{'( S ( VP ( VB ) ( NP ) ) )': 7.0, '( SQ ( MD ) ( NP ( PRP ) ) ( VP ( VB ) ( NP ) ( NP ) ) ( . ) )': 3.0}",True,I would like to know where I can find Italian cuisine.,( S ( NP ( PRP ) ) ( VP ( MD ) ( VP ) ) ( . ) ),"{'( S ( VP ( VB ) ( NP ) ) )': 5.0, '( SQ ( MD ) ( NP ( PRP ) ) ( VP ( VB ) ( NP ) ( NP ) ) ( . ) )': 5.0}",False,Help me locate restaurants that serve Italian dishes.,( S ( VP ( VB ) ( NP ) ( S ) ) ( . ) ),"{'( S ( VP ( VB ) ( NP ) ) )': 1.0, '( SQ ( MD ) ( NP ( PRP ) ) ( VP ( VB ) ( NP ) ( NP ) ) ( . ) )': 5.0}",True,Is there any place nearby where I can eat Italian food?,( SQ ( VBZ ) ( NP ( EX ) ) ( NP ( NP ) ( ADVP ) ) ( SBAR ( WHADVP ) ( S ) ) ( . ) ),"{'( S ( VP ( VB ) ( NP ) ) )': 9.0, '( SQ ( MD ) ( NP ( PRP ) ) ( VP ( VB ) ( NP ) ( NP ) ) ( . ) )': 7.0}",False,Tell me about restaurants that have a menu of Italian dishes.,( S ( VP ( VB ) ( NP ) ( PP ) ) ( . ) ),"{'( S ( VP ( VB ) ( NP ) ) )': 2.0, '( SQ ( MD ) ( NP ( PRP ) ) ( VP ( VB ) ( NP ) ( NP ) ) ( . ) )': 5.0}",True,I am interested in finding places that offer Italian cuisine.,( S ( NP ( PRP ) ) ( VP ( VBP ) ( ADJP ) ) ( . ) ),"{'( S ( VP ( VB ) ( NP ) ) )': 5.0, '( SQ ( MD ) ( NP ( PRP ) ) ( VP ( VB ) ( NP ) ( NP ) ) ( . ) )': 5.0}",False,Do you know any good spots for eating authentic Italian food?,( SQ ( VBP ) ( NP ( PRP ) ) ( VP ( VB ) ( NP ) ) ( . ) ),"{'( S ( VP ( VB ) ( NP ) ) )': 5.0, '( SQ ( MD ) ( NP ( PRP ) ) ( VP ( VB ) ( NP ) ( NP ) ) ( . ) )': 2.0}",True,"Could you recommend some places serving up delicious, traditionalItalian fare?",( SQ ( MD ) ( NP ( PRP ) ) ( VP ( VB ) ( NP ) ) ( . ) ),"{'( S ( VP ( VB ) ( NP ) ) )': 5.0, '( SQ ( MD ) ( NP ( PRP ) ) ( VP ( VB ) ( NP ) ( NP ) ) ( . ) )': 1.0}",True
add this artist named Kirk Hammett to my playlist Party,AddToPlaylist,"[['music_item', 'artist'], ['artist', 'Kirk Hammett'], ['playlist_owner', 'my'], ['playlist', 'Party']]",( S ( VP ( VB ) ( NP ) ( PP ) ) ),SNIPS,28,"['( S ( VP ( VB ) ( NP ) ) )', '( SQ ( MD ) ( NP ( PRP ) ) ( VP ( VB ) ( NP ) ( NP ) ) ( . ) )']","['find all the airlines that fly from Boston to Denver', 'Can you tell me the definition of ls?']",I want to include this musician called Kirk Hammett in my Party playlist.,( S ( NP ( PRP ) ) ( VP ( VBP ) ( S ) ) ( . ) ),"{'( S ( VP ( VB ) ( NP ) ) )': 5.0, '( SQ ( MD ) ( NP ( PRP ) ) ( VP ( VB ) ( NP ) ( NP ) ) ( . ) )': 5.0}",False,"Add Kirk Hammett, the artist, to my playlist with the name Party.",( S ( VP ( VB ) ( NP ) ( PP ) ( PP ) ) ( . ) ),"{'( S ( VP ( VB ) ( NP ) ) )': 3.0, '( SQ ( MD ) ( NP ( PRP ) ) ( VP ( VB ) ( NP ) ( NP ) ) ( . ) )': 6.0}",True,Incorporate this particular singer named Kirk Hammett into my Party playlist.,( S ( VP ( VB ) ( NP ) ) ( . ) ),"{'( S ( VP ( VB ) ( NP ) ) )': 1.0, '( SQ ( MD ) ( NP ( PRP ) ) ( VP ( VB ) ( NP ) ( NP ) ) ( . ) )': 5.0}",True,I would like to add an artist named Kirk Hammett to the playlist titled Party.,( S ( NP ( PRP ) ) ( VP ( MD ) ( VP ) ) ( . ) ),"{'( S ( VP ( VB ) ( NP ) ) )': 5.0, '( SQ ( MD ) ( NP ( PRP ) ) ( VP ( VB ) ( NP ) ( NP ) ) ( . ) )': 5.0}",False,Please include in my party music collection this artist known as Kirk Hammett.,( S ( NP ( UH ) ) ( VP ( VB ) ( PP ) ) ( . ) ),"{'( S ( VP ( VB ) ( NP ) ) )': 4.0, '( SQ ( MD ) ( NP ( PRP ) ) ( VP ( VB ) ( NP ) ( NP ) ) ( . ) )': 5.0}",False,I want you to add a musician called Kirk Hammett to the Party playlist on my device.,( S ( NP ( PRP ) ) ( VP ( VBP ) ( S ) ) ( . ) ),"{'( S ( VP ( VB ) ( NP ) ) )': 5.0, '( SQ ( MD ) ( NP ( PRP ) ) ( VP ( VB ) ( NP ) ( NP ) ) ( . ) )': 5.0}",False,Can you please put this person named Kirk Hattack thamet into the music list called Pah,( SQ ( MD ) ( NP ( PRP ) ) ( VP ( UH ) ( S ) ) ),"{'( S ( VP ( VB ) ( NP ) ) )': 5.0, '( SQ ( MD ) ( NP ( PRP ) ) ( VP ( VB ) ( NP ) ( NP ) ) ( . ) )': 4.0}",False,Incorporate a musical performer by name of 'Kirk Hamm'ett' within that list we call Partay.,( S ( S ( VP ) ) ( NP ( PRP ) ) ( VP ( VBP ) ( S ) ) ( . ) ),"{'( S ( VP ( VB ) ( NP ) ) )': 6.0, '( SQ ( MD ) ( NP ( PRP ) ) ( VP ( VB ) ( NP ) ( NP ) ) ( . ) )': 5.0}",False
I want to put a copy of this tune into Skatepark Punks,AddToPlaylist,"[['music_item', 'tune'], ['playlist', 'Skatepark Punks']]",( S ( NP ( PRP ) ) ( VP ( VBP ) ( S ) ) ),SNIPS,29,"['( S ( VP ( VB ) ( NP ) ) )', '( SQ ( MD ) ( NP ( PRP ) ) ( VP ( VB ) ( NP ) ( NP ) ) ( . ) )']","[""Drop a message to Phil indicating that I've got your back"", 'Can you tell me the weather forecast for Anston in colder temperatures?']",Can you add this song to Skatepark Punks?,( SQ ( MD ) ( NP ( PRP ) ) ( VP ( VB ) ( NP ) ( PP ) ) ( . ) ),"{'( S ( VP ( VB ) ( NP ) ) )': 6.0, '( SQ ( MD ) ( NP ( PRP ) ) ( VP ( VB ) ( NP ) ( NP ) ) ( . ) )': 1.0}",True,I'd like to upload a copy of this track to Skatepark Punks.,( S ( NP ( PRP ) ) ( VP ( MD ) ( VP ) ) ( . ) ),"{'( S ( VP ( VB ) ( NP ) ) )': 5.0, '( SQ ( MD ) ( NP ( PRP ) ) ( VP ( VB ) ( NP ) ( NP ) ) ( . ) )': 5.0}",False,Please place a duplicate of this melody in Skatepark Punks.,( S ( X ( UH ) ) ( VP ( VB ) ( NP ) ( PP ) ) ( . ) ),"{'( S ( VP ( VB ) ( NP ) ) )': 4.0, '( SQ ( MD ) ( NP ( PRP ) ) ( VP ( VB ) ( NP ) ( NP ) ) ( . ) )': 5.0}",False,Could you insert this tune into the playlist for Skatepark Punks?,( SQ ( MD ) ( NP ( PRP ) ) ( VP ( VB ) ( NP ) ( PP ) ) ( . ) ),"{'( S ( VP ( VB ) ( NP ) ) )': 6.0, '( SQ ( MD ) ( NP ( PRP ) ) ( VP ( VB ) ( NP ) ( NP ) ) ( . ) )': 1.0}",True,I'm interested in transferring a version of this music to Skatepark Punks.,( S ( NP ( PRP ) ) ( VP ( VBP ) ( ADJP ) ) ( . ) ),"{'( S ( VP ( VB ) ( NP ) ) )': 5.0, '( SQ ( MD ) ( NP ( PRP ) ) ( VP ( VB ) ( NP ) ( NP ) ) ( . ) )': 5.0}",False,Is it possible for me to include this song in the collection at Skatepark Punks?,( SQ ( VBZ ) ( NP ( NP ) ) ( ADJP ( JJ ) ) ( SBAR ( IN ) ( S ) ) ( . ) ),"{'( S ( VP ( VB ) ( NP ) ) )': 8.0, '( SQ ( MD ) ( NP ( PRP ) ) ( VP ( VB ) ( NP ) ( NP ) ) ( . ) )': 8.0}",False,Would it be okay if I placed a duplicate of this tune into the library at Skatepark Punks?,( SQ ( MD ) ( NP ( PRP ) ) ( VP ( VB ) ( ADJP ) ( SBAR ) ) ( . ) ),"{'( S ( VP ( VB ) ( NP ) ) )': 7.0, '( SQ ( MD ) ( NP ( PRP ) ) ( VP ( VB ) ( NP ) ( NP ) ) ( . ) )': 2.0}",True,Let's synchronize and put a copy of this track into Skate Park Punk.,( S ( VP ( VB ) ( S ) ) ( . ) ),"{'( S ( VP ( VB ) ( NP ) ) )': 2.0, '( SQ ( MD ) ( NP ( PRP ) ) ( VP ( VB ) ( NP ) ( NP ) ) ( . ) )': 6.0}",True
"I would give With Lee in Virginia, A Story of the American Civil War chronicle 4 of 6",RateBook,"[['object_name', 'With Lee in Virginia, A Story of the American Civil War'], ['object_part_of_series_type', 'chronicle'], ['rating_value', '4'], ['best_rating', '6']]",( S ( NP ( PRP ) ) ( VP ( MD ) ( VP ) ) ),SNIPS,30,"['( S ( VP ( VB ) ( NP ) ) )', '( SQ ( MD ) ( NP ( PRP ) ) ( VP ( VB ) ( NP ) ( NP ) ) ( . ) )']","['find albums with B-sides and Rarities from Join the Dots', 'Can you tell me the temperature in Pesotum?']",Could you locate restaurants that serve Italian cuisine?,( SQ ( MD ) ( NP ( PRP ) ) ( VP ( VB ) ( NP ) ) ( . ) ),"{'( S ( VP ( VB ) ( NP ) ) )': 5.0, '( SQ ( MD ) ( NP ( PRP ) ) ( VP ( VB ) ( NP ) ( NP ) ) ( . ) )': 1.0}",True,Where can I find places that offer Italian food?,( SBARQ ( WHADVP ( WRB ) ) ( SQ ( MD ) ( NP ) ( VP ) ) ( . ) ),"{'( S ( VP ( VB ) ( NP ) ) )': 7.0, '( SQ ( MD ) ( NP ( PRP ) ) ( VP ( VB ) ( NP ) ( NP ) ) ( . ) )': 7.0}",False,Can you help me discover establishments with Italian dishes?,( SQ ( MD ) ( NP ( PRP ) ) ( VP ( VB ) ( S ) ) ( . ) ),"{'( S ( VP ( VB ) ( NP ) ) )': 6.0, '( SQ ( MD ) ( NP ( PRP ) ) ( VP ( VB ) ( NP ) ( NP ) ) ( . ) )': 2.0}",True,I'm looking for restaurants serving authentic Italian meals.,( S ( NP ( PRP ) ) ( VP ( VBP ) ( VP ) ) ( . ) ),"{'( S ( VP ( VB ) ( NP ) ) )': 5.0, '( SQ ( MD ) ( NP ( PRP ) ) ( VP ( VB ) ( NP ) ( NP ) ) ( . ) )': 5.0}",False,Do you know any places specializing in Italian cuisine?,( SQ ( VBP ) ( NP ( PRP ) ) ( VP ( VB ) ( NP ) ) ( . ) ),"{'( S ( VP ( VB ) ( NP ) ) )': 5.0, '( SQ ( MD ) ( NP ( PRP ) ) ( VP ( VB ) ( NP ) ( NP ) ) ( . ) )': 2.0}",True,I would like to find eateries that serve Italian food.,( S ( NP ( PRP ) ) ( VP ( MD ) ( VP ) ) ( . ) ),"{'( S ( VP ( VB ) ( NP ) ) )': 5.0, '( SQ ( MD ) ( NP ( PRP ) ) ( VP ( VB ) ( NP ) ( NP ) ) ( . ) )': 5.0}",False,Are there any dining options that have an Italian menu available?,( SQ ( VBP ) ( NP ( EX ) ) ( NP ( NP ) ( SBAR ) ) ( . ) ),"{'( S ( VP ( VB ) ( NP ) ) )': 7.0, '( SQ ( MD ) ( NP ( PRP ) ) ( VP ( VB ) ( NP ) ( NP ) ) ( . ) )': 5.0}",False,"Can you suggest restaurants where I can try some delicious, traditional Italian dishes?",( SQ ( MD ) ( NP ( PRP ) ) ( VP ( VB ) ( NP ) ) ( . ) ),"{'( S ( VP ( VB ) ( NP ) ) )': 5.0, '( SQ ( MD ) ( NP ( PRP ) ) ( VP ( VB ) ( NP ) ( NP ) ) ( . ) )': 1.0}",True
Rate this album two out of 6,RateBook,"[['object_select', 'this'], ['object_type', 'album'], ['rating_value', 'two'], ['best_rating', '6']]",( S ( VP ( VB ) ( NP ) ( NP ) ) ),SNIPS,31,"['( S ( VP ( VB ) ( NP ) ) )', '( SQ ( MD ) ( NP ( PRP ) ) ( VP ( VB ) ( NP ) ( NP ) ) ( . ) )']","['Retrieve 5 conference articles that discuss text mining', 'Can you tell me the current temperature in Pesotum?']",Can you rate this album on a scale of 1 to 6?,( SQ ( MD ) ( NP ( PRP ) ) ( VP ( VB ) ( NP ) ( PP ) ) ( . ) ),"{'( S ( VP ( VB ) ( NP ) ) )': 6.0, '( SQ ( MD ) ( NP ( PRP ) ) ( VP ( VB ) ( NP ) ( NP ) ) ( . ) )': 1.0}",True,What rating would you give to this album out of a total of 6?,( SBARQ ( WHNP ( WDT ) ( NN ) ) ( SQ ( MD ) ( NP ) ( VP ) ) ( . ) ),"{'( S ( VP ( VB ) ( NP ) ) )': 8.0, '( SQ ( MD ) ( NP ( PRP ) ) ( VP ( VB ) ( NP ) ( NP ) ) ( . ) )': 8.0}",False,"On a scale from 1 to 6, please rate this album.","( S ( PP ( IN ) ( NP ) ) ( , ) ( UH ) ( VP ( VB ) ( NP ) ) ( . ) )","{'( S ( VP ( VB ) ( NP ) ) )': 6.0, '( SQ ( MD ) ( NP ( PRP ) ) ( VP ( VB ) ( NP ) ( NP ) ) ( . ) )': 7.0}",False,Please assign a rating between two and six for this album.,( S ( INTJ ( UH ) ) ( VP ( VB ) ( NP ) ( PP ) ) ( . ) ),"{'( S ( VP ( VB ) ( NP ) ) )': 4.0, '( SQ ( MD ) ( NP ( PRP ) ) ( VP ( VB ) ( NP ) ( NP ) ) ( . ) )': 5.0}",False,Could you let me know how you would rate this album out of six?,( SQ ( MD ) ( NP ( PRP ) ) ( VP ( VB ) ( S ) ) ( . ) ),"{'( S ( VP ( VB ) ( NP ) ) )': 6.0, '( SQ ( MD ) ( NP ( PRP ) ) ( VP ( VB ) ( NP ) ( NP ) ) ( . ) )': 2.0}",True,I'd like your opinion on the quality of this album on a six-point scale.,( S ( NP ( PRP ) ) ( VP ( MD ) ( VP ) ) ( . ) ),"{'( S ( VP ( VB ) ( NP ) ) )': 5.0, '( SQ ( MD ) ( NP ( PRP ) ) ( VP ( VB ) ( NP ) ( NP ) ) ( . ) )': 5.0}",False,"Out of six, what is the rating that should be given to this album?","( S ( PP ( IN ) ( PP ) ) ( , ) ( WHNP ( WP ) ) ( VP ( VBZ ) ( NP ) ) ( . ) )","{'( S ( VP ( VB ) ( NP ) ) )': 8.0, '( SQ ( MD ) ( NP ( PRP ) ) ( VP ( VB ) ( NP ) ( NP ) ) ( . ) )': 9.0}",False,I would appreciate it if you could provide your assessment for this particular album. The range can be from two up until six.,( S ( S ( NP ) ( VP ) ) ( . ) ( S ( NP ) ( VP ) ) ( . ) ),"{'( S ( VP ( VB ) ( NP ) ) )': 6.0, '( SQ ( MD ) ( NP ( PRP ) ) ( VP ( VB ) ( NP ) ( NP ) ) ( . ) )': 7.0}",False
