input_utterance,intent,parameters,utterance_template,source,seed_id,selected_templates,selected_templates_related_paraphrases,p1,p1_template,p1_ted_to_selected_templates,p1_is_similar,p2,p2_template,p2_ted_to_selected_templates,p2_is_similar,p3,p3_template,p3_ted_to_selected_templates,p3_is_similar,p4,p4_template,p4_ted_to_selected_templates,p4_is_similar,p5,p5_template,p5_ted_to_selected_templates,p5_is_similar,p6,p6_template,p6_ted_to_selected_templates,p6_is_similar,p7,p7_template,p7_ted_to_selected_templates,p7_is_similar,p8,p8_template,p8_ted_to_selected_templates,p8_is_similar
find Join the Dots: B-sides and Rarities,SearchCreativeWork,"[['object_name', 'Join the Dots: B-sides and Rarities']]",( S ( VP ( VB ) ( S ) ) ),SNIPS,40,"['( S ( VP ( VB ) ( NP ) ) )', '( SQ ( MD ) ( NP ( PRP ) ) ( VP ( VB ) ( NP ) ( NP ) ) ( . ) )']","['define dfw', 'Can you tell me the current temperature in Pesotum?']",search for the album Join the Dots: B-sides and Rarities,( S ( NP ( NP ) ( VP ) ) ( : ) ( NP ( NNS ) ( CC ) ( NNS ) ) ),"{'( S ( VP ( VB ) ( NP ) ) )': 8.0, '( SQ ( MD ) ( NP ( PRP ) ) ( VP ( VB ) ( NP ) ( NP ) ) ( . ) )': 10.0}",False,look up Join the Dots: B-sides and Rarities,( S ( VP ( VB ) ( PRT ) ( S ) ) ),"{'( S ( VP ( VB ) ( NP ) ) )': 1.0, '( SQ ( MD ) ( NP ( PRP ) ) ( VP ( VB ) ( NP ) ( NP ) ) ( . ) )': 7.0}",True,find where I can listen to Join the Dots: B-sides and Rarities,( S ( S ( VP ) ) ( : ) ( NP ( NNS ) ( CC ) ( NNS ) ) ),"{'( S ( VP ( VB ) ( NP ) ) )': 6.0, '( SQ ( MD ) ( NP ( PRP ) ) ( VP ( VB ) ( NP ) ( NP ) ) ( . ) )': 9.0}",False,discover any playlists with songs from Join the Dots: B-sides and Rarities,( S ( VP ( VB ) ( NP ) ) ),"{'( S ( VP ( VB ) ( NP ) ) )': 0.0, '( SQ ( MD ) ( NP ( PRP ) ) ( VP ( VB ) ( NP ) ( NP ) ) ( . ) )': 6.0}",True,locate Join the Dots: B-sides and Rarities album tracks,( S ( S ( VP ) ) ( : ) ( NP ( NML ) ( NN ) ( NNS ) ) ),"{'( S ( VP ( VB ) ( NP ) ) )': 6.0, '( SQ ( MD ) ( NP ( PRP ) ) ( VP ( VB ) ( NP ) ( NP ) ) ( . ) )': 9.0}",False,show me options for listening to songs from Join the Dots: B-sides and Rarities album,( S ( VP ( VB ) ( NP ) ( NP ) ) ),"{'( S ( VP ( VB ) ( NP ) ) )': 1.0, '( SQ ( MD ) ( NP ( PRP ) ) ( VP ( VB ) ( NP ) ( NP ) ) ( . ) )': 5.0}",True,gather information about tracks in join The dots : b-SideS And raritieS.,( S ( VP ( VB ) ( NP ) ) ( . ) ),"{'( S ( VP ( VB ) ( NP ) ) )': 1.0, '( SQ ( MD ) ( NP ( PRP ) ) ( VP ( VB ) ( NP ) ( NP ) ) ( . ) )': 5.0}",True,retrieve details on songs included in joinTheD0ts BS1Des AnD r[A]r!T!e$.,( S ( VP ( VB ) ( NP ) ) ( . ) ),"{'( S ( VP ( VB ) ( NP ) ) )': 1.0, '( SQ ( MD ) ( NP ( PRP ) ) ( VP ( VB ) ( NP ) ( NP ) ) ( . ) )': 5.0}",True
Terminate i-a541 now,EndEC2Instance,"[['VM', 'i-a541']]",( S ( VP ( VB ) ( NP ) ( ADVP ) ) ),ParaQuality,1,"['( S ( VP ( VB ) ( NP ) ) )', '( SQ ( MD ) ( NP ( PRP ) ) ( VP ( VB ) ( NP ) ( NP ) ) ( . ) )']","['Discover culinary videos', 'Can you tell me the definition of DFW?']",End the process i-a541 immediately,( S ( VP ( VB ) ( NP ) ( NP ) ( ADVP ) ) ),"{'( S ( VP ( VB ) ( NP ) ) )': 2.0, '( SQ ( MD ) ( NP ( PRP ) ) ( VP ( VB ) ( NP ) ( NP ) ) ( . ) )': 6.0}",True,Stop running i-a541 now,( S ( VP ( VB ) ( S ) ) ),"{'( S ( VP ( VB ) ( NP ) ) )': 1.0, '( SQ ( MD ) ( NP ( PRP ) ) ( VP ( VB ) ( NP ) ( NP ) ) ( . ) )': 7.0}",True,Terminate the execution of i-a541 right away,( S ( VP ( VB ) ( NP ) ( ADVP ) ) ),"{'( S ( VP ( VB ) ( NP ) ) )': 1.0, '( SQ ( MD ) ( NP ( PRP ) ) ( VP ( VB ) ( NP ) ( NP ) ) ( . ) )': 6.0}",True,Cease i-a541 at once,( S ( VP ( VB ) ( NP ) ( PP ) ) ),"{'( S ( VP ( VB ) ( NP ) ) )': 1.0, '( SQ ( MD ) ( NP ( PRP ) ) ( VP ( VB ) ( NP ) ( NP ) ) ( . ) )': 6.0}",True,Shut down and remove i-a541 from operation instantly,( S ( VP ( VP ) ( CC ) ( VP ) ) ),"{'( S ( VP ( VB ) ( NP ) ) )': 3.0, '( SQ ( MD ) ( NP ( PRP ) ) ( VP ( VB ) ( NP ) ( NP ) ) ( . ) )': 8.0}",True,Halt the performance of i-a541 without delay,( S ( VP ( VB ) ( NP ) ( PP ) ) ),"{'( S ( VP ( VB ) ( NP ) ) )': 1.0, '( SQ ( MD ) ( NP ( PRP ) ) ( VP ( VB ) ( NP ) ( NP ) ) ( . ) )': 6.0}",True,Put an end to the function of i-a541 promptly,( S ( VP ( VB ) ( NP ) ( PP ) ( ADVP ) ) ),"{'( S ( VP ( VB ) ( NP ) ) )': 2.0, '( SQ ( MD ) ( NP ( PRP ) ) ( VP ( VB ) ( NP ) ( NP ) ) ( . ) )': 7.0}",True,"Disable, cancel, and close down the activity of i-551 now",( S ( VP ( VP ) ( CC ) ( VP ) ) ),"{'( S ( VP ( VB ) ( NP ) ) )': 3.0, '( SQ ( MD ) ( NP ( PRP ) ) ( VP ( VB ) ( NP ) ( NP ) ) ( . ) )': 8.0}",True
Search for cooking videos,SearchWeb,"[['query', 'cooking videos']]",( NP ( NP ( VB ) ) ( PP ( IN ) ( NP ) ) ),ParaQuality,2,"['( S ( VP ( VB ) ( NP ) ) )', '( SQ ( MD ) ( NP ( PRP ) ) ( VP ( VB ) ( NP ) ( NP ) ) ( . ) )']","['find the lowest cost ticket from Denver to Pittsburgh', 'Can you tell me the weather forecast for Harrison-Crawford State Forest?']",Look up videos on how to cook,( S ( VP ( VB ) ( PRT ) ( NP ) ) ),"{'( S ( VP ( VB ) ( NP ) ) )': 1.0, '( SQ ( MD ) ( NP ( PRP ) ) ( VP ( VB ) ( NP ) ( NP ) ) ( . ) )': 6.0}",True,Find videos demonstrating cooking techniques,( S ( VP ( VB ) ( NP ) ) ),"{'( S ( VP ( VB ) ( NP ) ) )': 0.0, '( SQ ( MD ) ( NP ( PRP ) ) ( VP ( VB ) ( NP ) ( NP ) ) ( . ) )': 6.0}",True,Search for tutorials on cooking,( NP ( NP ( VB ) ) ( PP ( IN ) ( NP ) ) ),"{'( S ( VP ( VB ) ( NP ) ) )': 4.0, '( SQ ( MD ) ( NP ( PRP ) ) ( VP ( VB ) ( NP ) ( NP ) ) ( . ) )': 7.0}",False,Can you find me some instructional videos on food preparation?,( SQ ( MD ) ( NP ( PRP ) ) ( VP ( VB ) ( NP ) ( NP ) ) ( . ) ),"{'( S ( VP ( VB ) ( NP ) ) )': 6.0, '( SQ ( MD ) ( NP ( PRP ) ) ( VP ( VB ) ( NP ) ( NP ) ) ( . ) )': 0.0}",True,Seek out content related to culinary instruction,( S ( VP ( VB ) ( PRT ) ( NP ) ) ),"{'( S ( VP ( VB ) ( NP ) ) )': 1.0, '( SQ ( MD ) ( NP ( PRP ) ) ( VP ( VB ) ( NP ) ( NP ) ) ( . ) )': 6.0}",True,Discover video content showcasing the art of cooking,( S ( VP ( VB ) ( NP ) ) ),"{'( S ( VP ( VB ) ( NP ) ) )': 0.0, '( SQ ( MD ) ( NP ( PRP ) ) ( VP ( VB ) ( NP ) ( NP ) ) ( . ) )': 6.0}",True,Locate online resources for learning about food preparation through videos,( S ( VP ( VB ) ( NP ) ) ),"{'( S ( VP ( VB ) ( NP ) ) )': 0.0, '( SQ ( MD ) ( NP ( PRP ) ) ( VP ( VB ) ( NP ) ( NP ) ) ( . ) )': 6.0}",True,Find educational materials relating to culinary techniques in video format,( S ( VP ( VB ) ( NP ) ) ),"{'( S ( VP ( VB ) ( NP ) ) )': 0.0, '( SQ ( MD ) ( NP ( PRP ) ) ( VP ( VB ) ( NP ) ( NP ) ) ( . ) )': 6.0}",True
Find most popular photos tagged #LOVE,SearchWeb,"[['Tag', '#LOVE']]",( S ( S ( VP ) ) ( VP ( VBP ) ) ),ParaQuality,3,"['( S ( VP ( VB ) ( NP ) ) )', '( SQ ( MD ) ( NP ( PRP ) ) ( VP ( VB ) ( NP ) ( NP ) ) ( . ) )']","['include this musician called Kirk Hammett in my Party playlist', 'Can you show me five conference articles regarding text mining?']",Search for the top-rated pictures with the #LOVE hashtag.,( S ( VP ( VB ) ( PP ) ) ( . ) ),"{'( S ( VP ( VB ) ( NP ) ) )': 2.0, '( SQ ( MD ) ( NP ( PRP ) ) ( VP ( VB ) ( NP ) ( NP ) ) ( . ) )': 6.0}",True,Discover the most popular images tagged with #LOVE.,( S ( VP ( VB ) ( NP ) ) ( . ) ),"{'( S ( VP ( VB ) ( NP ) ) )': 1.0, '( SQ ( MD ) ( NP ( PRP ) ) ( VP ( VB ) ( NP ) ( NP ) ) ( . ) )': 5.0}",True,Find the trending photos that are labeled with #LOVE.,( S ( VP ( VB ) ( NP ) ) ( . ) ),"{'( S ( VP ( VB ) ( NP ) ) )': 1.0, '( SQ ( MD ) ( NP ( PRP ) ) ( VP ( VB ) ( NP ) ( NP ) ) ( . ) )': 5.0}",True,Locate the best-ranked pictures associated with #LOVE.,( S ( VP ( VB ) ( NP ) ) ( . ) ),"{'( S ( VP ( VB ) ( NP ) ) )': 1.0, '( SQ ( MD ) ( NP ( PRP ) ) ( VP ( VB ) ( NP ) ( NP ) ) ( . ) )': 5.0}",True,Retrieve the highly-liked images under the hashtag of #LOVE.,( S ( VP ( VB ) ( NP ) ( PP ) ) ( . ) ),"{'( S ( VP ( VB ) ( NP ) ) )': 2.0, '( SQ ( MD ) ( NP ( PRP ) ) ( VP ( VB ) ( NP ) ( NP ) ) ( . ) )': 5.0}",True,Show me a collection of top photos featuring #LOVE tags.,( S ( VP ( VB ) ( NP ) ( NP ) ) ( . ) ),"{'( S ( VP ( VB ) ( NP ) ) )': 2.0, '( SQ ( MD ) ( NP ( PRP ) ) ( VP ( VB ) ( NP ) ( NP ) ) ( . ) )': 4.0}",True,Explore high-quality pictures using the tag #LOVE.,( S ( VP ( VB ) ( NP ) ) ( . ) ),"{'( S ( VP ( VB ) ( NP ) ) )': 1.0, '( SQ ( MD ) ( NP ( PRP ) ) ( VP ( VB ) ( NP ) ( NP ) ) ( . ) )': 5.0}",True,Provide me access to prominent photographs marked as # LOVE.,( S ( VP ( VB ) ( NP ) ( NP ) ) ( . ) ),"{'( S ( VP ( VB ) ( NP ) ) )': 2.0, '( SQ ( MD ) ( NP ( PRP ) ) ( VP ( VB ) ( NP ) ( NP ) ) ( . ) )': 4.0}",True
Search for a few nice photos matching Opera House with size 1024px * 768px,SearchWeb,"[['size', '1024px * 768px'], ['query', 'Opera House']]",( NP ( NP ( VB ) ) ( PP ( IN ) ( NP ) ) ),ParaQuality,4,"['( S ( VP ( VB ) ( NP ) ) )', '( SQ ( MD ) ( NP ( PRP ) ) ( VP ( VB ) ( NP ) ( NP ) ) ( . ) )']","['Find some beautiful pictures that match Opera House with dimensions of 1024px * 768px', 'Can you tell me the proximity of the nearest taxi?']",Locate a few stunning images that correspond to Opera House and have a size of 1024px * 768px.,( S ( VP ( VB ) ( NP ) ) ( . ) ),"{'( S ( VP ( VB ) ( NP ) ) )': 1.0, '( SQ ( MD ) ( NP ( PRP ) ) ( VP ( VB ) ( NP ) ( NP ) ) ( . ) )': 5.0}",True,Retrieve several appealing photos that match the Opera House and have dimensions of 1024px * 768px.,( S ( VP ( VB ) ( NP ) ) ( . ) ),"{'( S ( VP ( VB ) ( NP ) ) )': 1.0, '( SQ ( MD ) ( NP ( PRP ) ) ( VP ( VB ) ( NP ) ( NP ) ) ( . ) )': 5.0}",True,Display some nice pictures that are similar to the Opera House and have a resolution of 1024 pixels wide by 768 pixels high.,( S ( VP ( VB ) ( NP ) ) ( . ) ),"{'( S ( VP ( VB ) ( NP ) ) )': 1.0, '( SQ ( MD ) ( NP ( PRP ) ) ( VP ( VB ) ( NP ) ( NP ) ) ( . ) )': 5.0}",True,"Discover a handful of beautiful images resembling the Opera House with dimensions set at exactly 1024 pixels width by x-height, where x is equal to or less than or equal to an arbitrary value not exceeding twice times seven hundred sixty-eight units measured in same-size pixelation.",( S ( VP ( VB ) ( NP ) ) ( . ) ),"{'( S ( VP ( VB ) ( NP ) ) )': 1.0, '( SQ ( MD ) ( NP ( PRP ) ) ( VP ( VB ) ( NP ) ( NP ) ) ( . ) )': 5.0}",True,"Unearth multiple attractive photographs bearing resemblance to the architecture of the Opera House with measurements amounting precisely from one thousand twenty-four negligible tracking elements leftward stretched up towards seven hundred sixty-eight downwardly positioned negligible tracking elements in equivalent subpixel increments arranged onscreen with no gaps or overlaps between them while maintaining their original proportions intact within their individual boundaries which abide by universally recognized visual standards relating specifically but not exclusively concerned with digital graphics and imaging technologies, including but not limited to monitors, displays, screens, projectors both analogical as well as digital-inverse counterparts fashioned thereof meeting relevant criteria specified ergonomically determining effective quality-standards employed past-present-future generations for providing suitable media into target-audience designated human-consuming environments partas consistent noticeable improvement framing inherited beneath specified generations furthers physically administratively avoiding misappropriations costing inadequate market reach relationally afflict socio-economic repercussions cascading biased formulaic impedance resulting predicted deflections awaywards incoming capital resources arising partially perpetuated omitted vis-à-vis according statistically recorded databases maintained secondary parties status reaffirm repeatability predictability integrated outcomes analyses running internal-algorithms supplying actionable insights guide reputable performance reproducible strategized estimations utilized various professional fields achieving verifiable interpretations relyable regularly verifiable input-scalable upper bound time-series consistency-variance indications heuristic cognitive associations supplemental juxtaposition consolidated operative relativity experimental recommixing imperative facilitating vulnerability dynamic autonomous understandable interface variations jovially predisposed busy users proved essential pragmatic behavioral intervention active workload-clearance ramifications overall pioneering age geographical non-discernment inclusive psychosocial-intricacies considerable influence precedes necessarily wholesome excess overhear-daily proceedings compromised injurious counterintuitive following community-wise norms compliance ensured explicitly implicitly educating informing enlightening self-sufficient said operators resolute while individual actions performed collaboratively synergistically interdependent coherence-force cajoled effective systemic better-communication spanning interdisciplinary analytical-incisive distributive representation negotiating differing generated harmonically validation entailing expedience filtering-structuring coherency resilience governing potential greater carryout hinted universally promoting unifying high-end monitoring excitingly inspiring technology-powered-customer-focused paradigm shift obeying intrinsic framework predefined surveillance personnel agree",( S ( S ( VP ) ) ( VP ( VBP ) ) ),"{'( S ( VP ( VB ) ( NP ) ) )': 3.0, '( SQ ( MD ) ( NP ( PRP ) ) ( VP ( VB ) ( NP ) ( NP ) ) ( . ) )': 8.0}",True,Find some nice pictures of the Opera House that are 1024 pixels wide and 768 pixels tall.,( S ( VP ( VB ) ( NP ) ) ( . ) ),"{'( S ( VP ( VB ) ( NP ) ) )': 1.0, '( SQ ( MD ) ( NP ( PRP ) ) ( VP ( VB ) ( NP ) ( NP ) ) ( . ) )': 5.0}",True,"Search for several beautiful photos that match the Opera House, with a size of exactly 1024 by 768 pixels.",( S ( VP ( VB ) ( PP ) ) ( . ) ),"{'( S ( VP ( VB ) ( NP ) ) )': 2.0, '( SQ ( MD ) ( NP ( PRP ) ) ( VP ( VB ) ( NP ) ( NP ) ) ( . ) )': 6.0}",True,"Can you locate a few lovely images similar to the Opera House, having the dimensions as precisely defined at 1024x768 pixels?","( SQ ( MD ) ( NP ( PRP ) ) ( VP ( VB ) ( NP ) ( , ) ( S ) ) ( . ) )","{'( S ( VP ( VB ) ( NP ) ) )': 6.0, '( SQ ( MD ) ( NP ( PRP ) ) ( VP ( VB ) ( NP ) ( NP ) ) ( . ) )': 1.0}",True
Are the burglar alarms in the office malfunctioning ?,CheckDevice,"[['location', 'office']]",( SQ ( VBP ) ( NP ( DT ) ( NN ) ( NNS ) ) ( PP ( IN ) ( NP ) ) ( VP ( VBG ) ) ( . ) ),ParaQuality,5,"['( S ( VP ( VB ) ( NP ) ) )', '( SQ ( MD ) ( NP ( PRP ) ) ( VP ( VB ) ( NP ) ( NP ) ) ( . ) )']","['Discover the trending images tagged as #LOVE', 'Can you tell me the definition of DFW?']",Are the alarms in the office that detect burglars experiencing a malfunction?,( SQ ( VBP ) ( NP ( NP ) ( SBAR ) ) ( . ) ),"{'( S ( VP ( VB ) ( NP ) ) )': 5.0, '( SQ ( MD ) ( NP ( PRP ) ) ( VP ( VB ) ( NP ) ( NP ) ) ( . ) )': 6.0}",False,Do the burglar alarms installed at the office have any malfunctions?,( SQ ( VBP ) ( NP ( NP ) ( VP ) ) ( VP ( VB ) ( NP ) ) ( . ) ),"{'( S ( VP ( VB ) ( NP ) ) )': 6.0, '( SQ ( MD ) ( NP ( PRP ) ) ( VP ( VB ) ( NP ) ( NP ) ) ( . ) )': 4.0}",False,Are there any issues with the security system's burglar alarms in our office?,( SQ ( VBP ) ( NP ( EX ) ) ( NP ( NP ) ( PP ) ) ( . ) ),"{'( S ( VP ( VB ) ( NP ) ) )': 7.0, '( SQ ( MD ) ( NP ( PRP ) ) ( VP ( VB ) ( NP ) ( NP ) ) ( . ) )': 5.0}",False,Is there something wrong with the burglar alarm system at our workplace?,( SQ ( VBZ ) ( NP ( EX ) ) ( NP ( NP ) ( ADJP ) ) ( PP ( IN ) ( NP ) ) ( . ) ),"{'( S ( VP ( VB ) ( NP ) ) )': 10.0, '( SQ ( MD ) ( NP ( PRP ) ) ( VP ( VB ) ( NP ) ( NP ) ) ( . ) )': 8.0}",False,Are there any problems with the functioning of burglar alarms in our office?,( SQ ( VBP ) ( NP ( EX ) ) ( NP ( NP ) ( PP ) ) ( . ) ),"{'( S ( VP ( VB ) ( NP ) ) )': 7.0, '( SQ ( MD ) ( NP ( PRP ) ) ( VP ( VB ) ( NP ) ( NP ) ) ( . ) )': 5.0}",False,Do we have any issues with regards to malfunctioning of burglary alert systems at work place? ,( SQ ( VBP ) ( NP ( PRP ) ) ( VP ( VB ) ( NP ) ) ( . ) ),"{'( S ( VP ( VB ) ( NP ) ) )': 5.0, '( SQ ( MD ) ( NP ( PRP ) ) ( VP ( VB ) ( NP ) ( NP ) ) ( . ) )': 2.0}",True,Inquire if there is a problem or defect encountered by burglar alarm devices installed within this workspace. ,( S ( VP ( VB ) ( SBAR ) ) ( . ) ),"{'( S ( VP ( VB ) ( NP ) ) )': 2.0, '( SQ ( MD ) ( NP ( PRP ) ) ( VP ( VB ) ( NP ) ( NP ) ) ( . ) )': 6.0}",True,Could you check if all of our office's intruder detection systems are working properly?,( SQ ( MD ) ( NP ( PRP ) ) ( VP ( VB ) ( SBAR ) ) ( . ) ),"{'( S ( VP ( VB ) ( NP ) ) )': 6.0, '( SQ ( MD ) ( NP ( PRP ) ) ( VP ( VB ) ( NP ) ( NP ) ) ( . ) )': 2.0}",True
Is the TV in the house off ?,CheckDevice,"[['device', 'TV']]",( SQ ( VBZ ) ( NP ( DT ) ( NN ) ) ( PP ( IN ) ( NP ) ) ( PRT ( RP ) ) ( . ) ),ParaQuality,6,"['( S ( VP ( VB ) ( NP ) ) )', '( SQ ( MD ) ( NP ( PRP ) ) ( VP ( VB ) ( NP ) ( NP ) ) ( . ) )']","['include this musician named Kirk Hammett in my Party playlist', 'Can you show me the best three convenience stores close to Newtown?']",Has the television in the house been turned off?,( SQ ( VBZ ) ( NP ( NP ) ( PP ) ) ( VP ( VBN ) ( VP ) ) ( . ) ),"{'( S ( VP ( VB ) ( NP ) ) )': 8.0, '( SQ ( MD ) ( NP ( PRP ) ) ( VP ( VB ) ( NP ) ( NP ) ) ( . ) )': 6.0}",False,Is the house's TV switched off?,( SQ ( VBZ ) ( NP ( NP ) ( NN ) ) ( VP ( VBN ) ( PRT ) ) ( . ) ),"{'( S ( VP ( VB ) ( NP ) ) )': 8.0, '( SQ ( MD ) ( NP ( PRP ) ) ( VP ( VB ) ( NP ) ( NP ) ) ( . ) )': 6.0}",False,Did someone turn off the TV in the house?,( SQ ( VBD ) ( NP ( NN ) ) ( VP ( VB ) ( PRT ) ( NP ) ( PP ) ) ( . ) ),"{'( S ( VP ( VB ) ( NP ) ) )': 7.0, '( SQ ( MD ) ( NP ( PRP ) ) ( VP ( VB ) ( NP ) ( NP ) ) ( . ) )': 4.0}",False,Can you confirm if the television in the house is off?,( SQ ( MD ) ( NP ( PRP ) ) ( VP ( VB ) ( SBAR ) ) ( . ) ),"{'( S ( VP ( VB ) ( NP ) ) )': 6.0, '( SQ ( MD ) ( NP ( PRP ) ) ( VP ( VB ) ( NP ) ( NP ) ) ( . ) )': 2.0}",True,Is it true that no one has left the TV on inside our home?,( SQ ( VBZ ) ( NP ( NP ) ) ( ADJP ( JJ ) ) ( SBAR ( IN ) ( S ) ) ( . ) ),"{'( S ( VP ( VB ) ( NP ) ) )': 8.0, '( SQ ( MD ) ( NP ( PRP ) ) ( VP ( VB ) ( NP ) ( NP ) ) ( . ) )': 8.0}",False,Could you please let me know if nobody forgot to switch off our television at home?,( SQ ( MD ) ( NP ( PRP ) ) ( VP ( UH ) ( VP ) ) ( . ) ),"{'( S ( VP ( VB ) ( NP ) ) )': 7.0, '( SQ ( MD ) ( NP ( PRP ) ) ( VP ( VB ) ( NP ) ( NP ) ) ( . ) )': 3.0}",True,Is there any chance that nobody left our household's television on? ,( SQ ( VBZ ) ( NP ( EX ) ) ( NP ( DT ) ( NN ) ( SBAR ) ) ( . ) ),"{'( S ( VP ( VB ) ( NP ) ) )': 8.0, '( SQ ( MD ) ( NP ( PRP ) ) ( VP ( VB ) ( NP ) ( NP ) ) ( . ) )': 6.0}",False,Has anyone remembered to turn off all televisions within this residence?,( SQ ( VBZ ) ( NP ( NN ) ) ( VP ( VBN ) ( S ) ) ( . ) ),"{'( S ( VP ( VB ) ( NP ) ) )': 6.0, '( SQ ( MD ) ( NP ( PRP ) ) ( VP ( VB ) ( NP ) ( NP ) ) ( . ) )': 5.0}",False
Any suggestions for an inexpensive hotel near Seattle for tomorrow for 2,FindHotel,"[['location', 'Seattle'], ['num_of_guests', '2']]",( NP ( NP ( DT ) ( NNS ) ) ( PP ( IN ) ( NP ) ) ),ParaQuality,7,"['( S ( VP ( VB ) ( NP ) ) )', '( SQ ( MD ) ( NP ( PRP ) ) ( VP ( VB ) ( NP ) ( NP ) ) ( . ) )']","['find places where I can listen to Join the Dots: B-sides and Rarities', 'Can you tell me the schedule for Crime and Punishment U.S.A.?']",Do you have any recommendations for a budget-friendly hotel in the vicinity of Seattle? We would be staying there tomorrow for two people.,( S ( SQ ( VBP ) ( NP ) ( VP ) ) ( . ) ( NP ( PRP ) ) ( VP ( MD ) ( VP ) ) ( . ) ),"{'( S ( VP ( VB ) ( NP ) ) )': 10.0, '( SQ ( MD ) ( NP ( PRP ) ) ( VP ( VB ) ( NP ) ( NP ) ) ( . ) )': 9.0}",False,Could you suggest an affordable hotel near Seattle that is available tomorrow for two guests?,( SQ ( MD ) ( NP ( PRP ) ) ( VP ( VB ) ( NP ) ) ( . ) ),"{'( S ( VP ( VB ) ( NP ) ) )': 5.0, '( SQ ( MD ) ( NP ( PRP ) ) ( VP ( VB ) ( NP ) ( NP ) ) ( . ) )': 1.0}",True,"I'm looking for a cheap hotel near Seattle for tomorrow, where can I find one?",( S ( NP ( PRP ) ) ( VP ( VBP ) ( VP ) ) ( . ) ),"{'( S ( VP ( VB ) ( NP ) ) )': 5.0, '( SQ ( MD ) ( NP ( PRP ) ) ( VP ( VB ) ( NP ) ( NP ) ) ( . ) )': 5.0}",False,Is there a reasonably priced hotel in the Seattle area that we can book for tomorrow and accommodate two people?,( SQ ( VBZ ) ( NP ( EX ) ) ( NP ( NP ) ( PP ) ) ( SBAR ( WHNP ) ( S ) ) ( . ) ),"{'( S ( VP ( VB ) ( NP ) ) )': 9.0, '( SQ ( MD ) ( NP ( PRP ) ) ( VP ( VB ) ( NP ) ( NP ) ) ( . ) )': 7.0}",False,Can you help me find an economical hotel near Seattle that's available from tomorrow and suitable for double occupancy?,( SQ ( MD ) ( NP ( PRP ) ) ( VP ( VB ) ( S ) ) ( . ) ),"{'( S ( VP ( VB ) ( NP ) ) )': 6.0, '( SQ ( MD ) ( NP ( PRP ) ) ( VP ( VB ) ( NP ) ( NP ) ) ( . ) )': 2.0}",True,"I need your assistance in finding an inexpensive accommodation option in the vicinity of Seattle. The stay is required from tomorrow onwards, accommodating 2 individuals.",( S ( S ( NP ) ( VP ) ) ( . ) ( S ( NP ) ( VP ) ) ( . ) ),"{'( S ( VP ( VB ) ( NP ) ) )': 6.0, '( SQ ( MD ) ( NP ( PRP ) ) ( VP ( VB ) ( NP ) ( NP ) ) ( . ) )': 7.0}",False,Please provide suggestions on finding a low-cost lodging option close to Seattle. We require it specifically starting from tomorrw and it should cater to 2 occupants.,( S ( S ( NP ) ( VP ) ) ( . ) ( S ( NP ) ( VP ) ) ( CC ) ( S ( NP ) ( VP ) ) ( . ) ),"{'( S ( VP ( VB ) ( NP ) ) )': 9.0, '( SQ ( MD ) ( NP ( PRP ) ) ( VP ( VB ) ( NP ) ( NP ) ) ( . ) )': 9.0}",False,"For my stay starting from tomorrow, could you recommend an affordable place to stay close to seattle city with no specific number of guest requirement?","( S ( PP ( IN ) ( NP ) ) ( , ) ( MD ) ( NP ( PRP ) ) ( VP ( VB ) ( NP ) ) ( . ) )","{'( S ( VP ( VB ) ( NP ) ) )': 8.0, '( SQ ( MD ) ( NP ( PRP ) ) ( VP ( VB ) ( NP ) ( NP ) ) ( . ) )': 6.0}",False
Are there any cheap hotels for 7-day stay somewhere near Riverside,FindHotel,"[['location', 'Riverside'], ['stay_length', '7-day']]",( SQ ( VBP ) ( NP ( EX ) ) ( NP ( NP ) ( PP ) ) ( ADVP ( RB ) ( IN ) ( NP ) ) ),ParaQuality,8,"['( S ( VP ( VB ) ( NP ) ) )', '( SQ ( MD ) ( NP ( PRP ) ) ( VP ( VB ) ( NP ) ( NP ) ) ( . ) )']","['Find a couple of great pictures that go well with Opera House, sized at 1024px * 768px', ""Could you give me some information about the customer reviews of McDonald's on Kensington St?""]",Is there any nearby place in Riverside where I can find a 7-day stay for a reasonable price?,( SQ ( VBZ ) ( NP ( EX ) ) ( NP ( NP ) ( SBAR ) ) ( . ) ),"{'( S ( VP ( VB ) ( NP ) ) )': 7.0, '( SQ ( MD ) ( NP ( PRP ) ) ( VP ( VB ) ( NP ) ( NP ) ) ( . ) )': 5.0}",False,I'm looking for affordable hotels near the Riverside area that offer a week-long stay.,( S ( NP ( PRP ) ) ( VP ( VBP ) ( VP ) ) ( . ) ),"{'( S ( VP ( VB ) ( NP ) ) )': 5.0, '( SQ ( MD ) ( NP ( PRP ) ) ( VP ( VB ) ( NP ) ( NP ) ) ( . ) )': 5.0}",False,Are there any budget-friendly accommodations available for a one-week stay close to Riverside?,( SQ ( VBP ) ( NP ( EX ) ) ( NP ( NP ) ( ADJP ) ) ( . ) ),"{'( S ( VP ( VB ) ( NP ) ) )': 7.0, '( SQ ( MD ) ( NP ( PRP ) ) ( VP ( VB ) ( NP ) ( NP ) ) ( . ) )': 5.0}",False,Could you help me locate inexpensive hotels in or around Riverside that are suitable for staying seven days?,( SQ ( MD ) ( NP ( PRP ) ) ( VP ( VB ) ( S ) ) ( . ) ),"{'( S ( VP ( VB ) ( NP ) ) )': 6.0, '( SQ ( MD ) ( NP ( PRP ) ) ( VP ( VB ) ( NP ) ( NP ) ) ( . ) )': 2.0}",True,"I need assistance finding economical lodging options near the Riverside vicinity, preferably with availability for seven days.",( S ( NP ( PRP ) ) ( VP ( VBP ) ( NP ) ) ( . ) ),"{'( S ( VP ( VB ) ( NP ) ) )': 4.0, '( SQ ( MD ) ( NP ( PRP ) ) ( VP ( VB ) ( NP ) ( NP ) ) ( . ) )': 4.0}",False,Is it possible to find reasonably priced hotels within close proximity to the Riverdale district that allow stays of one week at an affordable rate?,( SQ ( VBZ ) ( NP ( NP ) ) ( ADJP ( JJ ) ) ( S ( VP ) ) ( . ) ),"{'( S ( VP ( VB ) ( NP ) ) )': 7.0, '( SQ ( MD ) ( NP ( PRP ) ) ( VP ( VB ) ( NP ) ( NP ) ) ( . ) )': 7.0}",False,Can you suggest any low-cost hotel options in or around the Riverside area? I need accommodation for seven nights.,( S ( SQ ( MD ) ( NP ) ( VP ) ) ( . ) ( NP ( PRP ) ) ( VP ( VBP ) ( NP ) ( PP ) ) ( . ) ),"{'( S ( VP ( VB ) ( NP ) ) )': 10.0, '( SQ ( MD ) ( NP ( PRP ) ) ( VP ( VB ) ( NP ) ( NP ) ) ( . ) )': 7.0}",False,Are there any places near Riverside where I can spend seven days at a cheap hotel?,( SQ ( VBP ) ( NP ( EX ) ) ( NP ( NP ) ( SBAR ) ) ( . ) ),"{'( S ( VP ( VB ) ( NP ) ) )': 7.0, '( SQ ( MD ) ( NP ( PRP ) ) ( VP ( VB ) ( NP ) ( NP ) ) ( . ) )': 5.0}",False
