input_utterance,intent,parameters,utterance_template,source,seed_id,selected_templates,selected_templates_related_paraphrases,p1,p1_template,p1_ted_to_selected_templates,p1_is_similar,p2,p2_template,p2_ted_to_selected_templates,p2_is_similar,p3,p3_template,p3_ted_to_selected_templates,p3_is_similar,p4,p4_template,p4_ted_to_selected_templates,p4_is_similar,p5,p5_template,p5_ted_to_selected_templates,p5_is_similar,p6,p6_template,p6_ted_to_selected_templates,p6_is_similar,p7,p7_template,p7_ted_to_selected_templates,p7_is_similar,p8,p8_template,p8_ted_to_selected_templates,p8_is_similar
Terminate i-a541 now,EndEC2Instance,"[['VM', 'i-a541']]",( S ( VP ( VB ) ( NP ) ( ADVP ) ) ),ParaQuality,1,"['( S ( VP ( VB ) ( NP ) ) )', '( SQ ( MD ) ( NP ( PRP ) ) ( VP ( VB ) ( NP ) ( NP ) ) ( . ) )']","['list the airlines that fly from Boston to Denver', 'Can you tell me the distance of the closest cab?']",End i-a541 immediately,( NP ( NP ( NN ) ( NN ) ) ( ADVP ( RB ) ) ),"{'( S ( VP ( VB ) ( NP ) ) )': 6.0, '( SQ ( MD ) ( NP ( PRP ) ) ( VP ( VB ) ( NP ) ( NP ) ) ( . ) )': 9.0}",False,Stop i-a541 right now,( S ( VP ( VB ) ( NP ) ( ADVP ) ) ),"{'( S ( VP ( VB ) ( NP ) ) )': 1.0, '( SQ ( MD ) ( NP ( PRP ) ) ( VP ( VB ) ( NP ) ( NP ) ) ( . ) )': 6.0}",True,Abort i-a541 at once,( S ( VP ( VB ) ( NP ) ( PP ) ) ),"{'( S ( VP ( VB ) ( NP ) ) )': 1.0, '( SQ ( MD ) ( NP ( PRP ) ) ( VP ( VB ) ( NP ) ( NP ) ) ( . ) )': 6.0}",True,Cease i-a541 immediately,( S ( VP ( VB ) ( NP ) ( ADVP ) ) ),"{'( S ( VP ( VB ) ( NP ) ) )': 1.0, '( SQ ( MD ) ( NP ( PRP ) ) ( VP ( VB ) ( NP ) ( NP ) ) ( . ) )': 6.0}",True,Halt i-a541 now,( S ( VP ( VB ) ( NP ) ( ADVP ) ) ),"{'( S ( VP ( VB ) ( NP ) ) )': 1.0, '( SQ ( MD ) ( NP ( PRP ) ) ( VP ( VB ) ( NP ) ( NP ) ) ( . ) )': 6.0}",True,Discontinue i-a541 right away,( S ( VP ( VB ) ( NP ) ( ADVP ) ) ),"{'( S ( VP ( VB ) ( NP ) ) )': 1.0, '( SQ ( MD ) ( NP ( PRP ) ) ( VP ( VB ) ( NP ) ( NP ) ) ( . ) )': 6.0}",True,Terminate the execution of the task labeled as 'i-a541',( S ( VP ( VB ) ( NP ) ( ADVP ) ) ( '' ) ),"{'( S ( VP ( VB ) ( NP ) ) )': 2.0, '( SQ ( MD ) ( NP ( PRP ) ) ( VP ( VB ) ( NP ) ( NP ) ) ( . ) )': 6.0}",True,Cancel the operation labeled as 'i-aaa4512',( S ( VP ( VB ) ( NP ) ) ),"{'( S ( VP ( VB ) ( NP ) ) )': 0.0, '( SQ ( MD ) ( NP ( PRP ) ) ( VP ( VB ) ( NP ) ( NP ) ) ( . ) )': 6.0}",True
Search for cooking videos,SearchWeb,"[['query', 'cooking videos']]",( NP ( NP ( VB ) ) ( PP ( IN ) ( NP ) ) ),ParaQuality,2,"['( S ( VP ( VB ) ( NP ) ) )', '( SQ ( MD ) ( NP ( PRP ) ) ( VP ( VB ) ( NP ) ( NP ) ) ( . ) )']","['locate Fox Theatres featuring The Caretaker', 'Can you tell me the proximity of the closest taxi?']",Find videos on cooking,( S ( VP ( VB ) ( NP ) ) ),"{'( S ( VP ( VB ) ( NP ) ) )': 0.0, '( SQ ( MD ) ( NP ( PRP ) ) ( VP ( VB ) ( NP ) ( NP ) ) ( . ) )': 6.0}",True,Look up cooking tutorials,( S ( VP ( VB ) ( PRT ) ( NP ) ) ),"{'( S ( VP ( VB ) ( NP ) ) )': 1.0, '( SQ ( MD ) ( NP ( PRP ) ) ( VP ( VB ) ( NP ) ( NP ) ) ( . ) )': 6.0}",True,Discover videos about cooking techniques,( S ( VP ( VB ) ( NP ) ) ),"{'( S ( VP ( VB ) ( NP ) ) )': 0.0, '( SQ ( MD ) ( NP ( PRP ) ) ( VP ( VB ) ( NP ) ( NP ) ) ( . ) )': 6.0}",True,Search for instructional videos on cooking,( NP ( NP ( VB ) ) ( PP ( IN ) ( NP ) ) ),"{'( S ( VP ( VB ) ( NP ) ) )': 4.0, '( SQ ( MD ) ( NP ( PRP ) ) ( VP ( VB ) ( NP ) ( NP ) ) ( . ) )': 7.0}",False,Locate online videos for learning to cook,( S ( VP ( VB ) ( NP ) ) ),"{'( S ( VP ( VB ) ( NP ) ) )': 0.0, '( SQ ( MD ) ( NP ( PRP ) ) ( VP ( VB ) ( NP ) ( NP ) ) ( . ) )': 6.0}",True,Find and watch cooking demonstration videos,( S ( VP ( VB ) ( CC ) ( VB ) ( NP ) ) ),"{'( S ( VP ( VB ) ( NP ) ) )': 2.0, '( SQ ( MD ) ( NP ( PRP ) ) ( VP ( VB ) ( NP ) ( NP ) ) ( . ) )': 7.0}",True,Explore a selection of cooking recipe videos,( S ( VP ( VB ) ( NP ) ) ),"{'( S ( VP ( VB ) ( NP ) ) )': 0.0, '( SQ ( MD ) ( NP ( PRP ) ) ( VP ( VB ) ( NP ) ( NP ) ) ( . ) )': 6.0}",True,Look for step-by-step video guides for cooking,( S ( VP ( VB ) ( PP ) ) ),"{'( S ( VP ( VB ) ( NP ) ) )': 1.0, '( SQ ( MD ) ( NP ( PRP ) ) ( VP ( VB ) ( NP ) ( NP ) ) ( . ) )': 7.0}",True
Find most popular photos tagged #LOVE,SearchWeb,"[['Tag', '#LOVE']]",( S ( S ( VP ) ) ( VP ( VBP ) ) ),ParaQuality,3,"['( S ( VP ( VB ) ( NP ) ) )', '( SQ ( MD ) ( NP ( PRP ) ) ( VP ( VB ) ( NP ) ( NP ) ) ( . ) )']","['find albums with B-sides and Rarities from Join the Dots', 'Can you find me the most recent scientific publication about Machine Learning?']",Locate the most popular images with the hashtag #LOVE.,( S ( VP ( VB ) ( NP ) ) ( . ) ),"{'( S ( VP ( VB ) ( NP ) ) )': 1.0, '( SQ ( MD ) ( NP ( PRP ) ) ( VP ( VB ) ( NP ) ( NP ) ) ( . ) )': 5.0}",True,Discover the highly-rated pictures that are tagged with #LOVE.,( S ( VP ( VB ) ( NP ) ) ( . ) ),"{'( S ( VP ( VB ) ( NP ) ) )': 1.0, '( SQ ( MD ) ( NP ( PRP ) ) ( VP ( VB ) ( NP ) ( NP ) ) ( . ) )': 5.0}",True,Retrieve the top photos labeled with #LOVE.,( S ( VP ( VB ) ( NP ) ) ( . ) ),"{'( S ( VP ( VB ) ( NP ) ) )': 1.0, '( SQ ( MD ) ( NP ( PRP ) ) ( VP ( VB ) ( NP ) ( NP ) ) ( . ) )': 5.0}",True,Find me the most popular images using the hashtag #LOVE.,( S ( VP ( VB ) ( NP ) ( NP ) ) ( . ) ),"{'( S ( VP ( VB ) ( NP ) ) )': 2.0, '( SQ ( MD ) ( NP ( PRP ) ) ( VP ( VB ) ( NP ) ( NP ) ) ( . ) )': 4.0}",True,Can you locate the most liked and shared pictures tagged as #LOVE?,( SQ ( MD ) ( NP ( PRP ) ) ( VP ( VB ) ( NP ) ) ( . ) ),"{'( S ( VP ( VB ) ( NP ) ) )': 5.0, '( SQ ( MD ) ( NP ( PRP ) ) ( VP ( VB ) ( NP ) ( NP ) ) ( . ) )': 1.0}",True,I need to find the photos that have received a lot of attention and are tagged as #LOVe,( S ( NP ( PRP ) ) ( VP ( VBP ) ( S ) ) ),"{'( S ( VP ( VB ) ( NP ) ) )': 4.0, '( SQ ( MD ) ( NP ( PRP ) ) ( VP ( VB ) ( NP ) ( NP ) ) ( . ) )': 6.0}",False,"Show me which are currently in trend, those photographs marked by users under a special word called LOVE","( S ( S ( VP ) ) ( , ) ( NP ( NP ) ( VP ) ) )","{'( S ( VP ( VB ) ( NP ) ) )': 5.0, '( SQ ( MD ) ( NP ( PRP ) ) ( VP ( VB ) ( NP ) ( NP ) ) ( . ) )': 8.0}",False,I request you to bring together all of those fashionable visuals labelled specifically for LOVE,( S ( NP ( PRP ) ) ( VP ( VBP ) ( NP ) ( S ) ) ),"{'( S ( VP ( VB ) ( NP ) ) )': 3.0, '( SQ ( MD ) ( NP ( PRP ) ) ( VP ( VB ) ( NP ) ( NP ) ) ( . ) )': 5.0}",True
Search for a few nice photos matching Opera House with size 1024px * 768px,SearchWeb,"[['size', '1024px * 768px'], ['query', 'Opera House']]",( NP ( NP ( VB ) ) ( PP ( IN ) ( NP ) ) ),ParaQuality,4,"['( S ( VP ( VB ) ( NP ) ) )', '( SQ ( MD ) ( NP ( PRP ) ) ( VP ( VB ) ( NP ) ( NP ) ) ( . ) )']","['Retrieve 5 conference articles that discuss text mining', 'Can you tell me the weather forecast for Harrison-Crawford State Forest?']",Find a couple of beautiful pictures that match Opera House with dimensions of 1024px * 768px,( S ( VP ( VB ) ( NP ) ) ),"{'( S ( VP ( VB ) ( NP ) ) )': 0.0, '( SQ ( MD ) ( NP ( PRP ) ) ( VP ( VB ) ( NP ) ( NP ) ) ( . ) )': 6.0}",True,Look for some lovely images that correspond to Opera House with size of 1024 pixels by 768 pixels,( S ( VP ( VB ) ( PP ) ) ),"{'( S ( VP ( VB ) ( NP ) ) )': 1.0, '( SQ ( MD ) ( NP ( PRP ) ) ( VP ( VB ) ( NP ) ( NP ) ) ( . ) )': 7.0}",True,Search for a few good photographs that go well with Opera House and have dimensions of 1024 x 768 pixels,( S ( VP ( VB ) ( PP ) ) ),"{'( S ( VP ( VB ) ( NP ) ) )': 1.0, '( SQ ( MD ) ( NP ( PRP ) ) ( VP ( VB ) ( NP ) ( NP ) ) ( . ) )': 7.0}",True,Please find several nice photos that are related to the Opera House and have the size of 1024x768 pixels,( S ( INTJ ( UH ) ) ( VP ( VB ) ( NP ) ) ),"{'( S ( VP ( VB ) ( NP ) ) )': 2.0, '( SQ ( MD ) ( NP ( PRP ) ) ( VP ( VB ) ( NP ) ( NP ) ) ( . ) )': 6.0}",True,Can you locate some great images matching Opera House in the resolution of 1024 by 768?,( SQ ( MD ) ( NP ( PRP ) ) ( VP ( VB ) ( NP ) ( PP ) ) ( . ) ),"{'( S ( VP ( VB ) ( NP ) ) )': 6.0, '( SQ ( MD ) ( NP ( PRP ) ) ( VP ( VB ) ( NP ) ( NP ) ) ( . ) )': 1.0}",True,Retrieve a few high-quality pictures depicting the Opera House at a size ratio of approximately (1.33:1),( S ( VP ( VB ) ( NP ) ( PP ) ) ),"{'( S ( VP ( VB ) ( NP ) ) )': 1.0, '( SQ ( MD ) ( NP ( PRP ) ) ( VP ( VB ) ( NP ) ( NP ) ) ( . ) )': 6.0}",True,"I'm interested in finding multiple appealing photos showing the beauty of the Opera House, ideally around (width=1024, height=768) pixel range.",( S ( NP ( PRP ) ) ( VP ( VBP ) ( ADJP ) ) ( . ) ),"{'( S ( VP ( VB ) ( NP ) ) )': 5.0, '( SQ ( MD ) ( NP ( PRP ) ) ( VP ( VB ) ( NP ) ( NP ) ) ( . ) )': 5.0}",False,I would like to discover several picturesque photographs capturing views from and around Sydney's iconic architectural masterpiece - The opera house. It would be preferable if these pictures were available at an aspect ratio somewhere close to width:height = (16/9). ,( S ( S ( NP ) ( VP ) ) ( . ) ( S ( NP ) ( VP ) ) ( . ) ),"{'( S ( VP ( VB ) ( NP ) ) )': 6.0, '( SQ ( MD ) ( NP ( PRP ) ) ( VP ( VB ) ( NP ) ( NP ) ) ( . ) )': 7.0}",False
Are the burglar alarms in the office malfunctioning ?,CheckDevice,"[['location', 'office']]",( SQ ( VBP ) ( NP ( DT ) ( NN ) ( NNS ) ) ( PP ( IN ) ( NP ) ) ( VP ( VBG ) ) ( . ) ),ParaQuality,5,"['( S ( VP ( VB ) ( NP ) ) )', '( SQ ( MD ) ( NP ( PRP ) ) ( VP ( VB ) ( NP ) ( NP ) ) ( . ) )']","['find showings of The Caretaker at Fox Theatres', 'Can you tell me the proximity of the closest taxi?']",Do the office burglar alarms have a malfunction?,( SQ ( VBP ) ( NP ( DT ) ( NN ) ( NN ) ( NNS ) ) ( VP ( VB ) ( NP ) ) ( . ) ),"{'( S ( VP ( VB ) ( NP ) ) )': 8.0, '( SQ ( MD ) ( NP ( PRP ) ) ( VP ( VB ) ( NP ) ( NP ) ) ( . ) )': 6.0}",False,Is there an issue with the burglar alarms in the office?,( SQ ( VBZ ) ( NP ( EX ) ) ( NP ( NP ) ( PP ) ) ( . ) ),"{'( S ( VP ( VB ) ( NP ) ) )': 7.0, '( SQ ( MD ) ( NP ( PRP ) ) ( VP ( VB ) ( NP ) ( NP ) ) ( . ) )': 5.0}",False,Are there problems with the burglar alarms at work?,( SQ ( VBP ) ( NP ( EX ) ) ( NP ( NP ) ( PP ) ( PP ) ) ( . ) ),"{'( S ( VP ( VB ) ( NP ) ) )': 8.0, '( SQ ( MD ) ( NP ( PRP ) ) ( VP ( VB ) ( NP ) ( NP ) ) ( . ) )': 6.0}",False,Are there any malfunctions in the office's theft detection system?,( SQ ( VBP ) ( NP ( EX ) ) ( NP ( NP ) ( PP ) ) ( . ) ),"{'( S ( VP ( VB ) ( NP ) ) )': 7.0, '( SQ ( MD ) ( NP ( PRP ) ) ( VP ( VB ) ( NP ) ( NP ) ) ( . ) )': 5.0}",False,Could you check if the office's burglary alarm is working properly?,( SQ ( MD ) ( NP ( PRP ) ) ( VP ( VB ) ( SBAR ) ) ( . ) ),"{'( S ( VP ( VB ) ( NP ) ) )': 6.0, '( SQ ( MD ) ( NP ( PRP ) ) ( VP ( VB ) ( NP ) ( NP ) ) ( . ) )': 2.0}",True,I'm curious if there are any issues with the security system in place at our workplace.,( S ( NP ( PRP ) ) ( VP ( VBP ) ( ADJP ) ( SBAR ) ) ( . ) ),"{'( S ( VP ( VB ) ( NP ) ) )': 6.0, '( SQ ( MD ) ( NP ( PRP ) ) ( VP ( VB ) ( NP ) ( NP ) ) ( . ) )': 5.0}",False,Is it possible that something is wrong with the burglar alarms in our office?,( SQ ( VBZ ) ( NP ( NP ) ) ( ADJP ( JJ ) ) ( SBAR ( IN ) ( S ) ) ( . ) ),"{'( S ( VP ( VB ) ( NP ) ) )': 8.0, '( SQ ( MD ) ( NP ( PRP ) ) ( VP ( VB ) ( NP ) ( NP ) ) ( . ) )': 8.0}",False,Can you verify whether or not something is amiss with our office's security alarm?,( SQ ( MD ) ( NP ( PRP ) ) ( VP ( VB ) ( SBAR ) ) ( . ) ),"{'( S ( VP ( VB ) ( NP ) ) )': 6.0, '( SQ ( MD ) ( NP ( PRP ) ) ( VP ( VB ) ( NP ) ( NP ) ) ( . ) )': 2.0}",True
Is the TV in the house off ?,CheckDevice,"[['device', 'TV']]",( SQ ( VBZ ) ( NP ( DT ) ( NN ) ) ( PP ( IN ) ( NP ) ) ( PRT ( RP ) ) ( . ) ),ParaQuality,6,"['( S ( VP ( VB ) ( NP ) ) )', '( SQ ( MD ) ( NP ( PRP ) ) ( VP ( VB ) ( NP ) ( NP ) ) ( . ) )']","['Discover the most popular pictures with the hashtag #LOVE', 'Can you tell me the current heat in Pesotum?']",Is the television turned off in the house?,( SQ ( VBZ ) ( NP ( DT ) ( NN ) ) ( VP ( VBN ) ( PRT ) ( PP ) ) ( . ) ),"{'( S ( VP ( VB ) ( NP ) ) )': 9.0, '( SQ ( MD ) ( NP ( PRP ) ) ( VP ( VB ) ( NP ) ( NP ) ) ( . ) )': 6.0}",False,Has the TV in the house been switched off?,( SQ ( VBZ ) ( NP ( NP ) ( PP ) ) ( VP ( VBN ) ( VP ) ) ( . ) ),"{'( S ( VP ( VB ) ( NP ) ) )': 8.0, '( SQ ( MD ) ( NP ( PRP ) ) ( VP ( VB ) ( NP ) ( NP ) ) ( . ) )': 6.0}",False,Could you confirm if the television inside the house is powered down?,( SQ ( MD ) ( NP ( PRP ) ) ( VP ( VB ) ( SBAR ) ) ( . ) ),"{'( S ( VP ( VB ) ( NP ) ) )': 6.0, '( SQ ( MD ) ( NP ( PRP ) ) ( VP ( VB ) ( NP ) ( NP ) ) ( . ) )': 2.0}",True,Are we certain that no one left the TV on in our residence?,( SQ ( VBP ) ( NP ( PRP ) ) ( ADJP ( JJ ) ) ( SBAR ( IN ) ( S ) ) ( . ) ),"{'( S ( VP ( VB ) ( NP ) ) )': 8.0, '( SQ ( MD ) ( NP ( PRP ) ) ( VP ( VB ) ( NP ) ( NP ) ) ( . ) )': 7.0}",False,Inquire about whether or not there has been a power down of the television within our home.,( S ( VP ( VB ) ( PP ) ) ( . ) ),"{'( S ( VP ( VB ) ( NP ) ) )': 2.0, '( SQ ( MD ) ( NP ( PRP ) ) ( VP ( VB ) ( NP ) ( NP ) ) ( . ) )': 6.0}",True,"Is it confirmed that nobody left on, upstairs at PV0010, any sets (either big screen or regular) of televisions (whether they are working or with just junk composite peripherals attached)?",( SQ ( VBZ ) ( NP ( PRP ) ) ( VP ( VBN ) ( SBAR ) ) ( . ) ),"{'( S ( VP ( VB ) ( NP ) ) )': 7.0, '( SQ ( MD ) ( NP ( PRP ) ) ( VP ( VB ) ( NP ) ( NP ) ) ( . ) )': 4.0}",False,Do we know for certain none of these flat screens up here powered back on after I walked away from them a few minutes ago ?,( SQ ( VBP ) ( NP ( PRP ) ) ( VP ( VB ) ( PP ) ( S ) ) ( . ) ),"{'( S ( VP ( VB ) ( NP ) ) )': 6.0, '( SQ ( MD ) ( NP ( PRP ) ) ( VP ( VB ) ( NP ) ( NP ) ) ( . ) )': 3.0}",True,"Within this household, may someone please verify whether any televisions have been accidentally kept running? Can you settle this once and for all?","( S ( PP ( IN ) ( NP ) ) ( , ) ( MD ) ( NP ( NN ) ) ( VP ( UH ) ( VP ) ) ( . ) ( SQ ( MD ) ( NP ) ( VP ) ) ( . ) )","{'( S ( VP ( VB ) ( NP ) ) )': 15.0, '( SQ ( MD ) ( NP ( PRP ) ) ( VP ( VB ) ( NP ) ( NP ) ) ( . ) )': 13.0}",False
Any suggestions for an inexpensive hotel near Seattle for tomorrow for 2,FindHotel,"[['location', 'Seattle'], ['num_of_guests', '2']]",( NP ( NP ( DT ) ( NNS ) ) ( PP ( IN ) ( NP ) ) ),ParaQuality,7,"['( S ( VP ( VB ) ( NP ) ) )', '( SQ ( MD ) ( NP ( PRP ) ) ( VP ( VB ) ( NP ) ( NP ) ) ( . ) )']","['locate Fox Theatres featuring The Caretaker', 'Can you show me the best three convenience stores around Newtown?']","Can you recommend a budget-friendly hotel in the vicinity of Seattle for tomorrow, accommodating two guests?","( SQ ( MD ) ( NP ( PRP ) ) ( VP ( VB ) ( NP ) ( , ) ( S ) ) ( . ) )","{'( S ( VP ( VB ) ( NP ) ) )': 6.0, '( SQ ( MD ) ( NP ( PRP ) ) ( VP ( VB ) ( NP ) ( NP ) ) ( . ) )': 1.0}",True,I'm looking for an affordable hotel close to Seattle for tomorrow that can accommodate two people. Any suggestions?,( S ( NP ( PRP ) ) ( VP ( VBP ) ( VP ) ) ( . ) ),"{'( S ( VP ( VB ) ( NP ) ) )': 5.0, '( SQ ( MD ) ( NP ( PRP ) ) ( VP ( VB ) ( NP ) ( NP ) ) ( . ) )': 5.0}",False,Do you know of any cheap hotels near Seattle where I can stay tomorrow with another person?,( SQ ( VBP ) ( NP ( PRP ) ) ( VP ( VB ) ( PP ) ) ( . ) ),"{'( S ( VP ( VB ) ( NP ) ) )': 6.0, '( SQ ( MD ) ( NP ( PRP ) ) ( VP ( VB ) ( NP ) ( NP ) ) ( . ) )': 3.0}",True,Could you suggest a reasonably priced hotel near Seattle that's available for tomorrow and can accommodate two guests?,( SQ ( MD ) ( NP ( PRP ) ) ( VP ( VB ) ( NP ) ) ( . ) ),"{'( S ( VP ( VB ) ( NP ) ) )': 5.0, '( SQ ( MD ) ( NP ( PRP ) ) ( VP ( VB ) ( NP ) ( NP ) ) ( . ) )': 1.0}",True,I need help finding an inexpensive hotel in the area surrounding Seattle. It needs to have availability for tomorrow and be able to accommodate two people.,( S ( S ( NP ) ( VP ) ) ( . ) ( S ( NP ) ( VP ) ) ( . ) ),"{'( S ( VP ( VB ) ( NP ) ) )': 6.0, '( SQ ( MD ) ( NP ( PRP ) ) ( VP ( VB ) ( NP ) ( NP ) ) ( . ) )': 7.0}",False,Are there any low-cost hotels in the vicinity of Seattle that are available for tomorrow? I will be staying with one more person.,( SQ ( VBP ) ( NP ( EX ) ) ( NP ( NP ) ( SBAR ) ) ( . ) ( NP ( PRP ) ) ( VP ( MD ) ( VP ) ) ( . ) ),"{'( S ( VP ( VB ) ( NP ) ) )': 13.0, '( SQ ( MD ) ( NP ( PRP ) ) ( VP ( VB ) ( NP ) ( NP ) ) ( . ) )': 10.0}",False,"Is it possible to find a pocket-friendly hotel near me, specifically around Seattle, which has availability from +1 day onward; it should also support accommodation arrangements pertaining to multiple occupants (2).","( SQ ( VBZ ) ( NP ( NP ) ) ( ADJP ( JJ ) ) ( S ( VP ) ) ( , ) ( S ( NP ) ( VP ) ) ( . ) )","{'( S ( VP ( VB ) ( NP ) ) )': 10.0, '( SQ ( MD ) ( NP ( PRP ) ) ( VP ( VB ) ( NP ) ( NP ) ) ( . ) )': 8.0}",False,"I am in search of suggestions on finding economical places within proximity around the city known as 'Seattle' - these must include availability now until one night later (tomorrow), along with provisionaging occupancy rooming familiarity catered towards dual passengers (guests).","( S ( NP ( PRP ) ) ( VP ( VP ) ( , ) ( NP ) ( VP ) ) ( . ) )","{'( S ( VP ( VB ) ( NP ) ) )': 6.0, '( SQ ( MD ) ( NP ( PRP ) ) ( VP ( VB ) ( NP ) ( NP ) ) ( . ) )': 5.0}",False
Are there any cheap hotels for 7-day stay somewhere near Riverside,FindHotel,"[['location', 'Riverside'], ['stay_length', '7-day']]",( SQ ( VBP ) ( NP ( EX ) ) ( NP ( NP ) ( PP ) ) ( ADVP ( RB ) ( IN ) ( NP ) ) ),ParaQuality,8,"['( S ( VP ( VB ) ( NP ) ) )', '( SQ ( MD ) ( NP ( PRP ) ) ( VP ( VB ) ( NP ) ( NP ) ) ( . ) )']","['Locate some high-quality pictures that represent the Opera House with dimensions of 1024 pixels by 768 pixels', 'Can you show me places where I can improve my laptop?']",Can you find any inexpensive hotels nearby that offer a 7-day stay?,( SQ ( MD ) ( NP ( PRP ) ) ( VP ( VB ) ( NP ) ) ( . ) ),"{'( S ( VP ( VB ) ( NP ) ) )': 5.0, '( SQ ( MD ) ( NP ( PRP ) ) ( VP ( VB ) ( NP ) ( NP ) ) ( . ) )': 1.0}",True,I'm looking for affordable accommodations for a week near Riverside. Any suggestions?,( S ( S ( NP ) ( VP ) ) ( . ) ( NP ( DT ) ( NNS ) ) ( . ) ),"{'( S ( VP ( VB ) ( NP ) ) )': 7.0, '( SQ ( MD ) ( NP ( PRP ) ) ( VP ( VB ) ( NP ) ( NP ) ) ( . ) )': 8.0}",False,Could you help me locate budget-friendly hotels in the vicinity of Riverside for a duration of 7 days?,( SQ ( MD ) ( NP ( PRP ) ) ( VP ( VB ) ( S ) ) ( . ) ),"{'( S ( VP ( VB ) ( NP ) ) )': 6.0, '( SQ ( MD ) ( NP ( PRP ) ) ( VP ( VB ) ( NP ) ( NP ) ) ( . ) )': 2.0}",True,Are there any economical options available for lodging near Riverside that cater to stays lasting 7 days?,( SQ ( VBP ) ( NP ( EX ) ) ( NP ( NP ) ( ADJP ) ) ( . ) ),"{'( S ( VP ( VB ) ( NP ) ) )': 7.0, '( SQ ( MD ) ( NP ( PRP ) ) ( VP ( VB ) ( NP ) ( NP ) ) ( . ) )': 5.0}",False,I need to find reasonably priced hotels close to Riverside where I can stay for one week.,( S ( NP ( PRP ) ) ( VP ( VBP ) ( S ) ) ( . ) ),"{'( S ( VP ( VB ) ( NP ) ) )': 5.0, '( SQ ( MD ) ( NP ( PRP ) ) ( VP ( VB ) ( NP ) ( NP ) ) ( . ) )': 5.0}",False,Can you assist me in finding cost-effective hotels within close proximity to the Riverside area that provide accommodations for a period of 7 days?,( SQ ( MD ) ( NP ( PRP ) ) ( VP ( VB ) ( NP ) ( PP ) ) ( . ) ),"{'( S ( VP ( VB ) ( NP ) ) )': 6.0, '( SQ ( MD ) ( NP ( PRP ) ) ( VP ( VB ) ( NP ) ( NP ) ) ( . ) )': 1.0}",True,Do you know of any low-cost hotels nearby where I can stay for a week around the Riverside area?,( SQ ( VBP ) ( NP ( PRP ) ) ( VP ( VB ) ( PP ) ) ( . ) ),"{'( S ( VP ( VB ) ( NP ) ) )': 6.0, '( SQ ( MD ) ( NP ( PRP ) ) ( VP ( VB ) ( NP ) ( NP ) ) ( . ) )': 3.0}",True,Please recommend some affordable lodging options near Riverside suitable for a 7-day stay.,( S ( INTJ ( UH ) ) ( VP ( VB ) ( NP ) ) ( . ) ),"{'( S ( VP ( VB ) ( NP ) ) )': 3.0, '( SQ ( MD ) ( NP ( PRP ) ) ( VP ( VB ) ( NP ) ( NP ) ) ( . ) )': 5.0}",True
Send an email to Phil telling her that ''I got you'',SendMail,"[['contact', 'Phil'], ['message', 'I got you']]",( S ( VP ( VB ) ( NP ) ( PP ) ) ( '' ) ( '' ) ),ParaQuality,9,"['( S ( VP ( VB ) ( NP ) ) )', '( SQ ( MD ) ( NP ( PRP ) ) ( VP ( VB ) ( NP ) ( NP ) ) ( . ) )']","['Find videos on cooking', 'Can you tell me the current weather in Pesotum?']","Deliver an email to Phil, informing her that I have your back.","( S ( VP ( VB ) ( NP ) ( PP ) ( , ) ( S ) ) ( . ) )","{'( S ( VP ( VB ) ( NP ) ) )': 3.0, '( SQ ( MD ) ( NP ( PRP ) ) ( VP ( VB ) ( NP ) ( NP ) ) ( . ) )': 6.0}",True,"Could you please send a message to Phil, letting her know that she can count on me?",( SQ ( MD ) ( NP ( PRP ) ) ( VP ( UH ) ( VP ) ) ( . ) ),"{'( S ( VP ( VB ) ( NP ) ) )': 7.0, '( SQ ( MD ) ( NP ( PRP ) ) ( VP ( VB ) ( NP ) ( NP ) ) ( . ) )': 3.0}",True,"I need you to compose an email for Phil, conveying the message 'I'm here for you'.",( S ( NP ( PRP ) ) ( VP ( VBP ) ( S ) ) ( '' ) ( . ) ),"{'( S ( VP ( VB ) ( NP ) ) )': 6.0, '( SQ ( MD ) ( NP ( PRP ) ) ( VP ( VB ) ( NP ) ( NP ) ) ( . ) )': 6.0}",False,Can you draft an email addressed to Phil? In the content mention the phrase 'You can rely on me.',( SQ ( MD ) ( NP ( PRP ) ) ( VP ( VB ) ( NP ) ) ( . ) ( PP ( IN ) ( NP ) ) ( `` ) ( NP ( PRP ) ) ( VP ( MD ) ( VP ) ) ( . ) ( '' ) ),"{'( S ( VP ( VB ) ( NP ) ) )': 16.0, '( SQ ( MD ) ( NP ( PRP ) ) ( VP ( VB ) ( NP ) ( NP ) ) ( . ) )': 12.0}",False,"Please prepare and forward a message to Phil saying 'Don't worry, I'm there for you'.",( S ( NP ( UH ) ) ( VP ( VB ) ( CC ) ( VB ) ( NP ) ( PP ) ) ( '' ) ( . ) ),"{'( S ( VP ( VB ) ( NP ) ) )': 7.0, '( SQ ( MD ) ( NP ( PRP ) ) ( VP ( VB ) ( NP ) ( NP ) ) ( . ) )': 7.0}",False,Compose and deliver an email forwarding my assurance of support towards Phil.,( S ( VP ( VB ) ( CC ) ( VB ) ( NP ) ) ( . ) ),"{'( S ( VP ( VB ) ( NP ) ) )': 3.0, '( SQ ( MD ) ( NP ( PRP ) ) ( VP ( VB ) ( NP ) ( NP ) ) ( . ) )': 6.0}",True,Send a formal mail addressed to Philip communicating my response as 'No worries; got your back!',( S ( VP ( VB ) ( S ) ) ( . ) ( '' ) ),"{'( S ( VP ( VB ) ( NP ) ) )': 3.0, '( SQ ( MD ) ( NP ( PRP ) ) ( VP ( VB ) ( NP ) ( NP ) ) ( . ) )': 7.0}",True,Kindly write down a note in which it is conveyed that I'll always be there for Mr. Philip.,( S ( ADVP ( RB ) ) ( VP ( VB ) ( PRT ) ( NP ) ) ( . ) ),"{'( S ( VP ( VB ) ( NP ) ) )': 4.0, '( SQ ( MD ) ( NP ( PRP ) ) ( VP ( VB ) ( NP ) ( NP ) ) ( . ) )': 5.0}",False
Give me 5 conference articles about text mining,FindArticles,"[['query', 'text mining'], ['count', '5'], ['article_type', 'conference articles']]",( S ( VP ( VB ) ( NP ) ( NP ) ) ),ParaQuality,10,"['( S ( VP ( VB ) ( NP ) ) )', '( SQ ( MD ) ( NP ( PRP ) ) ( VP ( VB ) ( NP ) ( NP ) ) ( . ) )']","['Retrieve a selection of attractive photos that are similar to Opera House and have a resolution of 1024 pixels by 768 pixels', 'Can you tell me the least expensive one-way fare from Boston to Baltimore?']",Can you provide me with 5 conference articles related to text mining?,( SQ ( MD ) ( NP ( PRP ) ) ( VP ( VB ) ( NP ) ( PP ) ) ( . ) ),"{'( S ( VP ( VB ) ( NP ) ) )': 6.0, '( SQ ( MD ) ( NP ( PRP ) ) ( VP ( VB ) ( NP ) ( NP ) ) ( . ) )': 1.0}",True,I am looking for 5 conference articles specifically on text mining.,( S ( NP ( PRP ) ) ( VP ( VBP ) ( VP ) ) ( . ) ),"{'( S ( VP ( VB ) ( NP ) ) )': 5.0, '( SQ ( MD ) ( NP ( PRP ) ) ( VP ( VB ) ( NP ) ( NP ) ) ( . ) )': 5.0}",False,Could you gather a collection of 5 conference articles that discuss text mining?,( SQ ( MD ) ( NP ( PRP ) ) ( VP ( VB ) ( NP ) ) ( . ) ),"{'( S ( VP ( VB ) ( NP ) ) )': 5.0, '( SQ ( MD ) ( NP ( PRP ) ) ( VP ( VB ) ( NP ) ( NP ) ) ( . ) )': 1.0}",True,Please find me a list of 5 conference articles about text mining.,( S ( WHNP ( UH ) ) ( VP ( VB ) ( NP ) ( NP ) ) ( . ) ),"{'( S ( VP ( VB ) ( NP ) ) )': 4.0, '( SQ ( MD ) ( NP ( PRP ) ) ( VP ( VB ) ( NP ) ( NP ) ) ( . ) )': 4.0}",False,Do you have any information on 5 conference articles focusing on text mining?,( SQ ( VBP ) ( NP ( PRP ) ) ( VP ( VB ) ( NP ) ) ( . ) ),"{'( S ( VP ( VB ) ( NP ) ) )': 5.0, '( SQ ( MD ) ( NP ( PRP ) ) ( VP ( VB ) ( NP ) ( NP ) ) ( . ) )': 2.0}",True,I would like to find and read about 5 different texts regarding the subject of data mining at conferences.,( S ( NP ( PRP ) ) ( VP ( MD ) ( VP ) ) ( . ) ),"{'( S ( VP ( VB ) ( NP ) ) )': 5.0, '( SQ ( MD ) ( NP ( PRP ) ) ( VP ( VB ) ( NP ) ( NP ) ) ( . ) )': 5.0}",False,Is it possible for me to obtain a set of five published papers about using natural language processing techniques in analyzing written documents?,( SQ ( VBZ ) ( NP ( NP ) ) ( ADJP ( JJ ) ) ( SBAR ( IN ) ( S ) ) ( . ) ),"{'( S ( VP ( VB ) ( NP ) ) )': 8.0, '( SQ ( MD ) ( NP ( PRP ) ) ( VP ( VB ) ( NP ) ( NP ) ) ( . ) )': 8.0}",False,I'm seeking assistance in locating five research papers related to the theme of data extraction from textual information.,( S ( NP ( PRP ) ) ( VP ( VBP ) ( VP ) ) ( . ) ),"{'( S ( VP ( VB ) ( NP ) ) )': 5.0, '( SQ ( MD ) ( NP ( PRP ) ) ( VP ( VB ) ( NP ) ( NP ) ) ( . ) )': 5.0}",False
