input_utterance,intent,parameters,utterance_template,source,seed_id,selected_templates,selected_templates_related_paraphrases,p1,p1_template,p1_ted_to_selected_templates,p1_is_similar,p2,p2_template,p2_ted_to_selected_templates,p2_is_similar,p3,p3_template,p3_ted_to_selected_templates,p3_is_similar,p4,p4_template,p4_ted_to_selected_templates,p4_is_similar,p5,p5_template,p5_ted_to_selected_templates,p5_is_similar,p6,p6_template,p6_ted_to_selected_templates,p6_is_similar,p7,p7_template,p7_ted_to_selected_templates,p7_is_similar,p8,p8_template,p8_ted_to_selected_templates,p8_is_similar
"I would give With Lee in Virginia, A Story of the American Civil War chronicle 4 of 6",RateBook,"[['object_name', 'With Lee in Virginia, A Story of the American Civil War'], ['object_part_of_series_type', 'chronicle'], ['rating_value', '4'], ['best_rating', '6']]",( S ( NP ( PRP ) ) ( VP ( MD ) ( VP ) ) ),SNIPS,30,"['( S ( VP ( VB ) ( NP ) ) )', '( SQ ( MD ) ( NP ( PRP ) ) ( VP ( VB ) ( NP ) ( NP ) ) ( . ) )']","['locate Fox Theatres that are showing The Caretaker', 'Can you tell me the weather forecast for Harrison-Crawford State Forest?']","Find the 4th chronicle of With Lee in Virginia, A Story of the American Civil War out of 6",( S ( VP ( VB ) ( NP ) ( PP ) ) ),"{'( S ( VP ( VB ) ( NP ) ) )': 1.0, '( SQ ( MD ) ( NP ( PRP ) ) ( VP ( VB ) ( NP ) ( NP ) ) ( . ) )': 6.0}",True,"Locate chapter 4 out of 6 from the book With Lee in Virginia, A Story of the American Civil War",( S ( VP ( VB ) ( NP ) ( NP ) ( PP ) ) ),"{'( S ( VP ( VB ) ( NP ) ) )': 2.0, '( SQ ( MD ) ( NP ( PRP ) ) ( VP ( VB ) ( NP ) ( NP ) ) ( . ) )': 6.0}",True,Can you help me find one episode from a series called With Lee in Virginia about the American Civil War?,( SQ ( MD ) ( NP ( PRP ) ) ( VP ( VB ) ( S ) ) ( . ) ),"{'( S ( VP ( VB ) ( NP ) ) )': 6.0, '( SQ ( MD ) ( NP ( PRP ) ) ( VP ( VB ) ( NP ) ( NP ) ) ( . ) )': 2.0}",True,"I need assistance locating the fourth part among six parts that cover The American Civil War by With Lee in Virginia, A Story.",( S ( NP ( PRP ) ) ( VP ( VBP ) ( NP ) ) ( . ) ),"{'( S ( VP ( VB ) ( NP ) ) )': 4.0, '( SQ ( MD ) ( NP ( PRP ) ) ( VP ( VB ) ( NP ) ( NP ) ) ( . ) )': 4.0}",False,Discover where I can find chapter four titled 'With Lee in Virginia' which is part six total chronicles on American Civil war.,( S ( S ( VP ) ( '' ) ) ( SBAR ( WHNP ) ( S ) ) ( . ) ),"{'( S ( VP ( VB ) ( NP ) ) )': 6.0, '( SQ ( MD ) ( NP ( PRP ) ) ( VP ( VB ) ( NP ) ( NP ) ) ( . ) )': 8.0}",False,Is there a way for me to access Episode four named 'With lee In virginia' whish is a story about America's civil war?,( SQ ( VBZ ) ( NP ( EX ) ) ( NP ( NP ) ( NN ) ) ( VP ( VBZ ) ( NP ) ) ( . ) ),"{'( S ( VP ( VB ) ( NP ) ) )': 9.0, '( SQ ( MD ) ( NP ( PRP ) ) ( VP ( VB ) ( NP ) ( NP ) ) ( . ) )': 7.0}",False,Could you assist me with finding chronical number four called 'with lee In virginia'? It's part if an epic on american civil war. This would be story number among six total stories consulted by or related to it.,( S ( SQ ( MD ) ( NP ) ( VP ) ) ( . ) ( S ( NP ) ( VP ) ) ( . ) ( S ( NP ) ( VP ) ) ( . ) ),"{'( S ( VP ( VB ) ( NP ) ) )': 10.0, '( SQ ( MD ) ( NP ( PRP ) ) ( VP ( VB ) ( NP ) ( NP ) ) ( . ) )': 9.0}",False,"'On american civil wart there are six connecting stories and within them searching for Vandergrift', do you have that?","( S ( `` ) ( PP ( IN ) ( NP ) ) ( NP ( EX ) ) ( VP ( VBP ) ( NP ) ( S ) ) ( '' ) ( , ) ( SQ ( VBP ) ( NP ) ( VP ) ) ( . ) )","{'( S ( VP ( VB ) ( NP ) ) )': 14.0, '( SQ ( MD ) ( NP ( PRP ) ) ( VP ( VB ) ( NP ) ( NP ) ) ( . ) )': 14.0}",False
Rate this album two out of 6,RateBook,"[['object_select', 'this'], ['object_type', 'album'], ['rating_value', 'two'], ['best_rating', '6']]",( S ( VP ( VB ) ( NP ) ( NP ) ) ),SNIPS,31,"['( S ( VP ( VB ) ( NP ) ) )', '( SQ ( MD ) ( NP ( PRP ) ) ( VP ( VB ) ( NP ) ( NP ) ) ( . ) )']","['locate Fox Theatres featuring The Caretaker', 'Can you find me the least expensive ticket for a one-way trip from Boston to Baltimore?']",Give this album a rating of 2 out of 6.,( S ( VP ( VB ) ( NP ) ( NP ) ) ( . ) ),"{'( S ( VP ( VB ) ( NP ) ) )': 2.0, '( SQ ( MD ) ( NP ( PRP ) ) ( VP ( VB ) ( NP ) ( NP ) ) ( . ) )': 4.0}",True,Rate this album with a score of two out of six.,( S ( VP ( VB ) ( NP ) ( PP ) ) ( . ) ),"{'( S ( VP ( VB ) ( NP ) ) )': 2.0, '( SQ ( MD ) ( NP ( PRP ) ) ( VP ( VB ) ( NP ) ( NP ) ) ( . ) )': 5.0}",True,What would you rate this album on a scale of two to six?,( SBARQ ( WHNP ( WP ) ) ( SQ ( MD ) ( NP ) ( VP ) ) ( . ) ),"{'( S ( VP ( VB ) ( NP ) ) )': 7.0, '( SQ ( MD ) ( NP ( PRP ) ) ( VP ( VB ) ( NP ) ( NP ) ) ( . ) )': 7.0}",False,Can you assign a rating of 2 out of 6 to this album?,( SQ ( MD ) ( NP ( PRP ) ) ( VP ( VB ) ( NP ) ( PP ) ) ( . ) ),"{'( S ( VP ( VB ) ( NP ) ) )': 6.0, '( SQ ( MD ) ( NP ( PRP ) ) ( VP ( VB ) ( NP ) ( NP ) ) ( . ) )': 1.0}",True,"Provide an assessment for this album, giving it a ranking from two to six.","( S ( VP ( VB ) ( NP ) ( , ) ( S ) ) ( . ) )","{'( S ( VP ( VB ) ( NP ) ) )': 2.0, '( SQ ( MD ) ( NP ( PRP ) ) ( VP ( VB ) ( NP ) ( NP ) ) ( . ) )': 5.0}",True,"Evaluate and give feedback for this album, giving it a score between two and six.","( S ( VP ( VB ) ( CC ) ( VB ) ( NP ) ( PP ) ( , ) ( S ) ) ( . ) )","{'( S ( VP ( VB ) ( NP ) ) )': 5.0, '( SQ ( MD ) ( NP ( PRP ) ) ( VP ( VB ) ( NP ) ( NP ) ) ( . ) )': 8.0}",False,Indicate your opinion on the quality level of this music by assigning it a rating between two and six.,( S ( VP ( VB ) ( NP ) ( PP ) ) ( . ) ),"{'( S ( VP ( VB ) ( NP ) ) )': 2.0, '( SQ ( MD ) ( NP ( PRP ) ) ( VP ( VB ) ( NP ) ( NP ) ) ( . ) )': 5.0}",True,How would you rate the performance in terms relative to expectations? Rate as two out my maximum expectation value.,( S ( SBARQ ( WHADVP ) ( SQ ) ( . ) ) ( VP ( NN ) ( PP ) ( PP ) ) ( . ) ),"{'( S ( VP ( VB ) ( NP ) ) )': 8.0, '( SQ ( MD ) ( NP ( PRP ) ) ( VP ( VB ) ( NP ) ( NP ) ) ( . ) )': 9.0}",False
Give the current part of the saga 4 points out of 6.,RateBook,"[['object_select', 'current'], ['object_part_of_series_type', 'saga'], ['rating_value', '4'], ['rating_unit', 'points'], ['best_rating', '6']]",( S ( VP ( VB ) ( NP ) ( NP ) ) ( . ) ),SNIPS,32,"['( S ( VP ( VB ) ( NP ) ) )', '( SQ ( MD ) ( NP ( PRP ) ) ( VP ( VB ) ( NP ) ( NP ) ) ( . ) )']","['include the artist Kirk Hammett in my Party playlist', 'Can you find me the publication called The Lion Sleeps Tonight?']",Rate the current installment of the series with a score of 4 out of 6.,( S ( VP ( VB ) ( NP ) ( PP ) ) ( . ) ),"{'( S ( VP ( VB ) ( NP ) ) )': 2.0, '( SQ ( MD ) ( NP ( PRP ) ) ( VP ( VB ) ( NP ) ( NP ) ) ( . ) )': 5.0}",True,Give a rating of 4 out of 6 to the current part of the saga.,( S ( VP ( VB ) ( NP ) ( PP ) ) ( . ) ),"{'( S ( VP ( VB ) ( NP ) ) )': 2.0, '( SQ ( MD ) ( NP ( PRP ) ) ( VP ( VB ) ( NP ) ( NP ) ) ( . ) )': 5.0}",True,Can you assign 4 points out of 6 to the ongoing chapter in the saga?,( SQ ( MD ) ( NP ( PRP ) ) ( VP ( VB ) ( NP ) ( PP ) ) ( . ) ),"{'( S ( VP ( VB ) ( NP ) ) )': 6.0, '( SQ ( MD ) ( NP ( PRP ) ) ( VP ( VB ) ( NP ) ( NP ) ) ( . ) )': 1.0}",True,Please rate this section in the saga and give it a score between four and six.,( S ( NP ( UH ) ) ( VP ( VP ) ( CC ) ( VP ) ) ( . ) ),"{'( S ( VP ( VB ) ( NP ) ) )': 6.0, '( SQ ( MD ) ( NP ( PRP ) ) ( VP ( VB ) ( NP ) ( NP ) ) ( . ) )': 6.0}",False,What would you rate this part of the saga on a scale from one to ten?,( SBARQ ( WHNP ( WP ) ) ( SQ ( MD ) ( NP ) ( VP ) ) ( . ) ),"{'( S ( VP ( VB ) ( NP ) ) )': 7.0, '( SQ ( MD ) ( NP ( PRP ) ) ( VP ( VB ) ( NP ) ( NP ) ) ( . ) )': 7.0}",False,Is it possible for you to grade this portion of the story using a system where six is maximum points?,( SQ ( VBZ ) ( NP ( NP ) ) ( ADJP ( JJ ) ) ( SBAR ( IN ) ( S ) ) ( . ) ),"{'( S ( VP ( VB ) ( NP ) ) )': 8.0, '( SQ ( MD ) ( NP ( PRP ) ) ( VP ( VB ) ( NP ) ( NP ) ) ( . ) )': 8.0}",False,Could you assess how much I should enjoy this specific segment on a scale from one to five?,( SQ ( MD ) ( NP ( PRP ) ) ( VP ( VB ) ( SBAR ) ) ( . ) ),"{'( S ( VP ( VB ) ( NP ) ) )': 6.0, '( SQ ( MD ) ( NP ( PRP ) ) ( VP ( VB ) ( NP ) ( NP ) ) ( . ) )': 2.0}",True,"In terms evaluating, what mark does this piece merit ona scale from zero or six?","( FRAG ( PP ( IN ) ( NP ) ) ( , ) ( WHNP ( WDT ) ( NN ) ) ( SQ ( VBZ ) ( NP ) ( VP ) ) ( . ) )","{'( S ( VP ( VB ) ( NP ) ) )': 12.0, '( SQ ( MD ) ( NP ( PRP ) ) ( VP ( VB ) ( NP ) ( NP ) ) ( . ) )': 11.0}",False
Can you play some fifties music by lavern baker,PlayMusic,"[['year', 'fifties'], ['artist', 'lavern baker']]",( SQ ( MD ) ( NP ( PRP ) ) ( VP ( VB ) ( NP ) ( PP ) ) ),SNIPS,33,"['( S ( VP ( VB ) ( NP ) ) )', '( SQ ( MD ) ( NP ( PRP ) ) ( VP ( VB ) ( NP ) ( NP ) ) ( . ) )']","['locate Fox Theatres that are showing The Caretaker', 'Can you tell me the weather forecast for Harrison-Crawford State Forest?']",Could you find some Italian restaurants nearby?,( SQ ( MD ) ( NP ( PRP ) ) ( VP ( VB ) ( NP ) ( ADVP ) ) ( . ) ),"{'( S ( VP ( VB ) ( NP ) ) )': 6.0, '( SQ ( MD ) ( NP ( PRP ) ) ( VP ( VB ) ( NP ) ( NP ) ) ( . ) )': 1.0}",True,I'm looking for places that serve Italian cuisine.,( S ( NP ( PRP ) ) ( VP ( VBP ) ( VP ) ) ( . ) ),"{'( S ( VP ( VB ) ( NP ) ) )': 5.0, '( SQ ( MD ) ( NP ( PRP ) ) ( VP ( VB ) ( NP ) ( NP ) ) ( . ) )': 5.0}",False,Is there any restaurant around here that specializes in Italian food?,( SQ ( VBZ ) ( NP ( EX ) ) ( NP ( NP ) ( SBAR ) ) ( . ) ),"{'( S ( VP ( VB ) ( NP ) ) )': 7.0, '( SQ ( MD ) ( NP ( PRP ) ) ( VP ( VB ) ( NP ) ( NP ) ) ( . ) )': 5.0}",False,Can you recommend me a place with good Italian dishes?,( SQ ( MD ) ( NP ( PRP ) ) ( VP ( VB ) ( NP ) ( NP ) ) ( . ) ),"{'( S ( VP ( VB ) ( NP ) ) )': 6.0, '( SQ ( MD ) ( NP ( PRP ) ) ( VP ( VB ) ( NP ) ( NP ) ) ( . ) )': 0.0}",True,Tell me about some eateries where I can get Italian meals.,( S ( VP ( VB ) ( NP ) ( PP ) ) ( . ) ),"{'( S ( VP ( VB ) ( NP ) ) )': 2.0, '( SQ ( MD ) ( NP ( PRP ) ) ( VP ( VB ) ( NP ) ( NP ) ) ( . ) )': 5.0}",True,Do you know any dining establishments serving Italian cuisine?,( SQ ( VBP ) ( NP ( PRP ) ) ( VP ( VB ) ( NP ) ) ( . ) ),"{'( S ( VP ( VB ) ( NP ) ) )': 5.0, '( SQ ( MD ) ( NP ( PRP ) ) ( VP ( VB ) ( NP ) ( NP ) ) ( . ) )': 2.0}",True,Are there any places nearby where I can get some authentic Italian food?,( SQ ( VBP ) ( NP ( EX ) ) ( NP ( NP ) ( ADVP ) ) ( SBAR ( WHADVP ) ( S ) ) ( . ) ),"{'( S ( VP ( VB ) ( NP ) ) )': 9.0, '( SQ ( MD ) ( NP ( PRP ) ) ( VP ( VB ) ( NP ) ( NP ) ) ( . ) )': 7.0}",False,"I'm craving for pasta and pizza, do you have any recommendations?","( S ( NP ( PRP ) ) ( VP ( VP ) ( , ) ( SINV ) ) ( . ) )","{'( S ( VP ( VB ) ( NP ) ) )': 6.0, '( SQ ( MD ) ( NP ( PRP ) ) ( VP ( VB ) ( NP ) ( NP ) ) ( . ) )': 5.0}",False
Play a 1964 track from Shahram Nazeri on Pandora.,PlayMusic,"[['year', '1964'], ['music_item', 'track'], ['artist', 'Shahram Nazeri'], ['service', 'Pandora']]",( S ( VP ( VB ) ( NP ) ) ( . ) ),SNIPS,34,"['( S ( VP ( VB ) ( NP ) ) )', '( SQ ( MD ) ( NP ( PRP ) ) ( VP ( VB ) ( NP ) ( NP ) ) ( . ) )']","['find the lowest cost ticket from Denver to Pittsburgh', 'Can you tell me the cheapest price for a flight from Denver to Pittsburgh?']",Find a Shahram Nazeri track released in 1964 on Pandora.,( S ( VP ( VB ) ( NP ) ) ( . ) ),"{'( S ( VP ( VB ) ( NP ) ) )': 1.0, '( SQ ( MD ) ( NP ( PRP ) ) ( VP ( VB ) ( NP ) ( NP ) ) ( . ) )': 5.0}",True,Search for a song by Shahram Nazeri that was published in 1964 on Pandora.,( S ( VP ( VB ) ( PP ) ) ( . ) ),"{'( S ( VP ( VB ) ( NP ) ) )': 2.0, '( SQ ( MD ) ( NP ( PRP ) ) ( VP ( VB ) ( NP ) ( NP ) ) ( . ) )': 6.0}",True,Look up a 1964 tune from Shahram Nazeri on Pandora.,( S ( VP ( VB ) ( PRT ) ( NP ) ) ( . ) ),"{'( S ( VP ( VB ) ( NP ) ) )': 2.0, '( SQ ( MD ) ( NP ( PRP ) ) ( VP ( VB ) ( NP ) ( NP ) ) ( . ) )': 5.0}",True,Discover and play an old track by Shahram Nazeri on Pandora from the year 1964.,( S ( VP ( VB ) ( CC ) ( VB ) ( NP ) ( PP ) ( PP ) ) ( . ) ),"{'( S ( VP ( VB ) ( NP ) ) )': 5.0, '( SQ ( MD ) ( NP ( PRP ) ) ( VP ( VB ) ( NP ) ( NP ) ) ( . ) )': 8.0}",False,Can you find and play a song by Shahram Nazeri from the year 1964 on Pandora?,( SQ ( MD ) ( NP ( PRP ) ) ( VP ( VB ) ( CC ) ( VB ) ( NP ) ( PP ) ( PP ) ) ( . ) ),"{'( S ( VP ( VB ) ( NP ) ) )': 9.0, '( SQ ( MD ) ( NP ( PRP ) ) ( VP ( VB ) ( NP ) ( NP ) ) ( . ) )': 4.0}",False,Please play a song called 'Shahram Nazeri' that was released in 1964 from my library of songs available through the platform 'Pandora'.,( VP ( UH ) ( VP ( VB ) ( NP ) ) ( . ) ),"{'( S ( VP ( VB ) ( NP ) ) )': 3.0, '( SQ ( MD ) ( NP ( PRP ) ) ( VP ( VB ) ( NP ) ( NP ) ) ( . ) )': 5.0}",True,"Could you search for and stream a track titled 'Shahram Narez' that came out in nineteen sixty-four, using my subscription to the music streaming service, named 'Pandora'?",( SQ ( MD ) ( NP ( PRP ) ) ( VP ( VB ) ( PP ) ) ( . ) ),"{'( S ( VP ( VB ) ( NP ) ) )': 6.0, '( SQ ( MD ) ( NP ( PRP ) ) ( VP ( VB ) ( NP ) ( NP ) ) ( . ) )': 2.0}",True,"On my music app, could you locate and listen to one of Shawham Nezeris's tracks? It's specifically one made in nineteen sixty-four.","( FRAG ( PP ( IN ) ( NP ) ) ( , ) ( MD ) ( NP ( PRP ) ) ( VP ( VP ) ( CC ) ( VP ) ) ( . ) ( S ( NP ) ( VP ) ) ( . ) )","{'( S ( VP ( VB ) ( NP ) ) )': 15.0, '( SQ ( MD ) ( NP ( PRP ) ) ( VP ( VB ) ( NP ) ( NP ) ) ( . ) )': 11.0}",False
Please play me some Satire music,PlayMusic,"[['genre', 'Satire']]",( S ( X ( UH ) ) ( VP ( VB ) ( NP ) ( NP ) ) ),SNIPS,35,"['( S ( VP ( VB ) ( NP ) ) )', '( SQ ( MD ) ( NP ( PRP ) ) ( VP ( VB ) ( NP ) ( NP ) ) ( . ) )']","['Find 5 conference papers discussing text mining', 'Can you tell me the least expensive one-way fare from Boston to Baltimore?']",Can you please find some restaurants that serve Italian cuisine?,( SQ ( MD ) ( NP ( PRP ) ) ( VP ( UH ) ( VP ) ) ( . ) ),"{'( S ( VP ( VB ) ( NP ) ) )': 7.0, '( SQ ( MD ) ( NP ( PRP ) ) ( VP ( VB ) ( NP ) ( NP ) ) ( . ) )': 3.0}",True,I'm looking for places that have Italian food. Can you help me?,( S ( NP ( PRP ) ) ( VP ( VBP ) ( VP ) ) ( . ) ( SQ ( MD ) ( NP ) ( VP ) ) ( . ) ),"{'( S ( VP ( VB ) ( NP ) ) )': 10.0, '( SQ ( MD ) ( NP ( PRP ) ) ( VP ( VB ) ( NP ) ( NP ) ) ( . ) )': 9.0}",False,Please locate some restaurants serving Italian dishes for me.,( VP ( UH ) ( VP ( VB ) ( NP ) ) ( . ) ),"{'( S ( VP ( VB ) ( NP ) ) )': 3.0, '( SQ ( MD ) ( NP ( PRP ) ) ( VP ( VB ) ( NP ) ( NP ) ) ( . ) )': 5.0}",True,Could you assist me in finding eateries with Italian cuisine?,( SQ ( MD ) ( NP ( PRP ) ) ( VP ( VB ) ( NP ) ( PP ) ) ( . ) ),"{'( S ( VP ( VB ) ( NP ) ) )': 6.0, '( SQ ( MD ) ( NP ( PRP ) ) ( VP ( VB ) ( NP ) ( NP ) ) ( . ) )': 1.0}",True,Can you please recommend some restaurants that specialize in Italian food?,( SQ ( MD ) ( NP ( PRP ) ) ( VP ( UH ) ( VP ) ) ( . ) ),"{'( S ( VP ( VB ) ( NP ) ) )': 7.0, '( SQ ( MD ) ( NP ( PRP ) ) ( VP ( VB ) ( NP ) ( NP ) ) ( . ) )': 3.0}",True,I'd like your help in finding places to eat where they serve Italian cuisine.,( S ( NP ( PRP ) ) ( VP ( MD ) ( VP ) ) ( . ) ),"{'( S ( VP ( VB ) ( NP ) ) )': 5.0, '( SQ ( MD ) ( NP ( PRP ) ) ( VP ( VB ) ( NP ) ( NP ) ) ( . ) )': 5.0}",False,Can you find me a list of establishments that offer Italian food?,( SQ ( MD ) ( NP ( PRP ) ) ( VP ( VB ) ( NP ) ( NP ) ) ( . ) ),"{'( S ( VP ( VB ) ( NP ) ) )': 6.0, '( SQ ( MD ) ( NP ( PRP ) ) ( VP ( VB ) ( NP ) ( NP ) ) ( . ) )': 0.0}",True,Please assist me by locating dining options with dishes from Italy.,( S ( X ( UH ) ) ( VP ( VB ) ( NP ) ( PP ) ) ( . ) ),"{'( S ( VP ( VB ) ( NP ) ) )': 4.0, '( SQ ( MD ) ( NP ( PRP ) ) ( VP ( VB ) ( NP ) ( NP ) ) ( . ) )': 5.0}",False
When is Crime and Punishment U.S.A. showing?,SearchScreeningEvent,"[['movie_name', 'Crime and Punishment U.S.A.']]",( SBARQ ( WHADVP ( WRB ) ) ( SQ ( VBZ ) ( NP ) ( VP ) ) ( . ) ),SNIPS,36,"['( S ( VP ( VB ) ( NP ) ) )', '( SQ ( MD ) ( NP ( PRP ) ) ( VP ( VB ) ( NP ) ( NP ) ) ( . ) )']","['find places where I can listen to Join the Dots: B-sides and Rarities', 'Can you tell me the weather forecast for Anston in colder temperatures?']",What is the schedule for Crime and Punishment U.S.A.?,( SBARQ ( WHNP ( WP ) ) ( VP ( VBZ ) ( NP ) ) ( . ) ),"{'( S ( VP ( VB ) ( NP ) ) )': 5.0, '( SQ ( MD ) ( NP ( PRP ) ) ( VP ( VB ) ( NP ) ( NP ) ) ( . ) )': 6.0}",False,When will they be showing Crime and Punishment U.S.A.?,( SBARQ ( WHADVP ( WRB ) ) ( SQ ( MD ) ( NP ) ( VP ) ) ( . ) ),"{'( S ( VP ( VB ) ( NP ) ) )': 7.0, '( SQ ( MD ) ( NP ( PRP ) ) ( VP ( VB ) ( NP ) ( NP ) ) ( . ) )': 7.0}",False,Can you give me the showtimes for Crime and Punishment U.S.A.?,( SQ ( MD ) ( NP ( PRP ) ) ( VP ( VB ) ( NP ) ( NP ) ) ( . ) ),"{'( S ( VP ( VB ) ( NP ) ) )': 6.0, '( SQ ( MD ) ( NP ( PRP ) ) ( VP ( VB ) ( NP ) ( NP ) ) ( . ) )': 0.0}",True,I would like to know when Crime and Punishment U.S.A. is playing.,( S ( NP ( PRP ) ) ( VP ( MD ) ( VP ) ) ( . ) ),"{'( S ( VP ( VB ) ( NP ) ) )': 5.0, '( SQ ( MD ) ( NP ( PRP ) ) ( VP ( VB ) ( NP ) ( NP ) ) ( . ) )': 5.0}",False,Is there a specific time slot for Crime and Punishment U.S.A.?,( SQ ( VBZ ) ( NP ( EX ) ) ( NP ( NP ) ( PP ) ) ( . ) ),"{'( S ( VP ( VB ) ( NP ) ) )': 7.0, '( SQ ( MD ) ( NP ( PRP ) ) ( VP ( VB ) ( NP ) ( NP ) ) ( . ) )': 5.0}",False,At what time can I watch Crime and Punishment U.S.A.?,( SBARQ ( WHPP ( IN ) ( WHNP ) ) ( SQ ( MD ) ( NP ) ( VP ) ) ( . ) ),"{'( S ( VP ( VB ) ( NP ) ) )': 8.0, '( SQ ( MD ) ( NP ( PRP ) ) ( VP ( VB ) ( NP ) ( NP ) ) ( . ) )': 8.0}",False,Please let me know when I can see Crime and Punshiment USA,( S ( INTJ ( UH ) ) ( VP ( VB ) ( S ) ) ),"{'( S ( VP ( VB ) ( NP ) ) )': 3.0, '( SQ ( MD ) ( NP ( PRP ) ) ( VP ( VB ) ( NP ) ( NP ) ) ( . ) )': 7.0}",True,Could you provide me with the time at which I can see 2Crime And punushment USA please?,( SQ ( MD ) ( NP ( PRP ) ) ( VP ( VB ) ( NP ) ( PP ) ) ( . ) ),"{'( S ( VP ( VB ) ( NP ) ) )': 6.0, '( SQ ( MD ) ( NP ( PRP ) ) ( VP ( VB ) ( NP ) ( NP ) ) ( . ) )': 1.0}",True
find Fox Theatres with The Caretaker,SearchScreeningEvent,"[['location_name', 'Fox Theatres'], ['movie_name', 'The Caretaker']]",( S ( VP ( VB ) ( NP ) ( PP ) ) ),SNIPS,37,"['( S ( VP ( VB ) ( NP ) ) )', '( SQ ( MD ) ( NP ( PRP ) ) ( VP ( VB ) ( NP ) ( NP ) ) ( . ) )']","['Discover a handful of stunning photos featuring the Opera House, all with dimensions of 1024 pixels by 768 pixels', 'Can you tell me the proximity of the nearest taxi?']",Locate Fox Theatres with The Caretaker,( S ( VP ( VB ) ( NP ) ( PP ) ) ),"{'( S ( VP ( VB ) ( NP ) ) )': 1.0, '( SQ ( MD ) ( NP ( PRP ) ) ( VP ( VB ) ( NP ) ( NP ) ) ( . ) )': 6.0}",True,Find movie theaters that are showing The Caretaker at Fox Theatres,( S ( VP ( VB ) ( NP ) ) ),"{'( S ( VP ( VB ) ( NP ) ) )': 0.0, '( SQ ( MD ) ( NP ( PRP ) ) ( VP ( VB ) ( NP ) ( NP ) ) ( . ) )': 6.0}",True,Discover the location of Fox Theatres where you can watch The Caretaker,( S ( VP ( VB ) ( NP ) ) ),"{'( S ( VP ( VB ) ( NP ) ) )': 0.0, '( SQ ( MD ) ( NP ( PRP ) ) ( VP ( VB ) ( NP ) ( NP ) ) ( . ) )': 6.0}",True,Search for cinemas screening the movie called The Caretaker at Fox Theatres,( S ( VP ( VB ) ( PP ) ) ),"{'( S ( VP ( VB ) ( NP ) ) )': 1.0, '( SQ ( MD ) ( NP ( PRP ) ) ( VP ( VB ) ( NP ) ( NP ) ) ( . ) )': 7.0}",True,Can you find me information on theaters playing a film called 'The Caretaker' in the vicinity of Fox?,( SQ ( MD ) ( NP ( PRP ) ) ( VP ( VB ) ( NP ) ( NP ) ) ( . ) ),"{'( S ( VP ( VB ) ( NP ) ) )': 6.0, '( SQ ( MD ) ( NP ( PRP ) ) ( VP ( VB ) ( NP ) ( NP ) ) ( . ) )': 0.0}",True,I'm looking for places to see a movie called 'The Caretaker' and I would like to know if there are any theatres around here.,( S ( S ( NP ) ( VP ) ) ( CC ) ( S ( NP ) ( VP ) ) ( . ) ),"{'( S ( VP ( VB ) ( NP ) ) )': 6.0, '( SQ ( MD ) ( NP ( PRP ) ) ( VP ( VB ) ( NP ) ( NP ) ) ( . ) )': 7.0}",False,Are there any film venues showing 'The Carer' in the area near me?,( SQ ( VBP ) ( NP ( EX ) ) ( NP ( NP ) ( VP ) ) ( . ) ),"{'( S ( VP ( VB ) ( NP ) ) )': 7.0, '( SQ ( MD ) ( NP ( PRP ) ) ( VP ( VB ) ( NP ) ( NP ) ) ( . ) )': 5.0}",False,Could you assist me in locating cinema halls where I can watch a film named 'The Caregiver'?,( SQ ( MD ) ( NP ( PRP ) ) ( VP ( VB ) ( NP ) ( PP ) ) ( '' ) ( . ) ),"{'( S ( VP ( VB ) ( NP ) ) )': 7.0, '( SQ ( MD ) ( NP ( PRP ) ) ( VP ( VB ) ( NP ) ( NP ) ) ( . ) )': 2.0}",True
I would like to watch The Wedding Ring at the movie theatre,SearchScreeningEvent,"[['movie_name', 'The Wedding Ring'], ['object_location_type', 'movie theatre']]",( S ( NP ( PRP ) ) ( VP ( MD ) ( VP ) ) ),SNIPS,38,"['( S ( VP ( VB ) ( NP ) ) )', '( SQ ( MD ) ( NP ( PRP ) ) ( VP ( VB ) ( NP ) ( NP ) ) ( . ) )']","['define dfw', 'Could you show me 5 conference articles on the topic of text mining?']",Can you tell me where I can go to see The Wedding Ring at a movie theatre?,( SQ ( MD ) ( NP ( PRP ) ) ( VP ( VB ) ( NP ) ( SBAR ) ) ( . ) ),"{'( S ( VP ( VB ) ( NP ) ) )': 6.0, '( SQ ( MD ) ( NP ( PRP ) ) ( VP ( VB ) ( NP ) ( NP ) ) ( . ) )': 1.0}",True,I'm interested in finding a movie theatre that is showing The Wedding Ring.,( S ( NP ( PRP ) ) ( VP ( VBP ) ( ADJP ) ) ( . ) ),"{'( S ( VP ( VB ) ( NP ) ) )': 5.0, '( SQ ( MD ) ( NP ( PRP ) ) ( VP ( VB ) ( NP ) ( NP ) ) ( . ) )': 5.0}",False,Do you know any movie theatres playing The Wedding Ring?,( SQ ( VBP ) ( NP ( PRP ) ) ( VP ( VB ) ( NP ) ) ( . ) ),"{'( S ( VP ( VB ) ( NP ) ) )': 5.0, '( SQ ( MD ) ( NP ( PRP ) ) ( VP ( VB ) ( NP ) ( NP ) ) ( . ) )': 2.0}",True,Is there a cinema nearby where I can watch The Wedding Ring?,( SQ ( VBZ ) ( NP ( EX ) ) ( NP ( NP ) ( ADVP ) ( SBAR ) ) ( . ) ),"{'( S ( VP ( VB ) ( NP ) ) )': 8.0, '( SQ ( MD ) ( NP ( PRP ) ) ( VP ( VB ) ( NP ) ( NP ) ) ( . ) )': 6.0}",False,I want to see The Wedding Ring and I need to find a cinema that is showing it.,( S ( S ( NP ) ( VP ) ) ( CC ) ( S ( NP ) ( VP ) ) ( . ) ),"{'( S ( VP ( VB ) ( NP ) ) )': 6.0, '( SQ ( MD ) ( NP ( PRP ) ) ( VP ( VB ) ( NP ) ( NP ) ) ( . ) )': 7.0}",False,Could you suggest a place where I can watch The Wedding Ring at the movies?,( SQ ( MD ) ( NP ( PRP ) ) ( VP ( VB ) ( NP ) ) ( . ) ),"{'( S ( VP ( VB ) ( NP ) ) )': 5.0, '( SQ ( MD ) ( NP ( PRP ) ) ( VP ( VB ) ( NP ) ( NP ) ) ( . ) )': 1.0}",True,I'm looking for information on which movie theatres are screening The Wedding Ring.,( S ( NP ( PRP ) ) ( VP ( VBP ) ( VP ) ) ( . ) ),"{'( S ( VP ( VB ) ( NP ) ) )': 5.0, '( SQ ( MD ) ( NP ( PRP ) ) ( VP ( VB ) ( NP ) ( NP ) ) ( . ) )': 5.0}",False,Where can I go to catch a screening of The Wedding Ring?,( SBARQ ( WHADVP ( WRB ) ) ( SQ ( MD ) ( NP ) ( VP ) ) ( . ) ),"{'( S ( VP ( VB ) ( NP ) ) )': 7.0, '( SQ ( MD ) ( NP ( PRP ) ) ( VP ( VB ) ( NP ) ( NP ) ) ( . ) )': 7.0}",False
I want to read the book The Lion Sleeps Tonight,SearchCreativeWork,"[['object_type', 'book'], ['object_name', 'The Lion Sleeps Tonight']]",( S ( NP ( PRP ) ) ( VP ( VBP ) ( S ) ) ),SNIPS,39,"['( S ( VP ( VB ) ( NP ) ) )', '( SQ ( MD ) ( NP ( PRP ) ) ( VP ( VB ) ( NP ) ( NP ) ) ( . ) )']","['Locate several lovely images that correspond to Opera House and have a size of 1024 pixels by 768 pixels', 'Can you find me any budget-friendly hotels for a 7-day stay in the vicinity of Riverside?']",Please locate the book titled The Lion Sleeps Tonight for me to read.,( VP ( UH ) ( VP ( VB ) ( NP ) ( SBAR ) ) ( . ) ),"{'( S ( VP ( VB ) ( NP ) ) )': 4.0, '( SQ ( MD ) ( NP ( PRP ) ) ( VP ( VB ) ( NP ) ( NP ) ) ( . ) )': 5.0}",False,I am interested in reading The Lion Sleeps Tonight book. Can you help me find it?,( S ( NP ( PRP ) ) ( VP ( VBP ) ( ADJP ) ) ( . ) ( SQ ( MD ) ( NP ) ( VP ) ) ( . ) ),"{'( S ( VP ( VB ) ( NP ) ) )': 10.0, '( SQ ( MD ) ( NP ( PRP ) ) ( VP ( VB ) ( NP ) ( NP ) ) ( . ) )': 9.0}",False,Could you assist me in finding and reading the book called The Lion Sleeps Tonight?,( SQ ( MD ) ( NP ( PRP ) ) ( VP ( VB ) ( NP ) ( PP ) ) ( . ) ),"{'( S ( VP ( VB ) ( NP ) ) )': 6.0, '( SQ ( MD ) ( NP ( PRP ) ) ( VP ( VB ) ( NP ) ( NP ) ) ( . ) )': 1.0}",True,Can you find me a copy of the book named The Lion Sleeps Tonight that I can read?,( SQ ( MD ) ( NP ( PRP ) ) ( VP ( VB ) ( NP ) ( NP ) ) ( . ) ),"{'( S ( VP ( VB ) ( NP ) ) )': 6.0, '( SQ ( MD ) ( NP ( PRP ) ) ( VP ( VB ) ( NP ) ( NP ) ) ( . ) )': 0.0}",True,I'm looking for a way to access and read the book known as The Lion Sleeps Tonight.,( S ( NP ( PRP ) ) ( VP ( VBP ) ( VP ) ) ( . ) ),"{'( S ( VP ( VB ) ( NP ) ) )': 5.0, '( SQ ( MD ) ( NP ( PRP ) ) ( VP ( VB ) ( NP ) ( NP ) ) ( . ) )': 5.0}",False,Is it possible for you to provide assistance in locating and allowing me to read the novel titled The Lion Sleeps Tonight?,( SQ ( VBZ ) ( NP ( NP ) ) ( ADJP ( JJ ) ) ( SBAR ( IN ) ( S ) ) ( . ) ),"{'( S ( VP ( VB ) ( NP ) ) )': 8.0, '( SQ ( MD ) ( NP ( PRP ) ) ( VP ( VB ) ( NP ) ( NP ) ) ( . ) )': 8.0}",False,"Are there any options available for accessing and enjoying reading material, such as the novel with the title of The Lion Sleeps Tonight?",( SQ ( VBP ) ( NP ( EX ) ) ( NP ( NP ) ( ADJP ) ) ( . ) ),"{'( S ( VP ( VB ) ( NP ) ) )': 7.0, '( SQ ( MD ) ( NP ( PRP ) ) ( VP ( VB ) ( NP ) ( NP ) ) ( . ) )': 5.0}",False,Could you suggest a source where I can find an electronic version of  'The lion sleeps tonight'? ,( SQ ( MD ) ( NP ( PRP ) ) ( VP ( VB ) ( NP ) ) ( . ) ),"{'( S ( VP ( VB ) ( NP ) ) )': 5.0, '( SQ ( MD ) ( NP ( PRP ) ) ( VP ( VB ) ( NP ) ( NP ) ) ( . ) )': 1.0}",True
